Srno,RecipeName,TranslatedRecipeName,Ingredients,TranslatedIngredients,PrepTimeInMins,CookTimeInMins,TotalTimeInMins,Servings,Cuisine,Course,Diet,Instructions,TranslatedInstructions,URL
5727,Kashmiri Style Tamatar Chaman Recipe -Paneer Cooked With Tomatoes,Kashmiri Style Tamatar Chaman Recipe -Paneer Cooked With Tomatoes,"200 grams Paneer (Homemade Cottage Cheese) - cut into big cubes,4 Tomatoes - roughly chopped,1 teaspoon Cumin seeds (Jeera),1 teaspoon Ajwain (Carom seeds),2 teaspoons Kashmiri Red Chilli Powder,1/2 teaspoon Turmeric powder (Haldi),1 teaspoon Fennel Powder,1 teaspoon Dry ginger powder,1 teaspoon Garam masala powder - Kashmiri,2 tablespoons Mustard oil,Salt - to taste","200 grams Paneer (Homemade Cottage Cheese) - cut into big cubes,4 Tomatoes - roughly chopped,1 teaspoon Cumin seeds (Jeera),1 teaspoon Ajwain (Carom seeds),2 teaspoons Kashmiri Red Chilli Powder,1/2 teaspoon Turmeric powder (Haldi),1 teaspoon Fennel Powder,1 teaspoon Dry ginger powder,1 teaspoon Garam masala powder - Kashmiri,2 tablespoons Mustard oil,Salt - to taste",10,20,30,4,Kashmiri,Lunch,High Protein Vegetarian,"To begin making Kashmiri Style Tamatar Chaman Recipe, heat mustard oil in a heavy bottomed pan till it reaches the smoking level, place the paneer cubes and fry until it turns golden. Flip over and brown the other side as well. Once the paneer cubes are nicely fried, immerse them in a bowl of 1 cup warm water mixed with turmeric powder. This will keep the paneer soft.In the same pan, add the cumin seeds and let it splutter. Add the chopped tomatoes and cook until it turns soft and mushy.Mash the tomatoes with the back of the laddle, until they turn nice and pulpy.Add the fennel, dry ginger, kashmiri red chilli powder and mix well.Add in the fried paneer along with the turmeric water and bring it to a brisk boil.Add the kashmiri garam masala, season with salt and let the gravy simmer for 15 minutes, till it all comes together and the oil separates out.Switch off the heat, add in the shahi jeera to the Kashmiri Style Tamatar Chaman, mix well and let it rest for 10 minutes before serving so that the spices get infused into the paneer.Serve the Kashmiri Style Tamatar Chaman Recipe along with Steamed Rice and Haak T Thool for a simplified Kashmiri Cuisine inspired weeknight dinner.
","To begin making Kashmiri Style Tamatar Chaman Recipe, heat mustard oil in a heavy bottomed pan till it reaches the smoking level, place the paneer cubes and fry until it turns golden. Flip over and brown the other side as well. Once the paneer cubes are nicely fried, immerse them in a bowl of 1 cup warm water mixed with turmeric powder. This will keep the paneer soft.In the same pan, add the cumin seeds and let it splutter. Add the chopped tomatoes and cook until it turns soft and mushy.Mash the tomatoes with the back of the laddle, until they turn nice and pulpy.Add the fennel, dry ginger, kashmiri red chilli powder and mix well.Add in the fried paneer along with the turmeric water and bring it to a brisk boil.Add the kashmiri garam masala, season with salt and let the gravy simmer for 15 minutes, till it all comes together and the oil separates out.Switch off the heat, add in the shahi jeera to the Kashmiri Style Tamatar Chaman, mix well and let it rest for 10 minutes before serving so that the spices get infused into the paneer.Serve the Kashmiri Style Tamatar Chaman Recipe along with Steamed Rice and Haak T Thool for a simplified Kashmiri Cuisine inspired weeknight dinner.",http://www.archanaskitchen.com/tamatar-chaaman-recipe-kashmiri-style-paneer-cooked-with-tomatoes
5733,"Summer Salad Recipe-Red Cabbage, Lettuce Onions & Tomatoes ","Summer Salad Recipe-Red Cabbage, Lettuce Onions & Tomatoes ","1/2 cup Red cabbage - shredded,1/2 cup Iceberg lettuce - shredded,1/3 cup Onions - thinly sliced,Salt - to taste,1/3 cup Tomatoes - deseeded and thinly sliced,1 teaspoon Lemon juice,1 teaspoon Honey","1/2 cup Red cabbage - shredded,1/2 cup Iceberg lettuce - shredded,1/3 cup Onions - thinly sliced,Salt - to taste,1/3 cup Tomatoes - deseeded and thinly sliced,1 teaspoon Lemon juice,1 teaspoon Honey",15,0,15,4,Continental,Appetizer,Vegetarian,"To begin making the Minty Summer Salad Recipe With Red Cabbage Lettuce Onions And Tomatoes, cut the vegetables lengthwise and set aside. In a mixing bowl, combine the shredded red cabbage, lettuce, thinly sliced onions and tomatoes and mix well. The salad tastes best when it is served chilled. Chill the vegetables in the refrigerator for 30 minutes. Just before serving season the salad with some salt, honey lemon juice. Toss well and serve. Serve Minty Summer Salad Recipe With Red Cabbage Lettuce Onions And Tomatoes along with Beetroot Gazpacho Soup Recipe and Roasted Vegetable Panini Sandwich With Feta Cheese Recipe for a refreshing summer meal. Finish the with a Strawberry Banana Sorbet Recipe.
","To begin making the Minty Summer Salad Recipe With Red Cabbage Lettuce Onions And Tomatoes, cut the vegetables lengthwise and set aside. In a mixing bowl, combine the shredded red cabbage, lettuce, thinly sliced onions and tomatoes and mix well. The salad tastes best when it is served chilled. Chill the vegetables in the refrigerator for 30 minutes. Just before serving season the salad with some salt, honey lemon juice. Toss well and serve. Serve Minty Summer Salad Recipe With Red Cabbage Lettuce Onions And Tomatoes along with Beetroot Gazpacho Soup Recipe and Roasted Vegetable Panini Sandwich With Feta Cheese Recipe for a refreshing summer meal. Finish the with a Strawberry Banana Sorbet Recipe.
",https://www.archanaskitchen.com/minty-summer-salad-recipe-with-red-cabbage-lettuce-onions-and-tomatoes
5735,Karnataka Style Bonda Soup Recipe-Urad dal Fritters in Spicy Dal Soup,Karnataka Style Bonda Soup Recipe-Urad dal Fritters in Spicy Dal Soup,"1 cup White Urad Dal (Split) - soaked in water for 2 hours,1 Green Chilli - chopped,1 sprig Curry leaves - chopped,1 teaspoon Black pepper powder,1 tablespoon Fresh coconut - grated,1 teaspoon Baking soda,Salt - to taste,1/2 cup Yellow Moong Dal (Split),1 Tomato - chopped,1 inch Ginger - chopped,1 Green Chilli - chopped,1 teaspoon Cumin seeds (Jeera),1 pinch Asafoetida (hing),1 teaspoon Turmeric powder (Haldi),Salt - to taste,Sunflower Oil,Water - as required","1 cup White Urad Dal (Split) - soaked in water for 2 hours,1 Green Chilli - chopped,1 sprig Curry leaves - chopped,1 teaspoon Black pepper powder,1 tablespoon Fresh coconut - grated,1 teaspoon Baking soda,Salt - to taste,1/2 cup Yellow Moong Dal (Split),1 Tomato - chopped,1 inch Ginger - chopped,1 Green Chilli - chopped,1 teaspoon Cumin seeds (Jeera),1 pinch Asafoetida (hing),1 teaspoon Turmeric powder (Haldi),Salt - to taste,Sunflower Oil,Water - as required",150,60,210,4,Karnataka,South Indian Breakfast,Vegetarian,"To begin making the Karnataka Style Bonda Soup Recipe by soaking the urad dal for 2 hours or you can soak it the previous night and make it in the morning and grind them in a mixer with 1/4 cup water to a smooth paste.Now add the reaming ingredients like green chilli, salt, pepper, coconut, curry leaves and soda to it and mix well. Heat a Kuzhi paniyaram Pan and drizzle some oil in each hollow holes.Once it is heated add a tablespoon of the batter in each of the hollow holes and cook on either side till it golden brown for about 10 minutes. Keep them aside.Now pressure cook the moong dal with water, turmeric and salt for about 4 whistle and release the pressure naturally. Open the lid and mash it well to a creamy texture.Heat a sauce pan on a medium heat with some oil, crackle the jeera with hing and then add the ginger, tomato and green chilli. Saute for 2 minutes.Then add in the dal with 1 cup water, make it into a very thin consistency. Add in salt, pepper and coriander leaves. Leave it to boil for 10 minutes and turn it off.Now to serve add in the urad dal bonda in a cup and pour in the soup and serve. Serve the Karnataka Style Bonda Soup Recipe as one pot Breakfast meal in the morning with a cup of Tea.
","To begin making the Karnataka Style Bonda Soup Recipe by soaking the urad dal for 2 hours or you can soak it the previous night and make it in the morning and grind them in a mixer with 1/4 cup water to a smooth paste.Now add the reaming ingredients like green chilli, salt, pepper, coconut, curry leaves and soda to it and mix well. Heat a Kuzhi paniyaram Pan and drizzle some oil in each hollow holes.Once it is heated add a tablespoon of the batter in each of the hollow holes and cook on either side till it golden brown for about 10 minutes. Keep them aside.Now pressure cook the moong dal with water, turmeric and salt for about 4 whistle and release the pressure naturally. Open the lid and mash it well to a creamy texture.Heat a sauce pan on a medium heat with some oil, crackle the jeera with hing and then add the ginger, tomato and green chilli. Saute for 2 minutes.Then add in the dal with 1 cup water, make it into a very thin consistency. Add in salt, pepper and coriander leaves. Leave it to boil for 10 minutes and turn it off.Now to serve add in the urad dal bonda in a cup and pour in the soup and serve. Serve the Karnataka Style Bonda Soup Recipe as one pot Breakfast meal in the morning with a cup of Tea.",https://www.archanaskitchen.com/karnataka-style-bonda-soup-recipe-urad-dal-fritters-in-spicy-dal-soup-recipe
5736,Creamy Spinach & Cheese Bread Toast Recipe,Creamy Spinach & Cheese Bread Toast Recipe,"2 tablespoon Butter,2 Cups Spinach Leaves (Palak) - Finely chopped,1/2 Onion - chopped,4 cloves Garlic - finely chopped,1 1/2 tablespoon Corn flour,1/2 cup Milk,Salt - to taste,Whole Black Peppercorns - crushed,Red Chilli flakes - to taste,2 tablespoon Fresh cream,1/4 cup Cheese - grated,6 Whole Wheat Brown Bread","2 tablespoon Butter,2 Cups Spinach Leaves (Palak) - Finely chopped,1/2 Onion - chopped,4 cloves Garlic - finely chopped,1 1/2 tablespoon Corn flour,1/2 cup Milk,Salt - to taste,Whole Black Peppercorns - crushed,Red Chilli flakes - to taste,2 tablespoon Fresh cream,1/4 cup Cheese - grated,6 Whole Wheat Brown Bread",20,10,30,4,Italian Recipes,World Breakfast,Vegetarian,"To begin making Creamy Spinach & Cheese Bread Toast Recipe, prep all the ingredients in advance. Heat a pan and add butterOnce the pan is hot, add garlic and fry till golden on a low flame.Immediately, add onions and saute for about 2 minutes or till caramelised a bit.While the onion is cooking, saute occasionally on low flame. Also mix milk and corn flour in a small bowl while onion is done.Add spinach leaves and saute till the wilt a bit.To this mix, add milk and corn flour mixture.Keep stirring and Let it cook for 1 minute or till the mixture starts thickening.Add salt, pepper and chilli flakes to taste.Keep stirring it for 30 seconds on medium flame and make sure it does not get burnt.Now add cream and mix it well .Once the mixture is thick and creamy, add two tablespoon cheese and mix it well.Switch off the flame and let the mixture cool down.Preheat oven at 180 degrees celcius.Spread one tablespoon of mixture on bread slice and repeat the process with other slices too.Top it with Cheese (If you don't like too much cheese, you can skip this step as we have already added some cheese in the mixture already.)Put all bread slices on a baking tray and bake them for 8-10 minutes.Serve Creamy Spinach & Cheese Bread Toast Recipe with Peanut Butter Oats & Banana Smoothie.
","To begin making Creamy Spinach & Cheese Bread Toast Recipe, prep all the ingredients in advance. Heat a pan and add butterOnce the pan is hot, add garlic and fry till golden on a low flame.Immediately, add onions and saute for about 2 minutes or till caramelised a bit.While the onion is cooking, saute occasionally on low flame. Also mix milk and corn flour in a small bowl while onion is done.Add spinach leaves and saute till the wilt a bit.To this mix, add milk and corn flour mixture.Keep stirring and Let it cook for 1 minute or till the mixture starts thickening.Add salt, pepper and chilli flakes to taste.Keep stirring it for 30 seconds on medium flame and make sure it does not get burnt.Now add cream and mix it well .Once the mixture is thick and creamy, add two tablespoon cheese and mix it well.Switch off the flame and let the mixture cool down.Preheat oven at 180 degrees celcius.Spread one tablespoon of mixture on bread slice and repeat the process with other slices too.Top it with Cheese (If you don't like too much cheese, you can skip this step as we have already added some cheese in the mixture already.)Put all bread slices on a baking tray and bake them for 8-10 minutes.Serve Creamy Spinach & Cheese Bread Toast Recipe with Peanut Butter Oats & Banana Smoothie.",http://www.archanaskitchen.com/creamy-spinach-cheese-bread-toast-recipe
5737,Homemade Rose Flavoured Ice Cream Cake recipe,Homemade Rose Flavoured Ice Cream Cake recipe,"1 Chocolate Cake,1 cup Vanilla Ice cream,Heavy whipping cream,Rose Essence - few drops,1/2 cup Mixed nuts,Decorative sugar (Cake/ Candy Sprinkles) - as needed,1/8 cup Water,1/4 cup Sugar","1 Chocolate Cake,1 cup Vanilla Ice cream,Heavy whipping cream,Rose Essence - few drops,1/2 cup Mixed nuts,Decorative sugar (Cake/ Candy Sprinkles) - as needed,1/8 cup Water,1/4 cup Sugar",480,60,540,5,Continental,Dessert,Vegetarian,"To prepare Homemade Rose Flavoured Ice Cream Cake recipe, get prepped with all the ingredients required. Chocolate cake and vanilla ice cream needs to be kept ready.Slice off the upper portion of the cake and reserve the bottom half of the cake and proceed with making the sugar syrup.In a saucepan, add in water and then to this, add sugar. Once the sugar dissolves and the syrup starts to get thick switch off the flame (one string consistency). Now pour the sugar syrup on the chocolate cake and leave it for 5 minutes to absorb.Now take the Vanilla Ice Cream (I used my homemade vanilla Ice Cream). Let the ice cream become soft after thawing a bit. Then scoop the ice cream on top of the chocolate cake and spread it evenly with a spatula. Freeze it for 2-3 hours until it is well set.In a mixing bowl, take the full fat cream. Beat it in high speed using a hand blended until it forms soft peaks. Next add in the rose essence and beat once again till it is well combined.Now take the cake from freezer and scoop the cream over the cake, spread it evenly with a spatula.Once the cream is spread. Sprinkle with sugar balls and nuts throughout the cake. Cling wrap the cake.Freeze the Homemade Rose Flavoured Ice Cream Cake overnight or about 8 hours Remove it from the fridge after that, remove the cling wrap.Demould, slice Homemade Rose Flavoured Ice Cream Cake recipe and serve.
","To prepare Homemade Rose Flavoured Ice Cream Cake recipe, get prepped with all the ingredients required. Chocolate cake and vanilla ice cream needs to be kept ready.Slice off the upper portion of the cake and reserve the bottom half of the cake and proceed with making the sugar syrup.In a saucepan, add in water and then to this, add sugar. Once the sugar dissolves and the syrup starts to get thick switch off the flame (one string consistency). Now pour the sugar syrup on the chocolate cake and leave it for 5 minutes to absorb.Now take the Vanilla Ice Cream (I used my homemade vanilla Ice Cream). Let the ice cream become soft after thawing a bit. Then scoop the ice cream on top of the chocolate cake and spread it evenly with a spatula. Freeze it for 2-3 hours until it is well set.In a mixing bowl, take the full fat cream. Beat it in high speed using a hand blended until it forms soft peaks. Next add in the rose essence and beat once again till it is well combined.Now take the cake from freezer and scoop the cream over the cake, spread it evenly with a spatula.Once the cream is spread. Sprinkle with sugar balls and nuts throughout the cake. Cling wrap the cake.Freeze the Homemade Rose Flavoured Ice Cream Cake overnight or about 8 hours Remove it from the fridge after that, remove the cling wrap.Demould, slice Homemade Rose Flavoured Ice Cream Cake recipe and serve.",http://www.archanaskitchen.com/homemade-rose-flavoured-ice-cream-cake-recipe
5739,Rava Fried Prawns Recipe,Rava Fried Prawns Recipe,"20 Prawns,1 teaspoon Turmeric powder (Haldi),1 tablespoon Red Chilli powder,Salt - to taste,1/2 cup Sooji (Semolina/ Rava),1/4 cup Rice flour,1/4 teaspoon Turmeric powder (Haldi),1/4 teaspoon Red Chilli powder,Salt - a pinch,4 tablespoons Sunflower Oil","20 Prawns,1 teaspoon Turmeric powder (Haldi),1 tablespoon Red Chilli powder,Salt - to taste,1/2 cup Sooji (Semolina/ Rava),1/4 cup Rice flour,1/4 teaspoon Turmeric powder (Haldi),1/4 teaspoon Red Chilli powder,Salt - a pinch,4 tablespoons Sunflower Oil",10,20,30,4,Goan Recipes,Lunch,Non Vegeterian,"To begin making the Rava Fried Prawns Recipe, de-shell the prawns, remove the vein and wash properly.Marinate the prawns for 30 minutes with  salt, turmeric powder and chili powder.Take a plate and add the rice flour, rawa, pinch of salt, 1/4 teaspoon of turmeric powder and chili powder. Mix well to combine.Coat the marinated prawns in the rava and rice flour mix. Ensure that it is fully coated.Heat a pan and spread 1 tablespoon oil. Add more if required.Place the rava coated prawns on the pan and fry on low flame. After 10 minutes turn them to the other side.Fry them for 20 minutes.You know they are done when they turn golden brown on the outside.Always fry prawns on low heat and do not cover it while frying. Once done transfer the Rava Fried Prawns onto a serving plate and serve.Serve Rava Fried Prawns Recipe with Goan Bimbla Uddamethi Recipe and Steamed Rice Recipe for a perfect Goan meal.
","To begin making the Rava Fried Prawns Recipe, de-shell the prawns, remove the vein and wash properly.Marinate the prawns for 30 minutes with  salt, turmeric powder and chili powder.Take a plate and add the rice flour, rawa, pinch of salt, 1/4 teaspoon of turmeric powder and chili powder. Mix well to combine.Coat the marinated prawns in the rava and rice flour mix. Ensure that it is fully coated.Heat a pan and spread 1 tablespoon oil. Add more if required.Place the rava coated prawns on the pan and fry on low flame. After 10 minutes turn them to the other side.Fry them for 20 minutes.You know they are done when they turn golden brown on the outside.Always fry prawns on low heat and do not cover it while frying. Once done transfer the Rava Fried Prawns onto a serving plate and serve.Serve Rava Fried Prawns Recipe with Goan Bimbla Uddamethi Recipe and Steamed Rice Recipe for a perfect Goan meal.
",http://www.archanaskitchen.com/rava-fried-prawns-recipe
5741,Konkani Style Vaingana Kaap Recipe - Shallow Fried Eggplant With Semolina,Konkani Style Vaingana Kaap Recipe - Shallow Fried Eggplant With Semolina,"500 grams Brinjal (Baingan / Eggplant) - cut into thick slices,1 tablespoon Red Chilli powder,1/2 teaspoon Turmeric powder (Haldi),1/2 teaspoon Tamarind Paste,1/2 cup Sooji (Semolina/ Rava),Salt - to taste,Sunflower Oil - for shallow frying","500 grams Brinjal (Baingan / Eggplant) - cut into thick slices,1 tablespoon Red Chilli powder,1/2 teaspoon Turmeric powder (Haldi),1/2 teaspoon Tamarind Paste,1/2 cup Sooji (Semolina/ Rava),Salt - to taste,Sunflower Oil - for shallow frying",10,20,30,4,Konkan,Side Dish,Vegetarian,"To begin making the Vaingana Kaap Recipe, cut the eggplants into thick slices. In a bowl, mix the red chilli powder, turmeric powder, salt and tamarind pulp.Add the eggplant slices to the bowl and apply the mix evenly on both the sides of the eggplant slices.Leave it to marinate for 5 minutes, the excess water will also ooze out of the eggplants. Now, coat each eggplant slice with the semolina on both sides and keep aside.To roast the eggplant, heat a skillet, brush it with little oil, place a few eggplant slices and let it cook and roast on one side for 5 minutes.Brush a little oil on top, flip over and cook the other side of the eggplant slices for another 5 minutes until it is well cooked and roasted.Likewise, cook the rest of the eggplant slices. Enjoy the Vaingana Kaap Recipe along with Steamed Rice and Konkani Style Southe Koddel for a simple yet delicious weekday lunch.
","To begin making the Vaingana Kaap Recipe, cut the eggplants into thick slices. In a bowl, mix the red chilli powder, turmeric powder, salt and tamarind pulp.Add the eggplant slices to the bowl and apply the mix evenly on both the sides of the eggplant slices.Leave it to marinate for 5 minutes, the excess water will also ooze out of the eggplants. Now, coat each eggplant slice with the semolina on both sides and keep aside.To roast the eggplant, heat a skillet, brush it with little oil, place a few eggplant slices and let it cook and roast on one side for 5 minutes.Brush a little oil on top, flip over and cook the other side of the eggplant slices for another 5 minutes until it is well cooked and roasted.Likewise, cook the rest of the eggplant slices. Enjoy the Vaingana Kaap Recipe along with Steamed Rice and Konkani Style Southe Koddel for a simple yet delicious weekday lunch.
",http://www.archanaskitchen.com/vaingana-kaap-recipe-shallow-fried-eggplant-with-semolina
