Srno,RecipeName,TranslatedRecipeName,Ingredients,TranslatedIngredients,PrepTimeInMins,CookTimeInMins,TotalTimeInMins,Servings,Cuisine,Course,Diet,Instructions,TranslatedInstructions,URL
4641,आलू पोहा रेसिपी - Savory Flattened Rice & Potato Breakfast (Recipe In Hindi), Savory Flattened Rice & Potato Breakfast (Recipe In Hindi),"1-1/2 कप पोहा,2 आलू - उबले,1/4 कप हरा मटर - भाप ले,1/2 छोटा चमच्च राइ,1/2 छोटा चमच्च जीरा,6 कढ़ी पत्ता - बारीक काट ले,1 प्याज - बारीक काट ले,2 हरी मिर्च - काट ले,1 छोटा चमच्च अदरक - बारीक कस ले,1/2 छोटा चमच्च हल्दी पाउडर,1/4 छोटा चमच्च हींग,2 छोटा चमच्च शक्कर,1 निम्बू - रस,1 बड़ा चमच्च मूंगफली,2 बड़े चमच्च तेल,2 बड़े चमच्च हरा धनिया - बारीक काट ले,3/4 कप अनार - गार्निश के लिए,नमक - स्वाद अनुसार,1/2 कप स्वीट कॉर्न - भाप ले,1/2 कप अंकुरित दाल  - मूंग","1-1/2 कप पोहा,2 आलू - उबले,1/4 कप हरा मटर - भाप ले,1/2 छोटा चमच्च राइ,1/2 छोटा चमच्च जीरा,6 कढ़ी पत्ता - बारीक काट ले,1 प्याज - बारीक काट ले,2 हरी मिर्च - काट ले,1 छोटा चमच्च अदरक - बारीक कस ले,1/2 छोटा चमच्च हल्दी पाउडर,1/4 छोटा चमच्च हींग,2 छोटा चमच्च शक्कर,1 निम्बू - रस,1 बड़ा चमच्च मूंगफली,2 बड़े चमच्च तेल,2 बड़े चमच्च हरा धनिया - बारीक काट ले,3/4 कप अनार - गार्निश के लिए,नमक - स्वाद अनुसार,1/2 कप स्वीट कॉर्न - भाप ले,1/2 कप अंकुरित दाल  - मूंग",20,30,50,4,Indian,Indian Breakfast,Vegetarian,"आलू पोहा बनाने के लिए सबसे पहले फे को ठन्डे पानी के निचे धो ले और उसमे से पानी निकाल ले. धोए हुए पोहे को एक बाउल में डाले। इसमें नमक, हल्दी पाउडर, शक्कर और हींग डाले। मिला ले और अलग से रख दे. अब एक कढ़ाई में तेल गरम करें। इसमें राइ, जीरा डाले और 10 सेकण्ड्स तक पकने दे. 10 सेकण्ड्स के बाद इसमें प्याज, कढ़ी पत्ता, अदरक, हरी मिर्च डाले और प्याज के नरम होने तक पकाए. नरम होने के बाद इसमें आलू डाले और 2 मिनट तक पकने दे. 2 मिनट के बाद पोहा डाले। थोड़ा पानी छिड़के और सबको अच्छी तरह से मिला ले. आंच को धीमा करें, कढ़ाई को ढके और 4 से 5 मिनट के लिए पकने दे. 5 मिनट के बाद गैस बंद करें और इसमें निम्बू, भापे हुए मटर, सकी हुई मूंगफली और हरा धनिया डाले। मिलाए और 1 मिनट के लिए अलग से रह दे. 1 मिनट बाद स पर अनार के दाने डाले और गरमा गरम परोसे। आलू पोहा को सुबह के नाश्ते के लिए फ़िल्टर कॉफी और फलो के साथ परोसे।
","To make Aloo Poha, first wash the Fe under cold water and drain the water from it. Transfer the washed pohe to a bowl. Add salt, turmeric powder, sugar and asafoetida to it. Mix and keep aside. Now heat oil in a pan. Add the mustard seeds, cumin seeds and let it cook for 10 seconds. After 10 seconds, add onion, curry leaves, ginger, green chillies and cook till the onion becomes soft. After it becomes soft, add potatoes and let it cook for 2 minutes. Add poha after 2 minutes. Sprinkle some water and mix well. Reduce the flame, cover the pan and let it cook for 4 to 5 minutes. Turn off the gas after 5 minutes and add lemon, steamed peas, cooked peanuts and green coriander. Mix and keep aside for 1 minute. After 1 minute, add pomegranate seeds and serve hot. Serve Aloo Poha with filter coffee and fruits for breakfast.",https://www.archanaskitchen.com/savory-flattened-rice-potato-breakfast-recipe-in-hindi
4642,पुदीना धनिया पुलाव रेसिपी - Mint Coriander Spice Pulao Recipe, Mint Coriander Spice Pulao Recipe,"1-1/2 कप चावल - धो कर सूखा ले,1/3 कप हरा धनिया - बारीक काट ले,1 बड़े चम्मच घी,1/3 कप पुदीना - बारीक काट ले,1 स्टार अनीस,1/2 छोटा चम्मच सौंफ,2 तेज पत्ता,1 इंच दालचीनी","1-1/2 कप चावल - धो कर सूखा ले,1/3 कप हरा धनिया - बारीक काट ले,1 बड़े चम्मच घी,1/3 कप पुदीना - बारीक काट ले,1 स्टार अनीस,1/2 छोटा चम्मच सौंफ,2 तेज पत्ता,1 इंच दालचीनी",5,20,25,4,Indian,Main Course,Vegetarian,"पुदीना धनिया पुलाव रेसिपी बनाने के लिए सबसे पहले एक प्रेशर कुकर में घी गरम करें। इसमें स्टार अनीस, सौंफ, तेज पत्ता, दालचीनी डाले और 15 सेकण्ड्स के लिए पका ले.15 सेकण्ड्स के बाद इसमें धनिया पुदीना के पत्ते डाले और मिला ले.अब इसमें चावल, 3 कप पानी, नमक डाले और प्रेशर कुकर को बंद कर ले. 2 से 3 सिटी आने तक पका ले और गैस बंद कर दे. प्रेशर अपने आप निकलने दे और कुकर खोल ले.कुकर खोलने के बाद, चावल को मिला ले और एक बाउल में डाल दे. पुदीना धनिया पुलाव रेसिपी को दाल मखनी, पनीर बटर मसाला और फुल्के के साथ दिन के खाने के लिए परोसे।
","To make Pudina Coriander Casserole Recipe, first heat ghee in a pressure cooker. Add star anise, fennel, bay leaves, cinnamon and cook for 15 seconds. After 15 seconds, add coriander mint leaves and mix it. Now add rice, 3 cups of water, salt and close the pressure cooker. . Cook till 2 to 3 cities come and turn off the gas. Allow the pressure to drain and open the cooker. After opening the cooker, mix the rice and put it in a bowl. Serve Pudina Coriander Pulao Recipe along with Dal Makhni, Paneer Butter Masala and Phulka for dinner.",http://www.archanaskitchen.com/mint-coriander-spice-pulao-recipe-in-hindi
4643,Paneer Malai Makhani Biryani Recipe,Paneer Malai Makhani Biryani Recipe,"1 cup Basmati rice,4 teaspoon Ghee,2 teaspoon Ginger Garlic Paste,2 Onion - sliced,2 teaspoon Biryani Masala,3 teaspoon Lemon juice,Salt - to taste,200 gram Paneer (Homemade Cottage Cheese) - cubed,1 teaspoon Turmeric powder (Haldi),1 teaspoon Red Chilli powder,2 teaspoon Homemade tomato puree,4 teaspoon Hung Curd (Greek Yogurt),1 teaspoon Lemon juice,1/2 teaspoon Ginger Garlic Paste,2 teaspoon Sunflower Oil,Salt - to taste","1 cup Basmati rice,4 teaspoon Ghee,2 teaspoon Ginger Garlic Paste,2 Onion - sliced,2 teaspoon Biryani Masala,3 teaspoon Lemon juice,Salt - to taste,200 gram Paneer (Homemade Cottage Cheese) - cubed,1 teaspoon Turmeric powder (Haldi),1 teaspoon Red Chilli powder,2 teaspoon Homemade tomato puree,4 teaspoon Hung Curd (Greek Yogurt),1 teaspoon Lemon juice,1/2 teaspoon Ginger Garlic Paste,2 teaspoon Sunflower Oil,Salt - to taste",30,40,70,4,Indian,Dinner,High Protein Vegetarian,"To begin making the Paneer Malai Makhani Biryani recipe, the first step is to wash the rice and soak for 10 minutes.Heat a heavy bottomed pot with enough boiling water and add rice for cooking. Strain the rice just before the grain is fully cooked.Spread on a platter and cool it.Cut the paneer in barfi shape. Take a wide glass bowl and mix together red chilli powder, turmeric powder, tomato puree, curd, lime juice and salt. Add the paneer to the mix and coat well. Leave it for 5 minutesHeat a frying pan with oil and fry the marinated paneer for 5 to 8 minutes. Cook till paneer turn brown from both the sides. Remove the cubes from the pan and keep it aside. Sprinkle lime juice and salt on rice then carefully run the fork through the rice to mix it up without breaking the grains.Heat a big wok with ghee on low flame, add onion and fry till golden brownish and remove.In the same wok, add the rice, 3/4 fried onions and the biryani masala. Cook for about a minute or two. Now, to layer the biryani, add the rice in a platter, then put the paneer mixture on it and garnish it with the remaining fried onions.Serve Paneer Malai Makhani Biryani along with Boondi Raita and Kachumber Salad for a weekday dinner.
","To begin making the Paneer Malai Makhani Biryani recipe, the first step is to wash the rice and soak for 10 minutes.Heat a heavy bottomed pot with enough boiling water and add rice for cooking. Strain the rice just before the grain is fully cooked.Spread on a platter and cool it.Cut the paneer in barfi shape. Take a wide glass bowl and mix together red chilli powder, turmeric powder, tomato puree, curd, lime juice and salt. Add the paneer to the mix and coat well. Leave it for 5 minutesHeat a frying pan with oil and fry the marinated paneer for 5 to 8 minutes. Cook till paneer turn brown from both the sides. Remove the cubes from the pan and keep it aside. Sprinkle lime juice and salt on rice then carefully run the fork through the rice to mix it up without breaking the grains.Heat a big wok with ghee on low flame, add onion and fry till golden brownish and remove.In the same wok, add the rice, 3/4 fried onions and the biryani masala. Cook for about a minute or two. Now, to layer the biryani, add the rice in a platter, then put the paneer mixture on it and garnish it with the remaining fried onions.Serve Paneer Malai Makhani Biryani along with Boondi Raita and Kachumber Salad for a weekday dinner.",https://www.archanaskitchen.com/paneer-malai-makhani-biryani-recipe
4644,Raw Mango Carrot Cucumber Salad Recipe With Peanuts,Raw Mango Carrot Cucumber Salad Recipe With Peanuts,"1/2 cup Mango (Raw) - finely chopped,1/2 cup Carrot (Gajjar) - finely chopped,1/2 cup Cucumber - finely chopped,1/3 cup Tomatoes - deseeded and finely chopped,1/3 cup Roasted Peanuts (Moongphali),2 tablespoons Coriander (Dhania) Leaves - finely chopped,2 tablespoons Mint Leaves (Pudina) - finely chopped,Salt - to taste,1/2 teaspoon Black pepper powder,1/2 teaspoon Chaat Masala Powder,1/2 teaspoon Cumin powder (Jeera)","1/2 cup Mango (Raw) - finely chopped,1/2 cup Carrot (Gajjar) - finely chopped,1/2 cup Cucumber - finely chopped,1/3 cup Tomatoes - deseeded and finely chopped,1/3 cup Roasted Peanuts (Moongphali),2 tablespoons Coriander (Dhania) Leaves - finely chopped,2 tablespoons Mint Leaves (Pudina) - finely chopped,Salt - to taste,1/2 teaspoon Black pepper powder,1/2 teaspoon Chaat Masala Powder,1/2 teaspoon Cumin powder (Jeera)",15,0,15,4,Indian,Appetizer,Vegan,"To begin making the Raw Mango Carrot Cucumber Salad Recipe With Peanuts, prep all the ingredients and keep them ready.In a mixing bowl, combine the raw mango, carrots, cucumber, tomatoes, roasted peanuts, coriander leaves, mint leaves and give it a good mix. Into this bowl, add the salt, pepper, chaat masala, cumin powder and toss the salad. Give it a taste and adjust the seasonings accordingly.Once done, transfer the Raw Mango Carrot Cucumber Salad Recipe With Peanuts to a serving bowl and serve chilled.Serve Raw Mango Carrot Cucumber Salad Recipe With Peanuts along with Nawabi Paneer Curry Recipe, Cheese Garlic Naan Recipe and Papad Raita Recipe to make a delicious north Indian dinner or lunch. 
","To begin making the Raw Mango Carrot Cucumber Salad Recipe With Peanuts, prep all the ingredients and keep them ready.In a mixing bowl, combine the raw mango, carrots, cucumber, tomatoes, roasted peanuts, coriander leaves, mint leaves and give it a good mix. Into this bowl, add the salt, pepper, chaat masala, cumin powder and toss the salad. Give it a taste and adjust the seasonings accordingly.Once done, transfer the Raw Mango Carrot Cucumber Salad Recipe With Peanuts to a serving bowl and serve chilled.Serve Raw Mango Carrot Cucumber Salad Recipe With Peanuts along with Nawabi Paneer Curry Recipe, Cheese Garlic Naan Recipe and Papad Raita Recipe to make a delicious north Indian dinner or lunch. ",https://www.archanaskitchen.com/raw-mango-carrot-cucumber-tomato-peanut-indian-salad-recipe
4646,Dried Cranberry & White Chocolate Chip Biscotti Recipe,Dried Cranberry & White Chocolate Chip Biscotti Recipe,"1 cup All Purpose Flour (Maida),3/4 teaspoon Baking powder,1/4 cup Butter (unsalted) - at room temperature,1/4 cup Caster Sugar,1 Whole Eggs,1 teaspoon Vanilla Extract,1/4 cup Cranberries,1/4 cup White Chocolate - chopped","1 cup All Purpose Flour (Maida),3/4 teaspoon Baking powder,1/4 cup Butter (unsalted) - at room temperature,1/4 cup Caster Sugar,1 Whole Eggs,1 teaspoon Vanilla Extract,1/4 cup Cranberries,1/4 cup White Chocolate - chopped",20,60,80,4,Continental,Snack,Vegetarian,"Start making this Dried cranberry and white chocolate chip biscotti by preheating the convection oven to 180 degree Celsius.Meanwhile, line a cookie sheet with parchment paper or grease well.Sift or whisk together the flour, baking powder, and salt. Keep aside.With an electric mixer or hand whisk, beat together the butter and sugar until light and fluffy.Add the vanilla and beat until mixed well.Add the egg and beat until incorporated.Add the flour mixture and beat until soft dough forms.Fold in the dried cranberries and chocolate chips at this stage.Shape into a log of a centimeter and more in thickness, approximately 20 x 4 cms in size.Bake in the preheated oven for 20-25 minutes until firm to touch.Remove from oven and when cool enough to handle, slice using a serrated knife into slices of about 1.5 cm thickness.Place cut side up on your lined baking sheet and bake again at the same temperature for about 18-20 minutes. They will be hardened by now.Cool completely on sheet and store Dried Cranberry & White Chocolate Chip Biscotti Recipe immediately in an airtight container until required.
","Start making this Dried cranberry and white chocolate chip biscotti by preheating the convection oven to 180 degree Celsius.Meanwhile, line a cookie sheet with parchment paper or grease well.Sift or whisk together the flour, baking powder, and salt. Keep aside.With an electric mixer or hand whisk, beat together the butter and sugar until light and fluffy.Add the vanilla and beat until mixed well.Add the egg and beat until incorporated.Add the flour mixture and beat until soft dough forms.Fold in the dried cranberries and chocolate chips at this stage.Shape into a log of a centimeter and more in thickness, approximately 20 x 4 cms in size.Bake in the preheated oven for 20-25 minutes until firm to touch.Remove from oven and when cool enough to handle, slice using a serrated knife into slices of about 1.5 cm thickness.Place cut side up on your lined baking sheet and bake again at the same temperature for about 18-20 minutes. They will be hardened by now.Cool completely on sheet and store Dried Cranberry & White Chocolate Chip Biscotti Recipe immediately in an airtight container until required.",http://www.archanaskitchen.com/dried-cranberry-white-chocolate-chip-biscotti-recipe
4648,Andhra Style Sorakaya Kura Recipe - Bottle Gourd And Toor Dal Recipe,Andhra Style Sorakaya Kura Recipe - Bottle Gourd And Toor Dal Recipe,"2 cups Bottle gourd (lauki) - cut into small pieces,1 cup Arhar dal (Split Toor Dal) - soaked for 30 minutes,1 teaspoon Mustard seeds,1 sprig Curry leaves,1 pinch Asafoetida (hing),1 teaspoon Cumin seeds (Jeera),2 Tomatoes - chopped,2 Green Chilli - chopped,1 teaspoon Black pepper powder,1/2 teaspoon Turmeric powder (Haldi),1/2 teaspoon Red Chilli powder","2 cups Bottle gourd (lauki) - cut into small pieces,1 cup Arhar dal (Split Toor Dal) - soaked for 30 minutes,1 teaspoon Mustard seeds,1 sprig Curry leaves,1 pinch Asafoetida (hing),1 teaspoon Cumin seeds (Jeera),2 Tomatoes - chopped,2 Green Chilli - chopped,1 teaspoon Black pepper powder,1/2 teaspoon Turmeric powder (Haldi),1/2 teaspoon Red Chilli powder",10,25,35,4,Andhra,Lunch,Vegetarian,"To begin making the Sorakaya Kura Recipe we will keep a pressure cooker on medium heat, add oil and leave it get hot. Add mustard seeds and cumin seeds and allow it splutter for 10 seconds.Add curry leaves, hing, and leave the curry leaves to crackle for 10 seconds. Add in the chopped tomatoes and saute well till it becomes mushy.Add the turmeric powder, red chilli powder, pepper powder, salt, green chilli, chopped bottle gourd and soaked toor dal. Give the ingredients a stir and add 2 cups of water. Cook it for 4 whistle.Allow the pressure to release by itself and open the lid, give it a stir and check for salt and serve.Serve the Sorakaya Kura Recipe along with Tawa Paratha ,or Phulka along with a Carrot And Beans Thoran to go along with your meal. 
","To begin making the Sorakaya Kura Recipe we will keep a pressure cooker on medium heat, add oil and leave it get hot. Add mustard seeds and cumin seeds and allow it splutter for 10 seconds.Add curry leaves, hing, and leave the curry leaves to crackle for 10 seconds. Add in the chopped tomatoes and saute well till it becomes mushy.Add the turmeric powder, red chilli powder, pepper powder, salt, green chilli, chopped bottle gourd and soaked toor dal. Give the ingredients a stir and add 2 cups of water. Cook it for 4 whistle.Allow the pressure to release by itself and open the lid, give it a stir and check for salt and serve.Serve the Sorakaya Kura Recipe along with Tawa Paratha ,or Phulka along with a Carrot And Beans Thoran to go along with your meal. ",http://www.archanaskitchen.com/andhra-style-sorakaya-kura-recipe-bottle-gourd-and-toor-dal-recipe
4649,Delhi Style Matar Chaat Recipe - Spicy & Tangy Green Peas Chaat,Delhi Style Matar Chaat Recipe - Spicy & Tangy Green Peas Chaat,"1 cup Dried Green Peas (Vatana) - soaked for 1 hour,1 inch Ginger - finely chopped,1 teaspoon Red Chilli powder,1/2 cup Tomatoes - Chopped,1/2 teaspoon Cumin powder (Jeera),1 teaspoon Amchur (Dry Mango Powder),1/2 teaspoon Turmeric powder (Haldi),1 teaspoon Fennel seeds (Saunf),1/2 inch Cinnamon Stick (Dalchini),2 Bay leaves (tej patta),Salt - to taste,Lemon - extract from lemon,1 Onion - finely chopped,2 inch Ginger - cut into thin strips,1 Green Chilli - finely chopped,2 sprig Coriander (Dhania) Leaves - finely chopped,2 sprig Coriander (Dhania) Leaves - finely chopped","1 cup Dried Green Peas (Vatana) - soaked for 1 hour,1 inch Ginger - finely chopped,1 teaspoon Red Chilli powder,1/2 cup Tomatoes - Chopped,1/2 teaspoon Cumin powder (Jeera),1 teaspoon Amchur (Dry Mango Powder),1/2 teaspoon Turmeric powder (Haldi),1 teaspoon Fennel seeds (Saunf),1/2 inch Cinnamon Stick (Dalchini),2 Bay leaves (tej patta),Salt - to taste,Lemon - extract from lemon,1 Onion - finely chopped,2 inch Ginger - cut into thin strips,1 Green Chilli - finely chopped,2 sprig Coriander (Dhania) Leaves - finely chopped,2 sprig Coriander (Dhania) Leaves - finely chopped",500,45,545,4,North Indian Recipes,Snack,Vegetarian,"We begin making the Delhi Style Matar Chaat Recipe by soaking the dried green peas / matar for at least 5 to 6 hours or overnight hour and keep it aside.Heat a pressure cooker with oil, add bay leaf, cinnamon stick and fennel seeds. Saute till the aroma comes out.Then add the ginger and sauté for few seconds. Add tomatoes, cook till it is softened.Finally add the rest of the spice powders and give the masala for the chaat a stir. Cook till the raw smell goes away. This will take about 3 to 4 minutes.At this stage add the soaked dried green peas and give it a stir. Add 2 cups of water and pressure cook it for 4 to 5 whistles or for at least 20 to 25 minutes and turn off the heat. Once done, release the pressure naturally, as the Matar Chaat will continue to cook while there is pressure.Check the taste, add the lemon juice  and give it a stir. Transfer the Delhi Style Matar Chaat Recipe to small serving bowls.Sprinkle onions, ginger, green chilies, drizzle the mint chutney and top it up with chopped coriander leaves and serve hot.Serve the Delhi Style Matar Chaat Recipe as it is or along with Baked Amritsari Kulcha or Puri with a glass of Rose Lassi Recipe to enjoy your Lunch meal.
","We begin making the Delhi Style Matar Chaat Recipe by soaking the dried green peas / matar for at least 5 to 6 hours or overnight hour and keep it aside.Heat a pressure cooker with oil, add bay leaf, cinnamon stick and fennel seeds. Saute till the aroma comes out.Then add the ginger and sauté for few seconds. Add tomatoes, cook till it is softened.Finally add the rest of the spice powders and give the masala for the chaat a stir. Cook till the raw smell goes away. This will take about 3 to 4 minutes.At this stage add the soaked dried green peas and give it a stir. Add 2 cups of water and pressure cook it for 4 to 5 whistles or for at least 20 to 25 minutes and turn off the heat. Once done, release the pressure naturally, as the Matar Chaat will continue to cook while there is pressure.Check the taste, add the lemon juice  and give it a stir. Transfer the Delhi Style Matar Chaat Recipe to small serving bowls.Sprinkle onions, ginger, green chilies, drizzle the mint chutney and top it up with chopped coriander leaves and serve hot.Serve the Delhi Style Matar Chaat Recipe as it is or along with Baked Amritsari Kulcha or Puri with a glass of Rose Lassi Recipe to enjoy your Lunch meal.",http://www.archanaskitchen.com/delhi-style-matar-chaat-matra-recipe-spicy-tangy-dry-green-peas-curry-curry-recipe
