Srno,RecipeName,TranslatedRecipeName,Ingredients,TranslatedIngredients,PrepTimeInMins,CookTimeInMins,TotalTimeInMins,Servings,Cuisine,Course,Diet,Instructions,TranslatedInstructions,URL
4566,Red Wine Sauce Over Baked Sol Fish Recipe,Red Wine Sauce Over Baked Sole Fish Recipe,"1 lb Fish fillet - (sol fish),3 cloves Garlic - grated,3 Tablespoons Onions - finely chopped,1 Tablespoon Butter,Salt - to taste,2 cloves Garlic - grated,1 teaspoon Black pepper powder,1 teaspoon Salt,3/4 Cup Water,1/4 Cup Red wine - (or any cooked wine),1 Sprig Fresh Thyme leaves,1 teaspoon Black pepper powder,1-1/2 Tablespoons All Purpose Flour (Maida),Salt - to taste","1 lb Fish fillet - (sol fish),3 cloves Garlic - grated,3 Tablespoons Onions - finely chopped,1 Tablespoon Butter,Salt - to taste,2 cloves Garlic - grated,1 teaspoon Black pepper powder,1 teaspoon Salt,3/4 Cup Water,1/4 Cup Red wine - (or any cooked wine),1 Sprig Fresh Thyme leaves,1 teaspoon Black pepper powder,1-1/2 Tablespoons All Purpose Flour (Maida),Salt - to taste",20,20,40,2,Continental,Dinner,High Protein Non Vegetarian,"To begin making Red Wine Sauce Over Baked Sol Fish Recipe, wash fillet 3-4 times and pat them dry.In a large mixing bowl, marinate fillets with the marination ingredients mentioned. Keep aside for 20 minutes.Preheat oven at 350 degree Fahrenheit.Meanwhile in a bowl, mix in all the ingredients for red wine sauce. Whisk well so that there are no lumps of flour in it.Heat a skillet and add butter. Once butter melts, add onions and grated garlic. Fry on medium heat till the onions get translucent.Add the sauce mixture and mix on medium heat.Once the sauce comes to boil, reduce the heat and simmer till the sauce thickens. Stir in between.Once the sauce is nice and thick, remove from the heat.Line up baking tray with silver foil/parchment paper and brush it with some oil.Place Marinated fillet and bake for about 20 minutes.Check if the fish is baked well, using a toothpick.Remove and place the baked fish on serving plate and drizzle over the prepared sauce and serve with sliced onions and more thyme leaf sprigs.Serve Red Wine Sauce Over Baked Sol Fish Recipe as an inclusion in your weekend dinner with family, along with Fresh Garden Salad Recipe and along with Red Wine Sangria Cocktail Recipe.
","To begin making Red Wine Sauce Over Baked Sol Fish Recipe, wash fillet 3-4 times and pat them dry.In a large mixing bowl, marinate fillets with the marination ingredients mentioned. Keep aside for 20 minutes.Preheat oven at 350 degree Fahrenheit.Meanwhile in a bowl, mix in all the ingredients for red wine sauce. Whisk well so that there are no lumps of flour in it.Heat a skillet and add butter. Once butter melts, add onions and grated garlic. Fry on medium heat till the onions get translucent.Add the sauce mixture and mix on medium heat.Once the sauce comes to boil, reduce the heat and simmer till the sauce thickens. Stir in between.Once the sauce is nice and thick, remove from the heat.Line up baking tray with silver foil/parchment paper and brush it with some oil.Place Marinated fillet and bake for about 20 minutes.Check if the fish is baked well, using a toothpick.Remove and place the baked fish on serving plate and drizzle over the prepared sauce and serve with sliced onions and more thyme leaf sprigs.Serve Red Wine Sauce Over Baked Sol Fish Recipe as an inclusion in your weekend dinner with family, along with Fresh Garden Salad Recipe and along with Red Wine Sangria Cocktail Recipe.",http://www.archanaskitchen.com/red-wine-sauce-over-baked-sol-fish-recipe
4567,Lemongrass Flavored Tofu Fried Rice Recipe,Lemongrass Flavored Tofu Fried Rice Recipe,"1 cup Basmati rice,1 cup Coconut milk,2 Stalks Lemon Grass,1 inch Ginger - crushed,1/2 teaspoon Turmeric powder (Haldi),Salt - to taste,4 cloves Garlic - chopped,1 inch Ginger - chopped,1 Onion - chopped,1 Red Bell pepper (Capsicum) - chopped,1 Green Chilli - chopped,1/2 cup Spring Onion Greens - chopped,2 tablespoon Soy sauce,1 tablespoon Green Chilli Sauce,1 teaspoon Black pepper powder,Salt - to taste,Sunflower Oil","1 cup Basmati rice,1 cup Coconut milk,2 Stalks Lemon Grass,1 inch Ginger - crushed,1/2 teaspoon Turmeric powder (Haldi),Salt - to taste,4 cloves Garlic - chopped,1 inch Ginger - chopped,1 Onion - chopped,1 Red Bell pepper (Capsicum) - chopped,1 Green Chilli - chopped,1/2 cup Spring Onion Greens - chopped,2 tablespoon Soy sauce,1 tablespoon Green Chilli Sauce,1 teaspoon Black pepper powder,Salt - to taste,Sunflower Oil",10,30,40,4,Asian,Lunch,Vegetarian,"To begin making the Lemon Grass Flavored Tofu Fried Rice Recipe, cook the basmati rice in a pressure cooker by adding coconut milk and 1/2 a cup of water, chopped lemongrass, crushed ginger and turmeric powder.Pressure cook for about 2 whistle and switch off the heat. Allow the pressure to release naturally and rest it aside for some time.Take out the lemon grass and crushed ginger from the pressure cooked rice and mix the rice well with a fork.Heat a wok with some oil, add ginger and garlic that are chopped and saute till they soften.Add chopped onions and saute till they turn translucent. Once that is done you can add chopped bell peppers as well.Sprinkle some salt, chopped green chillies and saute till the bell peppers soften. Add cubed tofu pieces, pepper powder, soy sauce and green chilli sauce and give it a toss.Add the flavored lemon grass rice and toss well into the sautéed vegetables. Check for salt and finally add chopped spring onions and serve warm.Serve the Lemongrass Flavored Tofu Fried Rice Recipe along with Gobi Manchurian Recipe and Spring Rolls Recipe to make it a complete meal.
","To begin making the Lemon Grass Flavored Tofu Fried Rice Recipe, cook the basmati rice in a pressure cooker by adding coconut milk and 1/2 a cup of water, chopped lemongrass, crushed ginger and turmeric powder.Pressure cook for about 2 whistle and switch off the heat. Allow the pressure to release naturally and rest it aside for some time.Take out the lemon grass and crushed ginger from the pressure cooked rice and mix the rice well with a fork.Heat a wok with some oil, add ginger and garlic that are chopped and saute till they soften.Add chopped onions and saute till they turn translucent. Once that is done you can add chopped bell peppers as well.Sprinkle some salt, chopped green chillies and saute till the bell peppers soften. Add cubed tofu pieces, pepper powder, soy sauce and green chilli sauce and give it a toss.Add the flavored lemon grass rice and toss well into the sautéed vegetables. Check for salt and finally add chopped spring onions and serve warm.Serve the Lemongrass Flavored Tofu Fried Rice Recipe along with Gobi Manchurian Recipe and Spring Rolls Recipe to make it a complete meal.",https://www.archanaskitchen.com/lemon-grass-flavored-tofu-fried-rice-recipe
4568,Bhel Puri With Raw Mango Recipe,Bhel Puri With Raw Mango Recipe,"2 cups Puffed rice,1 Onion - peeled and finely chopped,1 Tomato - deseeded and finely chopped,1/2 cup Mango (Raw) - diced,3 sprig Coriander (Dhania) Leaves - minced,3 tablespoons Raw Peanuts (Moongphali) - roasted,2 tablespoons Yellow Moong Dal (Split) - fried(optional),1 1/2 tablespoon Lahsun Ki Chutney (Red Garlic Chutney),1 tablespoon Green Chutney (Coriander & Mint),1 1/2 tablespoon Sweet Chutney (Date & Tamarind),Salt - as required","2 cups Puffed rice,1 Onion - peeled and finely chopped,1 Tomato - deseeded and finely chopped,1/2 cup Mango (Raw) - diced,3 sprig Coriander (Dhania) Leaves - minced,3 tablespoons Raw Peanuts (Moongphali) - roasted,2 tablespoons Yellow Moong Dal (Split) - fried(optional),1 1/2 tablespoon Lahsun Ki Chutney (Red Garlic Chutney),1 tablespoon Green Chutney (Coriander & Mint),1 1/2 tablespoon Sweet Chutney (Date & Tamarind),Salt - as required",15,0,15,2,North Indian Recipes,Snack,Vegetarian,"To begin making Bhel Puri With Raw Mango, sprinkle a pinch of salt and red chili powder on diced raw mangoes and keep aside.In a wide mixing bowl, mix in chopped onions, chopped tomato, puffed rice, peanuts, Lahsun ki Chutney , green chutney and Date and Tamarind Chutney . Now add masala raw mango pieces and toss it gently. Season with salt if required.Add fresh chopped coriander, sev and fried moong dal to the bhel. Toss and serve immediately.Serve Bhel Puri With Raw Mango with a cup of Masala Chai  during your tea time break or you can also make it and serve with other chaats like Sev Puri and Dahi Bhalla Puri for a weekend chaat party.
","To begin making Bhel Puri With Raw Mango, sprinkle a pinch of salt and red chili powder on diced raw mangoes and keep aside.In a wide mixing bowl, mix in chopped onions, chopped tomato, puffed rice, peanuts, Lahsun ki Chutney , green chutney and Date and Tamarind Chutney . Now add masala raw mango pieces and toss it gently. Season with salt if required.Add fresh chopped coriander, sev and fried moong dal to the bhel. Toss and serve immediately.Serve Bhel Puri With Raw Mango with a cup of Masala Chai  during your tea time break or you can also make it and serve with other chaats like Sev Puri and Dahi Bhalla Puri for a weekend chaat party.",https://www.archanaskitchen.com/bhel-puri-with-raw-mango-recipe
4570,Broccoli Pakora Masala Recipe - Broccoli In Spicy Yogurt Gravy,Broccoli Pakora Masala Recipe - Broccoli In Spicy Yogurt Gravy,"1 cup Broccoli - finely chopped,1 cup Onion - thinly sliced,1 tablespoons Rice flour,3 tablespoons Gram flour (besan),1/2 teaspoon Baking soda,1/2 teaspoon Lemon juice,1/4 teaspoon Turmeric powder (Haldi),1/2 teaspoon Red Chilli powder,1/4 teaspoon Garam masala powder,3 tablespoons Water,Salt - to taste,1 cup Curd (Dahi / Yogurt) - beaten,3/4 cup Water,1 tablespoon Gram flour (besan),1 teaspoon Mustard seeds,1 teaspoon Cumin seeds (Jeera),Asafoetida (hing) - a pinch,2 tablespoons Sunflower Oil,1/4 teaspoon Turmeric powder (Haldi),1 teaspoon Red Chilli powder,1 teaspoon Coriander Powder (Dhania),Salt - to taste","1 cup Broccoli - finely chopped,1 cup Onion - thinly sliced,1 tablespoons Rice flour,3 tablespoons Gram flour (besan),1/2 teaspoon Baking soda,1/2 teaspoon Lemon juice,1/4 teaspoon Turmeric powder (Haldi),1/2 teaspoon Red Chilli powder,1/4 teaspoon Garam masala powder,3 tablespoons Water,Salt - to taste,1 cup Curd (Dahi / Yogurt) - beaten,3/4 cup Water,1 tablespoon Gram flour (besan),1 teaspoon Mustard seeds,1 teaspoon Cumin seeds (Jeera),Asafoetida (hing) - a pinch,2 tablespoons Sunflower Oil,1/4 teaspoon Turmeric powder (Haldi),1 teaspoon Red Chilli powder,1 teaspoon Coriander Powder (Dhania),Salt - to taste",10,20,30,4,North Indian Recipes,Lunch,Vegetarian,"To begin making the Broccoli Pakora Masala recipe, preheat the oven to 400°F/204°C and spray a non stick cooking oil over a baking tray and keep aside.Add the ingredients (under pakoras) in a bowl which includes broccoli, onion, rice flour, besan, baking soda, lemon juice, turmeric powder, red chilli powder, garam masala powder, salt and a little water. Mix well to form a thick consistency.Take a tea spoon full of mixture and round them slightly with wet hands and place them on a baking tray. Bake at 400°F for 20 minutes, till the top layers turn light brown. Take them out and place them aside.You can also fry them, if you don't want the baked pakora. For frying, heat oil in a heavy bottomed pan. When the oil is hot, add the pakoras one by one and fry them till it turns golden brown.Take them out on a kitchen towel and keep it aside. The next step is to make the yogurt gravy for the broccoli pakoras. In a wide pan, heat the oil and add mustard seeds, cumin seeds, asafoetida and let it cook for about 15 to 20 seconds.Lower the heat and add besan. Keep stirring in low heat till it turns aromatic and light golden in colour.Once it turns golden in colour, add in the yogurt, turmeric powder, red chilli powder, coriander powder and stir well in low heat for about 4 to 5 minutes. Add water according to your consistency.Add salt and mix well. Then add in the pakoras and let it simmer for 2 minutes. Broccoli pakoras in spicy yogurt gravy is ready to be served. Enjoy!Serve Broccoli Pakora Masala along with Tomato Onion Cucumber Raita, Jeera Rice and Phulka for a weekday meal.
","To begin making the Broccoli Pakora Masala recipe, preheat the oven to 400°F/204°C and spray a non stick cooking oil over a baking tray and keep aside.Add the ingredients (under pakoras) in a bowl which includes broccoli, onion, rice flour, besan, baking soda, lemon juice, turmeric powder, red chilli powder, garam masala powder, salt and a little water. Mix well to form a thick consistency.Take a tea spoon full of mixture and round them slightly with wet hands and place them on a baking tray. Bake at 400°F for 20 minutes, till the top layers turn light brown. Take them out and place them aside.You can also fry them, if you don't want the baked pakora. For frying, heat oil in a heavy bottomed pan. When the oil is hot, add the pakoras one by one and fry them till it turns golden brown.Take them out on a kitchen towel and keep it aside. The next step is to make the yogurt gravy for the broccoli pakoras. In a wide pan, heat the oil and add mustard seeds, cumin seeds, asafoetida and let it cook for about 15 to 20 seconds.Lower the heat and add besan. Keep stirring in low heat till it turns aromatic and light golden in colour.Once it turns golden in colour, add in the yogurt, turmeric powder, red chilli powder, coriander powder and stir well in low heat for about 4 to 5 minutes. Add water according to your consistency.Add salt and mix well. Then add in the pakoras and let it simmer for 2 minutes. Broccoli pakoras in spicy yogurt gravy is ready to be served. Enjoy!Serve Broccoli Pakora Masala along with Tomato Onion Cucumber Raita, Jeera Rice and Phulka for a weekday meal.",https://www.archanaskitchen.com/broccoli-pakora-masala-recipe-broccoli-in-spiced-yogurt-gravy
4578,Long Brinjal Poriyal Masala Recipe - Green Baingan Sabzi,Long Brinjal Poriyal Masala Recipe - Green Baingan Sabzi,"300 grams Long Green Brinjal - sliced into half and cut into 1 inch pieces,2 Tomatoes - finely chopped,1 teaspoon Coriander (Dhania) Seeds - coarsely pounded,1 sprig Curry leaves - roughly torn,1 teaspoon Sambar Powder,1/2 teaspoon Turmeric powder (Haldi),1/2 teaspoon Red Chilli powder,Salt - to taste,Sunflower Oil","300 grams Long Green Brinjal - sliced into half and cut into 1 inch pieces,2 Tomatoes - finely chopped,1 teaspoon Coriander (Dhania) Seeds - coarsely pounded,1 sprig Curry leaves - roughly torn,1 teaspoon Sambar Powder,1/2 teaspoon Turmeric powder (Haldi),1/2 teaspoon Red Chilli powder,Salt - to taste,Sunflower Oil",10,20,30,4,South Indian Recipes,Lunch,Vegetarian,"To begin making the Long Brinjal Poriyal Masala Recipe, first prepare all the ingredients and keep them ready. Cut the green brinjal and soak it in salt water to prevent it from getting dark.Heat oil in a heavy bottomed pan over medium heat. Add the coriander seeds and allow it to crackle.Add the chopped tomatoes, curry leaves and saute until the tomatoes soften. Stir in the brinjal (draining the excess water), sprinkle some salt and stir fry for a few seconds. Cover the pan and cook the brinjal until it softens.Once the brinjal is cooked through, open the lid and add the sambar powder, turmeric powder, red chilli powder and any more salt to taste.Stir well until the brinjal poriyal absorbs all the masala and looks well done. Give it a taste and adjust the seasonings accordingly. Once done, turn off the heat and transfer to a serving bowl.Serve the Brinjal Poriyal Masala along with Kerala Style Pulissery (Moru Kuzhambu), Steamed Rice, Tomato Cucumber Raita and Papad for lunch or dinner.
","To begin making the Long Brinjal Poriyal Masala Recipe, first prepare all the ingredients and keep them ready. Cut the green brinjal and soak it in salt water to prevent it from getting dark.Heat oil in a heavy bottomed pan over medium heat. Add the coriander seeds and allow it to crackle.Add the chopped tomatoes, curry leaves and saute until the tomatoes soften. Stir in the brinjal (draining the excess water), sprinkle some salt and stir fry for a few seconds. Cover the pan and cook the brinjal until it softens.Once the brinjal is cooked through, open the lid and add the sambar powder, turmeric powder, red chilli powder and any more salt to taste.Stir well until the brinjal poriyal absorbs all the masala and looks well done. Give it a taste and adjust the seasonings accordingly. Once done, turn off the heat and transfer to a serving bowl.Serve the Brinjal Poriyal Masala along with Kerala Style Pulissery (Moru Kuzhambu), Steamed Rice, Tomato Cucumber Raita and Papad for lunch or dinner.",http://www.archanaskitchen.com/long-brinjal-poriyal-masala-recipe-green-baingan-sabzi
4581,गोभी और ककड़ी का रायता रेसिपी - Cauliflower & Cucumber Raita (Recipe In Hindi), Cauliflower & Cucumber Raita (Recipe In Hindi),"2 कप हंग दही,2 कप गोभी - छोटा छोटा काट ले,1 ककड़ी - छीलकर काट ले,1 छोटा चमच्च जीरा पाउडर - सेक ले,2 हरी मिर्च - बारीक काट ले,नमक - स्वाद अनुसार,तेल - प्रयोग अनुसार,हरा धनिया - थोड़ा","2 कप हंग दही,2 कप गोभी - छोटा छोटा काट ले,1 ककड़ी - छीलकर काट ले,1 छोटा चमच्च जीरा पाउडर - सेक ले,2 हरी मिर्च - बारीक काट ले,नमक - स्वाद अनुसार,तेल - प्रयोग अनुसार,हरा धनिया - थोड़ा",20,30,50,4,Indian,Side Dish,Vegetarian,"गोभी और ककड़ी का रायता बनाने के लिए सबसे पहले एक कढ़ाई में तेल गरम कर ले. इसमें गोभी, थोड़ा नमक डाले और मध्यम आंच पर सेक ले. पक जाने के बाद, गैस बंद करें और गोभी को अलग से रख दे.अब एक बाउल ले. उसमे दही, नमक, जीरा पाउडर, हरी मिर्च और धनिया डाले। मिलाए और फिर इसमें पकी हुई गोभी और ककड़ी डाले। मिलाए, नमक और मसाले चेक करें और परोसे। गोभी और ककड़ी के रायते को राजस्थानी सेव टमाटर की सब्ज़ी और फुल्के के साथ दिन के खाने के लिए परोसे।
","To make cabbage and cucumber raita, first heat oil in a pan. Add cauliflower, some salt and roast it on medium heat. After cooking, turn off the gas and keep the cauliflower separately. Now take a bowl. Add curd, salt, cumin powder, green chilli and coriander to it. Mix and then add the cooked cabbage and cucumber. Mix, check salt and spices and serve. Serve Cabbage and Cucumber Raita with Rajasthani Sev Tomato Vegetable and Phulka for dinner.",https://www.archanaskitchen.com/cauliflower-cucumber-raita-recipe-in-hindi
4582,Menthi Vankaya Recipe - Andhra Style Fenugreek Spiced Baingan,Menthi Vankaya Recipe - Andhra Style Fenugreek Spiced Baingan,"10 Small Brinjal (Baingan / Eggplant),2 tablespoons Tamarind Paste - thick,1/4 cup Water,Salt - to taste,4 tablespoons Sunflower Oil,1 teaspoon White Urad Dal (Split),1 sprig Curry leaves,2 tablespoons Coriander (Dhania) Seeds,1 tablespoon Chana dal (Bengal Gram Dal),1 tablespoon White Urad Dal (Split),1 tablespoon Sesame seeds (Til seeds),1 teaspoon Cumin seeds (Jeera),1/2 teaspoon Methi Seeds (Fenugreek Seeds),3 Dry Red Chillies - adjustable,2 tablespoons Raw Peanuts (Moongphali) - optional","10 Small Brinjal (Baingan / Eggplant),2 tablespoons Tamarind Paste - thick,1/4 cup Water,Salt - to taste,4 tablespoons Sunflower Oil,1 teaspoon White Urad Dal (Split),1 sprig Curry leaves,2 tablespoons Coriander (Dhania) Seeds,1 tablespoon Chana dal (Bengal Gram Dal),1 tablespoon White Urad Dal (Split),1 tablespoon Sesame seeds (Til seeds),1 teaspoon Cumin seeds (Jeera),1/2 teaspoon Methi Seeds (Fenugreek Seeds),3 Dry Red Chillies - adjustable,2 tablespoons Raw Peanuts (Moongphali) - optional",10,10,20,2,Andhra,Lunch,Vegetarian,"To begin making the Menthi Vankaya recipe, in a pan, dry roast ingredients mentioned under methi karam/spice powder which includes coriander seeds, chana dal, urad dal, sesame seeds, cumin seeds, fenugreek seeds, dry red chillies and raw peanuts. This will take about 2 minutes.Once everything is roasted well, cool it completely and grind into fine powder using a mixer grinder.If you are adding peanuts, add them last after all the other spices are finely powdered. Otherwise, the powder becomes oily. Keep the powder aside to stuff in the brinjals.Next, wash and pat dry the small brinjals thoroughly. Slit brinjals in such a way that you see an X at the base. Be careful not to slit open them completely.In a bowl, add water with salt and immerse the brinjals in salt water for 5 minutes.In a heavy bottomed pan, add half of the water, required salt and gently drop brinjals when water starts to boil. Make sure there is only one layer of brinjals. Do not put one brinjal over the other.Cook covered until brinjals are 80% done. This will not take more than 6 to 10 minutes. Now, add tamarind paste. If there is not enough water left, add some more water. Mix and cook for another 2 or 3 minutes until brinjals absorb all the salt and tamarind flavours. Remove from pan, cool them completely. Drain the remaining water.In the meantime, take a regular sewing thread, measure the length equal to twice the diameter of brinjals and cut into 10 or 12 pieces. After the brinjals are cooled down, stuff them with spice powder and wrap the thread around them gently. This ensures the spice powder does not come out while frying. Heat oil in the same wide pan, fry urad dal until golden and add curry leaves. Fry until crisp and gently place stuffed and secured brinjals in the pan. Fry the brinjals until they are completely cooked. Sprinkle the remaining spice powder on the top.Turn the brinjals gently using a fork and and a spoon. Do not use a ladle as it may break the brinjals.Once the brinjals are soft and cooked properly, remove the thread carefully and serve hot.Serve Menthi Vankaya along with Mixed Vegetable Sambar, Steamed Rice and Elai Vadam for a satisfying South Indian lunch with your family
","To begin making the Menthi Vankaya recipe, in a pan, dry roast ingredients mentioned under methi karam/spice powder which includes coriander seeds, chana dal, urad dal, sesame seeds, cumin seeds, fenugreek seeds, dry red chillies and raw peanuts. This will take about 2 minutes.Once everything is roasted well, cool it completely and grind into fine powder using a mixer grinder.If you are adding peanuts, add them last after all the other spices are finely powdered. Otherwise, the powder becomes oily. Keep the powder aside to stuff in the brinjals.Next, wash and pat dry the small brinjals thoroughly. Slit brinjals in such a way that you see an X at the base. Be careful not to slit open them completely.In a bowl, add water with salt and immerse the brinjals in salt water for 5 minutes.In a heavy bottomed pan, add half of the water, required salt and gently drop brinjals when water starts to boil. Make sure there is only one layer of brinjals. Do not put one brinjal over the other.Cook covered until brinjals are 80% done. This will not take more than 6 to 10 minutes. Now, add tamarind paste. If there is not enough water left, add some more water. Mix and cook for another 2 or 3 minutes until brinjals absorb all the salt and tamarind flavours. Remove from pan, cool them completely. Drain the remaining water.In the meantime, take a regular sewing thread, measure the length equal to twice the diameter of brinjals and cut into 10 or 12 pieces. After the brinjals are cooled down, stuff them with spice powder and wrap the thread around them gently. This ensures the spice powder does not come out while frying. Heat oil in the same wide pan, fry urad dal until golden and add curry leaves. Fry until crisp and gently place stuffed and secured brinjals in the pan. Fry the brinjals until they are completely cooked. Sprinkle the remaining spice powder on the top.Turn the brinjals gently using a fork and and a spoon. Do not use a ladle as it may break the brinjals.Once the brinjals are soft and cooked properly, remove the thread carefully and serve hot.Serve Menthi Vankaya along with Mixed Vegetable Sambar, Steamed Rice and Elai Vadam for a satisfying South Indian lunch with your family",https://www.archanaskitchen.com/menthi-vankaya-recipe-andhra-style-fenugreek-spiced-baingan
