Srno,RecipeName,TranslatedRecipeName,Ingredients,TranslatedIngredients,PrepTimeInMins,CookTimeInMins,TotalTimeInMins,Servings,Cuisine,Course,Diet,Instructions,TranslatedInstructions,URL
6547,Quick Prawn Tikka Masala Recipe,Quick Prawn Tikka Masala Recipe,"10 Prawns - cleaned (jumbo),1/2 teaspoon Lemon juice,1 tablespoon Red Chilli powder,Salt - to taste,1 tablespoon Ginger Garlic Paste,1/2 cup Hung Curd (Greek Yogurt),1/4 cup Fresh cream,2 Onions - chopped,3 Tomatoes - pureed,1 tablespoon Kashmiri Red Chilli Powder,Salt - to taste,1 teaspoon Turmeric powder (Haldi),1 teaspoon Cumin seeds (Jeera),1 tablespoon Garam masala powder,1 teaspoon Ginger Garlic Paste,1 tablespoon Butter,Sunflower Oil - as required,1 teaspoon Tandoori masala - (optional)","10 Prawns - cleaned (jumbo),1/2 teaspoon Lemon juice,1 tablespoon Red Chilli powder,Salt - to taste,1 tablespoon Ginger Garlic Paste,1/2 cup Hung Curd (Greek Yogurt),1/4 cup Fresh cream,2 Onions - chopped,3 Tomatoes - pureed,1 tablespoon Kashmiri Red Chilli Powder,Salt - to taste,1 teaspoon Turmeric powder (Haldi),1 teaspoon Cumin seeds (Jeera),1 tablespoon Garam masala powder,1 teaspoon Ginger Garlic Paste,1 tablespoon Butter,Sunflower Oil - as required,1 teaspoon Tandoori masala - (optional)",15,15,30,2,North Indian Recipes,Dinner,Non Vegeterian,"To begin making the Quick Prawn Tikka Masala recipe, take a big bowl and add lime juice, salt, chilli powder and ginger garlic paste and mix everything.Add prawns and make sure that each piece is coated properly. Marinate for 15 to 20 minutes.Heat butter in a heavy bottomed pan and add the marinated prawns. Cook for about 4 to 5 minutes until they start looking slightly tender.Remember overcooking will spoil them. Keep the cooked prawns aside in another bowl.In the same pan, add 2 tablespoon oil and add cumin seeds. Once they start to sizzle, add chopped onions and saute for about 4-5 minutes until onions turn dark brown.Add ginger garlic paste, chilli powder, turmeric powder, salt and fry for one minute until the mix turns aromatic.Next add the pureed tomatoes to the pan and mix well. Cook on low flame for 3 to 4 minutes, until the mixture thickens.Now add cream, curd and garam masala. Mix well and let it cook on low flame.Finally add cooked prawns, tandoori masala powder and salt to taste.Serve hot and garnish with some onion circles and coriander leaves. Serve Quick Prawn Tikka Masala along with Steamed Rice and Beetroot Pachadi for a weekday lunch or dinner.
","To begin making the Quick Prawn Tikka Masala recipe, take a big bowl and add lime juice, salt, chilli powder and ginger garlic paste and mix everything.Add prawns and make sure that each piece is coated properly. Marinate for 15 to 20 minutes.Heat butter in a heavy bottomed pan and add the marinated prawns. Cook for about 4 to 5 minutes until they start looking slightly tender.Remember overcooking will spoil them. Keep the cooked prawns aside in another bowl.In the same pan, add 2 tablespoon oil and add cumin seeds. Once they start to sizzle, add chopped onions and saute for about 4-5 minutes until onions turn dark brown.Add ginger garlic paste, chilli powder, turmeric powder, salt and fry for one minute until the mix turns aromatic.Next add the pureed tomatoes to the pan and mix well. Cook on low flame for 3 to 4 minutes, until the mixture thickens.Now add cream, curd and garam masala. Mix well and let it cook on low flame.Finally add cooked prawns, tandoori masala powder and salt to taste.Serve hot and garnish with some onion circles and coriander leaves. Serve Quick Prawn Tikka Masala along with Steamed Rice and Beetroot Pachadi for a weekday lunch or dinner.",https://www.archanaskitchen.com/quick-prawn-tikka-masala-recipe
6550,Golden Turmeric Almond Saffron Milk Shot Recipe,Golden Turmeric Almond Saffron Milk Shot Recipe,"2 inch Whole turmeric,1/2 teaspoon Ginger - crushed,2 tablespoons Brown Sugar (Demerara Sugar) - (reduce if you wish),1-1/2 tablespoons Honey,2 inch Cinnamon Stick (Dalchini),5 Cardamom (Elaichi) Pods/Seeds,2 pinch Saffron strands,5 tablespoons Almond Meal (Badam Powder),4 cups Milk,15 Raisins","2 inch Whole turmeric,1/2 teaspoon Ginger - crushed,2 tablespoons Brown Sugar (Demerara Sugar) - (reduce if you wish),1-1/2 tablespoons Honey,2 inch Cinnamon Stick (Dalchini),5 Cardamom (Elaichi) Pods/Seeds,2 pinch Saffron strands,5 tablespoons Almond Meal (Badam Powder),4 cups Milk,15 Raisins",5,20,25,4,Indian,Vegetarian,Vegetarian,"To begin making the Golden Turmeric Almond Saffron Milk Shot Recipe, in a mixer attachment, grind the almond powder and the brown sugar together and keep aside.In a mortar and pestle, crush the ginger, turmeric together and keep aside.Heat the milk in a saucepan and bring it to one boil.Now, simmer the milk and keep cooking for another 10 minutes or until it is considerably thicker.Put the rest of the ingredients in it including alomd and brown sugar powder, turmeric, ginger, honey, cinnamon stick, cardamom seeds, saffron strands, except raisins. Let the milk continue to cook on simmer.After 10-15 minutes, switch off the flame and serve the milk hot after straining milk out of the undissolved ingredients.Add the raisins on each glass and serve the milk. Enjoy Golden Turmeric Almond Saffron Milk Shot Recipe either before sleep or during tea time.
","To begin making the Golden Turmeric Almond Saffron Milk Shot Recipe, in a mixer attachment, grind the almond powder and the brown sugar together and keep aside.In a mortar and pestle, crush the ginger, turmeric together and keep aside.Heat the milk in a saucepan and bring it to one boil.Now, simmer the milk and keep cooking for another 10 minutes or until it is considerably thicker.Put the rest of the ingredients in it including alomd and brown sugar powder, turmeric, ginger, honey, cinnamon stick, cardamom seeds, saffron strands, except raisins. Let the milk continue to cook on simmer.After 10-15 minutes, switch off the flame and serve the milk hot after straining milk out of the undissolved ingredients.Add the raisins on each glass and serve the milk. Enjoy Golden Turmeric Almond Saffron Milk Shot Recipe either before sleep or during tea time.",http://www.archanaskitchen.com/golden-turmeric-almond-saffron-milk-shot-recipe
6556,Amritsari Dal Recipe,Amritsari Dal Recipe,"1 cup Black Urad Dal (Whole),1/4 cup Chana dal (Bengal Gram Dal),1 Onion - finely chopped,1 Tomato - finely chopped,2 Green Chillies - finely chopped,1 inch Ginger - grated,2 cloves Garlic - finely chopped,1/2 teaspoon Ajwain (Carom seeds),1/4 teaspoon Red Chilli powder,1/2 teaspoon Garam masala powder,1 inch Cinnamon Stick (Dalchini),Salt - to taste,Sunflower Oil - as required","1 cup Black Urad Dal (Whole),1/4 cup Chana dal (Bengal Gram Dal),1 Onion - finely chopped,1 Tomato - finely chopped,2 Green Chillies - finely chopped,1 inch Ginger - grated,2 cloves Garlic - finely chopped,1/2 teaspoon Ajwain (Carom seeds),1/4 teaspoon Red Chilli powder,1/2 teaspoon Garam masala powder,1 inch Cinnamon Stick (Dalchini),Salt - to taste,Sunflower Oil - as required",10,30,40,4,Punjabi,Lunch,High Protein Vegetarian,"We will begin making the Amritsari Dal Recipe by rinsing and soaking the dals for at least 4 to 5 hours or overnight.Heat a teaspoon of oil into the pressure cooker, add the soaked dal along with half of the chopped tomatoes, 1/2 teaspoon of turmeric powder, 3 cups of water and salt to taste. Cover the cooker and pressure cook, until the dal is done.Once the dal is cooked through for atleast 4 to 5 whistles, turn off the heat and allow the pressure to release naturally.The next step is to make the masala for the dal. Into a heavy bottomed pan, heat a bit of oil. Once the oil is hot, add the onions, ginger, garlic and saute for a few minutes until the onions are tender.Add the chillies, tomatoes and the remaining masalas and saute well until the masalas are well combined into the tomatoes.Add the cooked dal and stir well into the masala. Adjust the consistency of the dal, by adding little water if required. Lightly mash the dal with the back of the spoon to give it a mushy texture. Cover and simmer the dal for about 10 minutes.Once done, stir in the chopped coriander leaves and serve.Serve the Amritsari Dal with Ajwain Puri,and Dubki Wale Aloo Recipe for a lunch meal. 
","We will begin making the Amritsari Dal Recipe by rinsing and soaking the dals for at least 4 to 5 hours or overnight.Heat a teaspoon of oil into the pressure cooker, add the soaked dal along with half of the chopped tomatoes, 1/2 teaspoon of turmeric powder, 3 cups of water and salt to taste. Cover the cooker and pressure cook, until the dal is done.Once the dal is cooked through for atleast 4 to 5 whistles, turn off the heat and allow the pressure to release naturally.The next step is to make the masala for the dal. Into a heavy bottomed pan, heat a bit of oil. Once the oil is hot, add the onions, ginger, garlic and saute for a few minutes until the onions are tender.Add the chillies, tomatoes and the remaining masalas and saute well until the masalas are well combined into the tomatoes.Add the cooked dal and stir well into the masala. Adjust the consistency of the dal, by adding little water if required. Lightly mash the dal with the back of the spoon to give it a mushy texture. Cover and simmer the dal for about 10 minutes.Once done, stir in the chopped coriander leaves and serve.Serve the Amritsari Dal with Ajwain Puri,and Dubki Wale Aloo Recipe for a lunch meal. ",http://www.archanaskitchen.com/amritsari-dal-recipe
6560,Khatti Meethi Tinda Masala Recipe,Khatti Meethi Tinda Masala Recipe,"300 grams Tinda (Apple Gourd) - peeled and cut into wedges,1 teaspoon Ajwain (Carom seeds),1 Tomato - finely chopped,1 inch Ginger - grated,2 Green Chillies - slit,1/2 teaspoon Turmeric powder (Haldi),1/2 teaspoon Red Chilli powder,1/2 teaspoon Amchur (Dry Mango Powder),1 tablespoon Jaggery,Salt - to taste,1 teaspoon Sunflower Oil - for cooking,1 teaspoon Kasuri Methi (Dried Fenugreek Leaves) - for garnish","300 grams Tinda (Apple Gourd) - peeled and cut into wedges,1 teaspoon Ajwain (Carom seeds),1 Tomato - finely chopped,1 inch Ginger - grated,2 Green Chillies - slit,1/2 teaspoon Turmeric powder (Haldi),1/2 teaspoon Red Chilli powder,1/2 teaspoon Amchur (Dry Mango Powder),1 tablespoon Jaggery,Salt - to taste,1 teaspoon Sunflower Oil - for cooking,1 teaspoon Kasuri Methi (Dried Fenugreek Leaves) - for garnish",10,30,40,4,North Indian Recipes,Side Dish,Vegetarian,"To begin making the Khatti Meethi Tinda Masala Recipe, firstly first prepare all the ingredients and keep them ready by the side.Heat oil in the pressure cooker, add the ajwain seeds and allow it to crackle. Add the ginger and tomatoes and saute until the tomatoes soften.Add the cut tinda (apple gourd), and the remaining ingredients including green chillies, turmeric powder, red chilli powder, amchur, jaggery and salt except the kasuri methi. Add 1/4 cup of water, cover the pressure cooker, cook for three whistles and turn off the heat.Allow the pressure to release naturally. Once the pressure releases, open the cooker and stir in the kasuri methi.Check the salt and seasonings and adjust to suit your taste. Transfer to a serving bowl and serve warm.Serve the Khatti Meethi Tinda Masala along with Methi Thepla, Boondi Kadhi and Mango Pickle for a cosy sunday lunch or weeknight dinner. 
","To begin making the Khatti Meethi Tinda Masala Recipe, firstly first prepare all the ingredients and keep them ready by the side.Heat oil in the pressure cooker, add the ajwain seeds and allow it to crackle. Add the ginger and tomatoes and saute until the tomatoes soften.Add the cut tinda (apple gourd), and the remaining ingredients including green chillies, turmeric powder, red chilli powder, amchur, jaggery and salt except the kasuri methi. Add 1/4 cup of water, cover the pressure cooker, cook for three whistles and turn off the heat.Allow the pressure to release naturally. Once the pressure releases, open the cooker and stir in the kasuri methi.Check the salt and seasonings and adjust to suit your taste. Transfer to a serving bowl and serve warm.Serve the Khatti Meethi Tinda Masala along with Methi Thepla, Boondi Kadhi and Mango Pickle for a cosy sunday lunch or weeknight dinner. ",http://www.archanaskitchen.com/khatti-meethi-tinda-masala-recipe
6563,Mustard Prawns In Coconut Recipe,Mustard Prawns In Coconut Recipe,"10 Prawns,3/4 Kasundi mustard sauce - (while making the paste the amount of mustard used is 1/4th cup),3 Green Chillies - (for the mustard paste one for the dish and one for garnishing),2 teaspoons Mustard oil,1/4 teaspoon Kalonji (Onion Nigella Seeds),1 teaspoon Turmeric powder (Haldi),1/4 teaspoon Red Chilli powder,Salt - as per taste,1 teaspoon Coriander (Dhania) Leaves - for the mustard paste,Coriander (Dhania) Leaves - Few","10 Prawns,3/4 Kasundi mustard sauce - (while making the paste the amount of mustard used is 1/4th cup),3 Green Chillies - (for the mustard paste one for the dish and one for garnishing),2 teaspoons Mustard oil,1/4 teaspoon Kalonji (Onion Nigella Seeds),1 teaspoon Turmeric powder (Haldi),1/4 teaspoon Red Chilli powder,Salt - as per taste,1 teaspoon Coriander (Dhania) Leaves - for the mustard paste,Coriander (Dhania) Leaves - Few",8,30,38,4,Bengali Recipes,Lunch,Non Vegeterian,"To begin making the Mustard Prawns In Coconut recipe, Wash the deveined prawns in salt water.In parallel grind the mustard with two ice cubes, salt and green chillies along with a spoon of chopped coriander in a grinder. The ice reduces the bitterness of mustard. The quantity of the paste should be half cup.Heat two spoon of oil in a flat bottomed pan and add the Kalonji once the oil is heated.Once the flavour comes add one sliced green chilli. Now add the prawns and coat them with oil on all sides and keep on sauting till it turns white.In low flame add the mustard paste, turmeric powder and red chilli powder.Saute for sometime and mix well then add the grated coconut and mix again.Add enough water just to keep the prawns covered. Now add rest of the chilli and cover the pan.Cook in low flame for 15 minutes. Garnish with coriander leaves and serve.Mustard Prawns In Coconut is best served with plain rice or with bengali pulao for a delicious meal.
","To begin making the Mustard Prawns In Coconut recipe, Wash the deveined prawns in salt water.In parallel grind the mustard with two ice cubes, salt and green chillies along with a spoon of chopped coriander in a grinder. The ice reduces the bitterness of mustard. The quantity of the paste should be half cup.Heat two spoon of oil in a flat bottomed pan and add the Kalonji once the oil is heated.Once the flavour comes add one sliced green chilli. Now add the prawns and coat them with oil on all sides and keep on sauting till it turns white.In low flame add the mustard paste, turmeric powder and red chilli powder.Saute for sometime and mix well then add the grated coconut and mix again.Add enough water just to keep the prawns covered. Now add rest of the chilli and cover the pan.Cook in low flame for 15 minutes. Garnish with coriander leaves and serve.Mustard Prawns In Coconut is best served with plain rice or with bengali pulao for a delicious meal.",https://www.archanaskitchen.com/mustard-prawns-in-coconut-recipe
6564,Beetroot Greens Rice Recipe,Beetroot Greens Rice Recipe,"1 cup Cooked rice,200 grams Beetroot Greens - finely chopped,1 Onion - finely chipped,1 inch Ginger - finely chopped,4 cloves Garlic - finely chopped,1/2 tablespoon Red Chilli powder,1/2 tablespoon Coriander Powder (Dhania),1 tablespoon Sunflower Oil,1/2 teaspoon Mustard seeds,1/2 teaspoon Cumin seeds (Jeera),1 sprig Curry leaves,1/2 teaspoon Salt","1 cup Cooked rice,200 grams Beetroot Greens - finely chopped,1 Onion - finely chipped,1 inch Ginger - finely chopped,4 cloves Garlic - finely chopped,1/2 tablespoon Red Chilli powder,1/2 tablespoon Coriander Powder (Dhania),1 tablespoon Sunflower Oil,1/2 teaspoon Mustard seeds,1/2 teaspoon Cumin seeds (Jeera),1 sprig Curry leaves,1/2 teaspoon Salt",20,15,35,4,Indian,Dinner,Vegetarian,"To begin making the Beetroot Greens Rice Recipe, firstly remove the beetroot green leaves from beetroot.Wash them thoroughly by rinsing in cold water for at least 4-5 times. Chop the onion and leaves along with its tender pink stem finely.Separate the pink stem from the greens and keep them aside.Heat oil in a pan and add mustard seeds & cumin seeds. Once they crackle, add onion, ginger and garlic. Saute them till the onion becomes translucent.Once it is done, add the chopped pink stem and sprinkle some water on it. They take around 5 minutes to get cooked. Then add the greens and cook it for 1-2 minutes.Add chilli powder and coriander powder and saute it for about 3 minutes. After 3 minutes, add the cooked rice with the mixture and mix it well.When the rice is properly mixed with the masala, cover the pan with a lid and let it cook for 5 minutes on low flame.Adjust salt according to your taste and turn off the heat. Transfer the beetroot greens rice into a serving plate and serve. Serve Beetroot Greens Rice Recipe with Tomato Onion Cucumber Raita Recipe for lunch.
","To begin making the Beetroot Greens Rice Recipe, firstly remove the beetroot green leaves from beetroot.Wash them thoroughly by rinsing in cold water for at least 4-5 times. Chop the onion and leaves along with its tender pink stem finely.Separate the pink stem from the greens and keep them aside.Heat oil in a pan and add mustard seeds & cumin seeds. Once they crackle, add onion, ginger and garlic. Saute them till the onion becomes translucent.Once it is done, add the chopped pink stem and sprinkle some water on it. They take around 5 minutes to get cooked. Then add the greens and cook it for 1-2 minutes.Add chilli powder and coriander powder and saute it for about 3 minutes. After 3 minutes, add the cooked rice with the mixture and mix it well.When the rice is properly mixed with the masala, cover the pan with a lid and let it cook for 5 minutes on low flame.Adjust salt according to your taste and turn off the heat. Transfer the beetroot greens rice into a serving plate and serve. Serve Beetroot Greens Rice Recipe with Tomato Onion Cucumber Raita Recipe for lunch.",http://www.archanaskitchen.com/beetroot-greens-rice-recipe
6565,Masoor Moong Phali Ki Dal Recipe (Masoor Dal With Peanuts Recipe),Masoor Moong Phali Ki Dal Recipe (Masoor Dal With Peanuts Recipe),"3/4 cup Masoor Dal (Whole),1/2 cup Raw Peanuts (Moongphali),1 inch Ginger - grated,2 Green Chillies - slit,1 Onion - finely chopped,1 Tomato - finely chopped,1 Bay leaf (tej patta) - torn,1 teaspoon Turmeric powder (Haldi),1 teaspoon Garam masala powder,Salt - to taste,1 teaspoon Ghee,1/2 teaspoon Cumin seeds (Jeera),1 inch Cinnamon Stick (Dalchini) - broken,Coriander (Dhania) Leaves - a small bunch chopped,1 teaspoon Lemon juice","3/4 cup Masoor Dal (Whole),1/2 cup Raw Peanuts (Moongphali),1 inch Ginger - grated,2 Green Chillies - slit,1 Onion - finely chopped,1 Tomato - finely chopped,1 Bay leaf (tej patta) - torn,1 teaspoon Turmeric powder (Haldi),1 teaspoon Garam masala powder,Salt - to taste,1 teaspoon Ghee,1/2 teaspoon Cumin seeds (Jeera),1 inch Cinnamon Stick (Dalchini) - broken,Coriander (Dhania) Leaves - a small bunch chopped,1 teaspoon Lemon juice",10,35,45,4,North Indian Recipes,Lunch,High Protein Vegetarian,"To begin making the Masoor Moong Phali Ki Dal Recipe, first prep all the ingredients and keep them ready.Heat oil in the pressure cooker, add the ginger, onion and saute until the onions soften. Add the tomato, chilli, bay leaf, masoor dal, peanuts, turmeric powder, garam masala powder and salt to taste.Add 2-1/2 cups of water and pressure cook for 2 whistles. After the couple of whistles, turn the heat to low and simmer for 4 to 5 minutes. Turn off the heat and allow the pressure to release naturally.Heat ghee in a tadka pan for seasoning; add the cumin seeds, cinnamon and allow the flavors to infuse for a few seconds. Open the cooker, and transfer to a serving bowl. Stir in the chopped coriander leaves and the lemon juice. Check the salt and adjust to taste.Finally pour the seasoning and serve. Serve the Masoor Moong Phali Ki Dal along with Tawa Paratha, Cabbage Sabzi and Raita for a wholesome lunch or dinner.
","To begin making the Masoor Moong Phali Ki Dal Recipe, first prep all the ingredients and keep them ready.Heat oil in the pressure cooker, add the ginger, onion and saute until the onions soften. Add the tomato, chilli, bay leaf, masoor dal, peanuts, turmeric powder, garam masala powder and salt to taste.Add 2-1/2 cups of water and pressure cook for 2 whistles. After the couple of whistles, turn the heat to low and simmer for 4 to 5 minutes. Turn off the heat and allow the pressure to release naturally.Heat ghee in a tadka pan for seasoning; add the cumin seeds, cinnamon and allow the flavors to infuse for a few seconds. Open the cooker, and transfer to a serving bowl. Stir in the chopped coriander leaves and the lemon juice. Check the salt and adjust to taste.Finally pour the seasoning and serve. Serve the Masoor Moong Phali Ki Dal along with Tawa Paratha, Cabbage Sabzi and Raita for a wholesome lunch or dinner.
",https://www.archanaskitchen.com/masoor-moong-phali-ki-dal-recipe-masoor-dal-with-peanuts-recipe
6566,Quinoa Veg Soup (Bolivian Style Stew) Recipe,Quinoa Veg Soup (Bolivian Style Stew) Recipe,"1/4 cup Quinoa - soaked in warm water for 10 mins,1 cup Kala Chana (Brown Chickpeas) - cooked,1/2 cup Vegetable stock,1 Onions - finely chopped,2 Bay leaf (tej patta),1 cup Water,1 cup Carrots (Gajjar) - beans and peas,1/2 cup Green Bell Pepper (Capsicum) - chopped,1 teaspoon Ginger - grated,1 tablespoon Sunflower Oil,1/4 cup Homemade tomato puree - or pasta sauce,1/2 tablespoon Kashmiri Red Chilli Powder,1/2 teaspoon Cumin seeds (Jeera),1/2 teaspoon Coriander Powder (Dhania),1/2 teaspoon Coriander (Dhania) Leaves","1/4 cup Quinoa - soaked in warm water for 10 mins,1 cup Kala Chana (Brown Chickpeas) - cooked,1/2 cup Vegetable stock,1 Onions - finely chopped,2 Bay leaf (tej patta),1 cup Water,1 cup Carrots (Gajjar) - beans and peas,1/2 cup Green Bell Pepper (Capsicum) - chopped,1 teaspoon Ginger - grated,1 tablespoon Sunflower Oil,1/4 cup Homemade tomato puree - or pasta sauce,1/2 tablespoon Kashmiri Red Chilli Powder,1/2 teaspoon Cumin seeds (Jeera),1/2 teaspoon Coriander Powder (Dhania),1/2 teaspoon Coriander (Dhania) Leaves",20,40,60,4,Continental,Dinner,Vegetarian,"To begin making Quinoa Veg Soup, firstly add oil in a pressure cooker.Add onions, grated ginger, garlic and bay leaf and sauté till the onions turn golden brown.Once the onions turn golden brown, add tomato puree, bell pepper, veggies and sauté with salt.Add the cooked garbanzo, red chilli powder, jeera, dhania powder, quinoa, vegetable stock, water and pressure cook it for 2 whistles.Let the pressure die down on its own. Simmer for 3-4 mins till you get desired consistency and lastly add cilantro. Check the salt and spices and adjust to suit your taste and serve.Serve Quinoa Veg Soup with Chilli Cheese Toast or any other toast of your choice.
","To begin making Quinoa Veg Soup, firstly add oil in a pressure cooker.Add onions, grated ginger, garlic and bay leaf and sauté till the onions turn golden brown.Once the onions turn golden brown, add tomato puree, bell pepper, veggies and sauté with salt.Add the cooked garbanzo, red chilli powder, jeera, dhania powder, quinoa, vegetable stock, water and pressure cook it for 2 whistles.Let the pressure die down on its own. Simmer for 3-4 mins till you get desired consistency and lastly add cilantro. Check the salt and spices and adjust to suit your taste and serve.Serve Quinoa Veg Soup with Chilli Cheese Toast or any other toast of your choice.",http://www.archanaskitchen.com/quinoa-veg-soup-bolivian-style-stew-recipe
