Srno,RecipeName,TranslatedRecipeName,Ingredients,TranslatedIngredients,PrepTimeInMins,CookTimeInMins,TotalTimeInMins,Servings,Cuisine,Course,Diet,Instructions,TranslatedInstructions,URL
4729,Maharashtrian Achar Ka Masala (Pickle Mix Recipe),Maharashtrian Achar Ka Masala (Pickle Mix Recipe),"250 gram Kashmiri Red Chilli Powder,200 gram Mustard seeds,1 tablespoon Fennel seeds (Saunf),2 tablespoon Methi Powder (Fenugreek Powder),1-1/2 cup Turmeric powder (Haldi),2 cup Salt,2 tablespoons Asafoetida (hing),2 tablespoons Peanut oil","250 gram Kashmiri Red Chilli Powder,200 gram Mustard seeds,1 tablespoon Fennel seeds (Saunf),2 tablespoon Methi Powder (Fenugreek Powder),1-1/2 cup Turmeric powder (Haldi),2 cup Salt,2 tablespoons Asafoetida (hing),2 tablespoons Peanut oil",0,20,20,400,Maharashtrian Recipes,Side Dish,Vegetarian,"To prepare Maharashtrian Achar Ka Masala recipe, Heat oil in a kadai over medium heat. Add hing, fenugreek powder and saute it for a few seconds until aroma rises.Add chilli powder , mustard, dal, fennel seeds, turmeric (except salt) and mix well. Turn off the heat.Now add salt and mix well.Let the Maharashtrian Achar Ka Masala cool down to room temperature.Keep it in airtight bottles until required for Spicy Lime Pickle, Aam ka Achar, or in dishes like Achari paneer.
","To prepare Maharashtrian Achar Ka Masala recipe, Heat oil in a kadai over medium heat. Add hing, fenugreek powder and saute it for a few seconds until aroma rises.Add chilli powder , mustard, dal, fennel seeds, turmeric (except salt) and mix well. Turn off the heat.Now add salt and mix well.Let the Maharashtrian Achar Ka Masala cool down to room temperature.Keep it in airtight bottles until required for Spicy Lime Pickle, Aam ka Achar, or in dishes like Achari paneer.",https://www.archanaskitchen.com/maharashtrian-achar-ka-masala-pickle-mix-recipe
4730,Thai Style Curried Corn Fritters Recipe,Thai Style Curried Corn Fritters Recipe,"1 cup Sweet corn,2 sprig Coriander (Dhania) Leaves - chopped,1 teaspoon Thai Red Curry Paste,1/2 teaspoon Baking powder,1 Whole Egg,Salt - to taste,1 tablespoon Red Chilli sauce,Sunflower Oil","1 cup Sweet corn,2 sprig Coriander (Dhania) Leaves - chopped,1 teaspoon Thai Red Curry Paste,1/2 teaspoon Baking powder,1 Whole Egg,Salt - to taste,1 tablespoon Red Chilli sauce,Sunflower Oil",5,25,30,4,Thai,Appetizer,Vegetarian,"To begin making the Thai Style Curried Corn Fritters Recipe, add the corn kernels into a mixer and keep some aside for the extra crunch to your fritter. Blitz the remaining corn to a smooth mixture in a mixer jar. Transfer it into a bowl and add the whole corn kernels along with rest of the ingredients -coriander leaves, thai red curry paste, baking powder, egg, salt, red chilli sauce and mix well.Heat a Kuzhi Paniyaram pan with a few drops of oil in each of the cavities, once it is heated up add a spoon of the mixture and cook them on either side.Keep flipping them so that it will evenly browns on all the sides.Serve the Thai Style Curried Corn Fritters with a Peanut Chilli Dipping Sauce and glass of Carrot Pineapple Orange Juice by the side as your evening snack.
","To begin making the Thai Style Curried Corn Fritters Recipe, add the corn kernels into a mixer and keep some aside for the extra crunch to your fritter. Blitz the remaining corn to a smooth mixture in a mixer jar. Transfer it into a bowl and add the whole corn kernels along with rest of the ingredients -coriander leaves, thai red curry paste, baking powder, egg, salt, red chilli sauce and mix well.Heat a Kuzhi Paniyaram pan with a few drops of oil in each of the cavities, once it is heated up add a spoon of the mixture and cook them on either side.Keep flipping them so that it will evenly browns on all the sides.Serve the Thai Style Curried Corn Fritters with a Peanut Chilli Dipping Sauce and glass of Carrot Pineapple Orange Juice by the side as your evening snack.",http://www.archanaskitchen.com/thai-style-curried-corn-fritters-recipe
4731,टोफू फ्राइड राइस रेसिपी - Tofu Fried Rice (Recipe In Hindi), Tofu Fried Rice (Recipe In Hindi),"1 कप चावल,200 ग्राम टोफू - टुकड़े कर ले,1 तेज पत्ता,1 छोटा चमच्च इलाइची पाउडर,2 प्याज - बारीक काट ले,4 हरे प्याज - बारीक काट ले,4 बड़े चमच्च हरे प्याज के पत्ते - बारीक काट ले,1/2 शिमला मिर्च (हरी) - काट ले,8 बटन मशरुम - काट ले,1 गाजर - छीलकर काट ले,5 कली लहसुन - बारीक काट ले,1 बड़ा चमच्च अदरक लहसुन का पेस्ट,1 बड़ा चमच्च ग्रीन चिल्ली सॉस,1 छोटा चमच्च सोया सॉस,नमक - स्वाद अनुसार,तेल - प्रयोग अनुसार","1 कप चावल,200 ग्राम टोफू - टुकड़े कर ले,1 तेज पत्ता,1 छोटा चमच्च इलाइची पाउडर,2 प्याज - बारीक काट ले,4 हरे प्याज - बारीक काट ले,4 बड़े चमच्च हरे प्याज के पत्ते - बारीक काट ले,1/2 शिमला मिर्च (हरी) - काट ले,8 बटन मशरुम - काट ले,1 गाजर - छीलकर काट ले,5 कली लहसुन - बारीक काट ले,1 बड़ा चमच्च अदरक लहसुन का पेस्ट,1 बड़ा चमच्च ग्रीन चिल्ली सॉस,1 छोटा चमच्च सोया सॉस,नमक - स्वाद अनुसार,तेल - प्रयोग अनुसार",20,60,80,3,Chinese,Lunch,Vegetarian,"टोफू फ्राइड राइस बनाने के लिए सबसे पहले चावल को धो ले और पानी में भिगो कर 15 मिनट के लिए अलग से रख दे.अब चावल को एक सॉसपैन में तेज पत्ता और नमक के साथ डाले और आधा पकने तक पका ले. पानी निकाल ले, दालचीनी पाउडर डाले और उसे अलग से रख दे. अब एक कढ़ाई में तेल गरम करें। इसमें टोफू डाले और उनके दोनों तरफ से भूरा होने तक पका ले. कढ़ाई से निकाले और अलग से रख दे. उसी कढ़ाई में थोड़ा और तेल डाले। तेल के गरम होने के बाद इसमें लहसुन डाले और 30 सेकण्ड्स तक पकने दे. अब इसमें हरे प्याज और प्याज डाले। प्याज के नरम होने तक पकाए। नरम होने के बाद अदरक लहसुन का पेस्ट डाले और मिला ले. 1 मिनट बाद इसमें शिमला मिर्च, गाजर और मशरुम डाले। सब्ज़िओ के पकने तक पकाए। अब इसमें सारे सॉस एक एक कर े डाले और मिला ले. इसमें स्वाद अनुसार नमक डाले। टोफू के टुकड़े, चावल डाले और मिला ले. 2 से 3 मिनट तक पकने दे और फिर हरे प्याज के पत्तो से गार्निश करें। टोफू फ्राइड राइस को वेज मंचूरियन के साथ वीकेंड के भोजन के लिए परोसे।
","To make Tofu Fried Rice, first wash the rice and soak it in water and keep it aside for 15 minutes. Now put the rice in a saucepan with bay leaves and salt and cook till half cooked. Take out the water, add cinnamon powder and keep it aside. Now heat oil in a pan. Add tofu to it and cook till it turns brown on both sides. Remove from the pan and keep aside. Add some more oil to the same pan. After the oil is hot, add garlic to it and let it cook for 30 seconds. Now add green onions and onions. Cook onion until it becomes soft. After softening, add ginger garlic paste and mix. After 1 minute add capsicum, carrot and mushrooms. Cook until the vegetables are cooked. Now add all the sauces in it and mix. Add salt according to taste. Add pieces of tofu, rice and mix. Allow to cook for 2 to 3 minutes and then garnish with green onion leaves. Serve Tofu Fried Rice with Veg Manchurian for a weekend meal.",http://www.archanaskitchen.com/tofu-fried-rice-recipe-in-hindi
4733,Strawberry Cheesecake Muffins Recipe,Strawberry Cheesecake Muffins Recipe,"225 grams Britannia Cream Cheese - (at room temperature),2-1/2 cups All Purpose Flour (Maida),3/4 cup Caster Sugar - (1/4 + 1/2),2 teaspoons Baking powder,1/4 teaspoon Salt,1 Whole Egg,1-1/4 cups Milk,1/3 cup Butter - melted,1/2 cup Strawberries - chopped,1/4 teaspoon Vanilla Extract","225 grams Britannia Cream Cheese - (at room temperature),2-1/2 cups All Purpose Flour (Maida),3/4 cup Caster Sugar - (1/4 + 1/2),2 teaspoons Baking powder,1/4 teaspoon Salt,1 Whole Egg,1-1/4 cups Milk,1/3 cup Butter - melted,1/2 cup Strawberries - chopped,1/4 teaspoon Vanilla Extract",15,40,55,6,Continental,Dessert,Eggetarian,"To begin making the Strawberry Cheesecake Muffins Recipe, first prep all the ingredients and get them ready.In a large mixing bowl, add the cream cheese and 1/4 cup sugar, using a hand mixer beat well until light and fluffy. Add 1/4 cup fresh chopped strawberries in it and fold it in with help of spoon or fork. Keep the cream cheese batter aside.In a mixing bowl, sift the flour, baking powder and salt, keep aside.In a large mixing bowl, using a hand mixer, beat together the egg, 1/2 cup of sugar.In a separate bowl, beat together egg, milk, rest of the sugar (1/2 cup), butter and vanilla extract. Gradually add the flour mixture and beat until the cake is well combined. Add the remaining strawberries into the cake mixture and fold it in.Preheat the oven to 180 C and grease the muffin pan or line it with muffins paper. Spoon half the cake batter into the bottom of the pan. Next, spoon the cream cheese batter on the top and another spoon of the cake batter.Essentially the cream cheese batter is sandwiched between the cake batter.Once done, place the Strawberry Cheesecake Muffin in the oven and set it to bake for 12 to 15 minutes, until a tester inserted inside comes out almost clean. There will be a few crumbs of the cheesecake that will be stuck to the tester, and that's ok.Once done, remove from the oven and set it to cool completely.Once cooled, the Strawberry Cheesecake Muffins are ready to be served during tea time or as a dessert.
","To begin making the Strawberry Cheesecake Muffins Recipe, first prep all the ingredients and get them ready.In a large mixing bowl, add the cream cheese and 1/4 cup sugar, using a hand mixer beat well until light and fluffy. Add 1/4 cup fresh chopped strawberries in it and fold it in with help of spoon or fork. Keep the cream cheese batter aside.In a mixing bowl, sift the flour, baking powder and salt, keep aside.In a large mixing bowl, using a hand mixer, beat together the egg, 1/2 cup of sugar.In a separate bowl, beat together egg, milk, rest of the sugar (1/2 cup), butter and vanilla extract. Gradually add the flour mixture and beat until the cake is well combined. Add the remaining strawberries into the cake mixture and fold it in.Preheat the oven to 180 C and grease the muffin pan or line it with muffins paper. Spoon half the cake batter into the bottom of the pan. Next, spoon the cream cheese batter on the top and another spoon of the cake batter.Essentially the cream cheese batter is sandwiched between the cake batter.Once done, place the Strawberry Cheesecake Muffin in the oven and set it to bake for 12 to 15 minutes, until a tester inserted inside comes out almost clean. There will be a few crumbs of the cheesecake that will be stuck to the tester, and that's ok.Once done, remove from the oven and set it to cool completely.Once cooled, the Strawberry Cheesecake Muffins are ready to be served during tea time or as a dessert.",https://www.archanaskitchen.com/strawberry-cheesecake-muffins-recipe
4735,Perfect Gooey Mozzarella Garlic Bread Recipe,Perfect Gooey Mozzarella Garlic Bread Recipe,"4 Pav buns,1 to 2 tablespoons Extra Virgin Olive Oil,2 tablespoons Salted butter - softened,2 tablespoons Garlic - finely chopped,Black pepper powder - as required,1 cup Mozzarella cheese - shredded,1 tablespoon Parsley leaves - finely chopped,Mixed Herbs (Dried) - for  seasoning,1 teaspoon Coriander (Dhania) Leaves - finely chopped","4 Pav buns,1 to 2 tablespoons Extra Virgin Olive Oil,2 tablespoons Salted butter - softened,2 tablespoons Garlic - finely chopped,Black pepper powder - as required,1 cup Mozzarella cheese - shredded,1 tablespoon Parsley leaves - finely chopped,Mixed Herbs (Dried) - for  seasoning,1 teaspoon Coriander (Dhania) Leaves - finely chopped",10,10,20,4,Fusion,Appetizer,Vegetarian,"To begin making the Perfect Gooey Mozzarella Garlic Bread, preheat the oven to 200 degrees C.Stir together the butter, oil, garlic and parsley in a small bowl.Cut the buns into half horizontally and place the top side of the bun facing down on a baking tray.Using a pastry brush, butter them with the garlic mixture. Top each pav with generous amount of cheese and a sprinkle of black pepper and Italian seasoning.Bake at 200 degree C for 5 to 6 minutes until bubbly with some golden spots - note to check them often. The cheese will also melt. You don't need to toast these buns.Garnish with coriander and some melted butter. Serve Perfect Gooey Mozzarella Garlic Bread along with Desi Style Masala Pasta or or along with Roasted Vegetable Pizza Recipe With Oat Flour Crust for a perfect weekend dinner.
","To begin making the Perfect Gooey Mozzarella Garlic Bread, preheat the oven to 200 degrees C.Stir together the butter, oil, garlic and parsley in a small bowl.Cut the buns into half horizontally and place the top side of the bun facing down on a baking tray.Using a pastry brush, butter them with the garlic mixture. Top each pav with generous amount of cheese and a sprinkle of black pepper and Italian seasoning.Bake at 200 degree C for 5 to 6 minutes until bubbly with some golden spots - note to check them often. The cheese will also melt. You don't need to toast these buns.Garnish with coriander and some melted butter. Serve Perfect Gooey Mozzarella Garlic Bread along with Desi Style Masala Pasta or or along with Roasted Vegetable Pizza Recipe With Oat Flour Crust for a perfect weekend dinner.
",https://www.archanaskitchen.com/perfect-gooey-mozzarella-garlic-bread-recipe
4736,Bengali Style Dhokar Dalna Recipe (Spiced Lentil Cakes in Tomato Gravy Recipe),Bengali Style Dhokar Dalna Recipe (Spiced Lentil Cakes in Tomato Gravy Recipe),"1/2 cup Chana dal (Bengal Gram Dal),1/2 cup White Urad Dal (Whole),1/2 inch Ginger - grated,1 Green Chilli - chopped,2 teaspoon Cumin seeds (Jeera) - roasted,Salt - to taste,1 teaspoon Sugar,1 Tomato - blanched and pureed,1 Potato (Aloo) - cubed,1 inch Ginger - grated,2 Green Chillies - finely chopped,1 teaspoon Turmeric powder (Haldi),2 teaspoon Red Chilli powder,2 teaspoon Cumin powder (Jeera),1 teaspoon Coriander Powder (Dhania),1 Bay leaf (tej patta),2 Cardamom (Elaichi) Pods/Seeds,1 inch Cinnamon Stick (Dalchini),1/2 teaspoon Cumin seeds (Jeera),Ghee - for cooking","1/2 cup Chana dal (Bengal Gram Dal),1/2 cup White Urad Dal (Whole),1/2 inch Ginger - grated,1 Green Chilli - chopped,2 teaspoon Cumin seeds (Jeera) - roasted,Salt - to taste,1 teaspoon Sugar,1 Tomato - blanched and pureed,1 Potato (Aloo) - cubed,1 inch Ginger - grated,2 Green Chillies - finely chopped,1 teaspoon Turmeric powder (Haldi),2 teaspoon Red Chilli powder,2 teaspoon Cumin powder (Jeera),1 teaspoon Coriander Powder (Dhania),1 Bay leaf (tej patta),2 Cardamom (Elaichi) Pods/Seeds,1 inch Cinnamon Stick (Dalchini),1/2 teaspoon Cumin seeds (Jeera),Ghee - for cooking",180,45,225,4,Bengali Recipes,Main Course,Vegetarian,"We begin making the Bengali Style Dhokar Dalna Recipe (Spiced Lentil Cakes in Tomato Gravy Recipe) by soaking the dal for at least three hours. Then into the grinder, add all the ingredients along with the dal and little water and grind it into a smooth rice batter consistency.Pour the batter into the Dhokla Pan and steam it for about 30 minutes. Till it is firm and not sticky. Place it outside and let it cool. Cut into diamonds and pan fry them using a shallow frying pan till it is brown and crisp on either side.Next for the gravy blanch the tomatoes in boiling water over a sauce pan for about 2 minutes. Then remove the skin and blitz it in a mixer to a smooth puree.Heat a kadai with oil and add ingredient along with the ginger that are mentioned in the seasoning list. Let it sauté for few minutes. Then add the tomato puree, along with all the spice and sauté till the raw smell goes away. Add 1 cup water and let it simmer for about 20 minutes.Once done add in the cakes and can served by sprinkling chopped coriander leaves.Serve the Bengali Style Dhokar Dalna Recipe (Spiced Lentil Cakes in Tomato Gravy Recipe) along with Hot Phulka to enjoy your meal.
","We begin making the Bengali Style Dhokar Dalna Recipe (Spiced Lentil Cakes in Tomato Gravy Recipe) by soaking the dal for at least three hours. Then into the grinder, add all the ingredients along with the dal and little water and grind it into a smooth rice batter consistency.Pour the batter into the Dhokla Pan and steam it for about 30 minutes. Till it is firm and not sticky. Place it outside and let it cool. Cut into diamonds and pan fry them using a shallow frying pan till it is brown and crisp on either side.Next for the gravy blanch the tomatoes in boiling water over a sauce pan for about 2 minutes. Then remove the skin and blitz it in a mixer to a smooth puree.Heat a kadai with oil and add ingredient along with the ginger that are mentioned in the seasoning list. Let it sauté for few minutes. Then add the tomato puree, along with all the spice and sauté till the raw smell goes away. Add 1 cup water and let it simmer for about 20 minutes.Once done add in the cakes and can served by sprinkling chopped coriander leaves.Serve the Bengali Style Dhokar Dalna Recipe (Spiced Lentil Cakes in Tomato Gravy Recipe) along with Hot Phulka to enjoy your meal.",http://www.archanaskitchen.com/bengali-style-dhokar-dalna-recipe-spiced-lentil-cakes-in-tomato-gravy-recipe
4737,Gan Bian Dou Jiao Recipe (Dry Fried Sichuan Haricot Beans),Gan Bian Dou Jiao Recipe (Dry Fried Sichuan Haricot Beans),"400 grams Green beans (French Beans) - trimmed and halved,2 teaspoons Red Chilli sauce,4 cloves Garlic - finely chopped,2 inch Ginger - finely chopped,3 Spring Onion Greens - finely chopped,1 tablespoon Honey,1 teaspoon Soy sauce,Salt - to taste","400 grams Green beans (French Beans) - trimmed and halved,2 teaspoons Red Chilli sauce,4 cloves Garlic - finely chopped,2 inch Ginger - finely chopped,3 Spring Onion Greens - finely chopped,1 tablespoon Honey,1 teaspoon Soy sauce,Salt - to taste",10,15,25,4,Sichuan,Appetizer,Vegetarian,"To begin making the Stir Fried Sichuan String Bean Recipe (Gan Bian Dou Jiao Recipe), first prep all the ingredients. Steam the green beans along with salt on high for about 5 minutes until just about done. The beans have to be still crunchy, drain it under cold water in order to stop cooking.Heat oil in a heavy bottomed pan over medium heat, add the ginger, garlic, and spring onions and saute until the aromas come through.Add honey, salt, soy sauce, Sichuan sauce and the steamed green beans and toss on high heat until the beans are well coated with the spices and flavors.Check the salt and adjust to suit your taste. Once done, turn off the heat and serve.Serve the Stir Fried Sichuan String Bean Recipe (Gan Bian Dou Jiao Recipe), along with Chinese Sichuan fried rice or Chinese Vegetable Fried Rice for a delicious weekend dinner.
","To begin making the Stir Fried Sichuan String Bean Recipe (Gan Bian Dou Jiao Recipe), first prep all the ingredients. Steam the green beans along with salt on high for about 5 minutes until just about done. The beans have to be still crunchy, drain it under cold water in order to stop cooking.Heat oil in a heavy bottomed pan over medium heat, add the ginger, garlic, and spring onions and saute until the aromas come through.Add honey, salt, soy sauce, Sichuan sauce and the steamed green beans and toss on high heat until the beans are well coated with the spices and flavors.Check the salt and adjust to suit your taste. Once done, turn off the heat and serve.Serve the Stir Fried Sichuan String Bean Recipe (Gan Bian Dou Jiao Recipe), along with Chinese Sichuan fried rice or Chinese Vegetable Fried Rice for a delicious weekend dinner.
",http://www.archanaskitchen.com/gan-bian-dou-jiao-recipe-dry-fried-sichuan-string-beans
4740,कर्नाटका स्टाइल सोरक्कै पाल्या रेसिपी - Karnataka Style Sorakkai Palya (Recipe In Hindi), Karnataka Style Sorakkai Palya (Recipe In Hindi),"1 लौकी - छीलकर काट ले,1 टमाटर - काट ले,1 छोटा चमच्च जीरा,1 छोटा चमच्च हल्दी पाउडर,1 छोटा चमच्च लाल मिर्च पाउडर,2 बड़े चमच्च सांबर पाउडर,1 टहनी कढ़ी पत्ता,नमक - स्वाद अनुसार,तेल - प्रयोग अनुसार","1 gourd - peel and chop, 1 tomato - chopped, 1 teaspoon cumin seeds, 1 teaspoon turmeric powder, 1 teaspoon red chilli powder, 2 tablespoons sambar powder, 1 sprig curry leaves, salt - as per taste, oil - use accordingly",10,30,40,3,Karnataka,Lunch,Vegetarian,"कर्नाटका स्टाइल सोरक्कै पाल्या बनाने के लिए सबसे पहले एक प्रेशर कुकर में तेल गरम कर ले. इसमें जीरा, कढ़ी पत्ता डाले और 10 सेकण्ड्स के लिए पका ले. अब इसमें टमाटर, नमक डाले और टमाटर के नरम होने तक पका ले. टमाटर के नरम होने के बाद इसमें हल्दी पाउडर, लाल मिर्च पाउडर, सांबर पाउडर, लौकी डाले और अच्छी तरह से मिला ले. 2 मिनट के बाद इसमें 1/2 कप पानी डाले, कुकर बंद करें और 3 सिटी आने तक पका ले. प्रेशर अपने आप निकलने दे. कुकर खोले और परोसे।कर्नाटका स्टाइल सोरक्कै पाल्या को किरई सांबर और चावल के साथ दिन के खाने के लिए परोसे।  
","To make Karnataka Style Soraakkai Palya, first heat the oil in a pressure cooker. Add cumin seeds, curry leaves and cook for 10 seconds. Now add tomatoes, salt and cook till the tomatoes become soft. After the tomato becomes soft, add turmeric powder, red chili powder, sambar powder, gourd and mix it well. After 2 minutes, add 1/2 cup of water to it, close the cooker and cook till 3 cities come. Let the pressure drain automatically. Open and serve the cooker. Serve the Karnatka Style Sorakka Palya with Kirai Sambar and rice for dinner.",https://www.archanaskitchen.com/karnataka-style-sorakkai-palya-recipe-pressure-cooked-bottle-gourd-recipe-in-hindi
