Srno,RecipeName,TranslatedRecipeName,Ingredients,TranslatedIngredients,PrepTimeInMins,CookTimeInMins,TotalTimeInMins,Servings,Cuisine,Course,Diet,Instructions,TranslatedInstructions,URL
1271,Chow Chow Sambar Recipe (Chayote Squash Sambar),Chow Chow Sambar Recipe (Chayote Squash Sambar),"1 cup Arhar dal (Split Toor Dal),2 cups Chow chow (chayote squash) - cut into cubes,30 grams Tamarind - soaked in 1 cup of water,1 Onion - sliced,2 Tomatoes - chopped,1 tablespoon Sambar Powder,1/4 teaspoon Turmeric powder (Haldi),4 sprig Coriander (Dhania) Leaves - roughly chopped,Sunflower Oil - as required,Salt - as required,1 teaspoon Sesame (Gingelly) Oil - or vegetable oil,1 teaspoon Mustard seeds,1/4 teaspoon Asafoetida (hing),1 Dry Red Chillies,1 sprig Curry leaves - roughly torn","1 cup Arhar dal (Split Toor Dal),2 cups Chow chow (chayote squash) - cut into cubes,30 grams Tamarind - soaked in 1 cup of water,1 Onion - sliced,2 Tomatoes - chopped,1 tablespoon Sambar Powder,1/4 teaspoon Turmeric powder (Haldi),4 sprig Coriander (Dhania) Leaves - roughly chopped,Sunflower Oil - as required,Salt - as required,1 teaspoon Sesame (Gingelly) Oil - or vegetable oil,1 teaspoon Mustard seeds,1/4 teaspoon Asafoetida (hing),1 Dry Red Chillies,1 sprig Curry leaves - roughly torn",10,30,40,4,South Indian Recipes,Lunch,High Protein Vegetarian,"To begin making the Chow Chow Sambar recipe, first pressure cook the toor dal along with turmeric and 2 cups of water for 2 whistles. Let the pressure release naturally. Once the dal is cooked, whisk the dal well and keep it aside.Add a teaspoon of oil in a heavy bottoemd pan and heat it on a medium flame, add the sliced onion and saute for 2 minutes till the onions turns soft and translucent.Add tomatoes, chow chow and cook till the chow chow is cooked 3/4th, stirring occasionally.Once it is done, add the tamarind extract, sambar powder, salt to taste and let it simmer until the raw smell of the tamarind goes away and the chow chow is perfectly cooked.Add the cooked toor dal, adjust the seasoning, add the roughly chopped coriander leaves and let it simmer for another 2 or 3 minutes and switch off.In another small tadka pan, add a teaspoon of sesame oil and allow it to heat. Once the oil is heated up, add the mustard seeds, the dry red chilies and allow it to roast until lightly browned.Add the asafoetida powder and curry leaves, stir it in and turn off the heat.Pour this tempering over the cooked sambar and it is ready to be served. Serve Chow-Chow Sambar with Homemade Soft Idli or Masala Dosa. You can even serve it with Steamed Rice and Cauliflower Thoran for your vegetarian lunch or dinner.
","To begin making the Chow Chow Sambar recipe, first pressure cook the toor dal along with turmeric and 2 cups of water for 2 whistles. Let the pressure release naturally. Once the dal is cooked, whisk the dal well and keep it aside.Add a teaspoon of oil in a heavy bottoemd pan and heat it on a medium flame, add the sliced onion and saute for 2 minutes till the onions turns soft and translucent.Add tomatoes, chow chow and cook till the chow chow is cooked 3/4th, stirring occasionally.Once it is done, add the tamarind extract, sambar powder, salt to taste and let it simmer until the raw smell of the tamarind goes away and the chow chow is perfectly cooked.Add the cooked toor dal, adjust the seasoning, add the roughly chopped coriander leaves and let it simmer for another 2 or 3 minutes and switch off.In another small tadka pan, add a teaspoon of sesame oil and allow it to heat. Once the oil is heated up, add the mustard seeds, the dry red chilies and allow it to roast until lightly browned.Add the asafoetida powder and curry leaves, stir it in and turn off the heat.Pour this tempering over the cooked sambar and it is ready to be served. Serve Chow-Chow Sambar with Homemade Soft Idli or Masala Dosa. You can even serve it with Steamed Rice and Cauliflower Thoran for your vegetarian lunch or dinner.",https://www.archanaskitchen.com/chow-chow-sambar-chayote-squash-sambar-recipe
1272,Muttaikose Poriyal Recipe -  Purple Cabbage Poriyal | Red Cabbage Sabzi,Muttaikose Poriyal Recipe -  Purple Cabbage Poriyal | Red Cabbage Sabzi,"500 grams Purple cabbage - roughly chopped or sliced thin,Salt - to taste,2 tablespoons Water,1 teaspoon Coconut Oil,1 teaspoon Mustard seeds,2 teaspoons White Urad Dal (Split),2 sprig Curry leaves - finely chopped,1/4 teaspoon Asafoetida (hing),2 Green Chillies - slit,1/4 cup Fresh coconut - grated","500 grams Purple cabbage - roughly chopped or sliced thin,Salt - to taste,2 tablespoons Water,1 teaspoon Coconut Oil,1 teaspoon Mustard seeds,2 teaspoons White Urad Dal (Split),2 sprig Curry leaves - finely chopped,1/4 teaspoon Asafoetida (hing),2 Green Chillies - slit,1/4 cup Fresh coconut - grated",15,30,45,3,South Indian Recipes,Side Dish,No Onion No Garlic (Sattvic),"To begin making the Muttaikose Poriyal Recipe/ Purple Cabbage Poriyal, get the cabbage chopped or sliced and the rest of the ingredients ready.Place the purple cabbage in pressure cooker, add 2 tablespoon of water and pressure cook for 1 whistle and turn off the heat. Release the pressure immediately, to avoid over cooking the cabbage.Heat a teaspoon of oil a heavy-bottomed pan on medium heat.Add the mustard seeds and urad dal. Allow them to crackle. Roast the urad dal until it gets lightly browned.Once the dal is golden brown and crisp, add the curry leaves, green chillies, purple cabbage and salt to taste.Give the Purple Cabbage Poriyal a stir and saute for a couple of minutes and turn off the heat.Once done, add the grated coconut, give the Purple Cabbage Poriyal a mix and check the salt and adjust to suit your taste.Add more coconut if required. Turn off the heat and serve the Muttaikose Poriyal / Purple Cabbage Poriyal warm.Serve the Muttaikose Poriyal Recipe/ Purple Cabbage Poriyal along with Tomato Rasam and Steamed Rice topped with ghee for lunch or dinner.
","To begin making the Muttaikose Poriyal Recipe/ Purple Cabbage Poriyal, get the cabbage chopped or sliced and the rest of the ingredients ready.Place the purple cabbage in pressure cooker, add 2 tablespoon of water and pressure cook for 1 whistle and turn off the heat. Release the pressure immediately, to avoid over cooking the cabbage.Heat a teaspoon of oil a heavy-bottomed pan on medium heat.Add the mustard seeds and urad dal. Allow them to crackle. Roast the urad dal until it gets lightly browned.Once the dal is golden brown and crisp, add the curry leaves, green chillies, purple cabbage and salt to taste.Give the Purple Cabbage Poriyal a stir and saute for a couple of minutes and turn off the heat.Once done, add the grated coconut, give the Purple Cabbage Poriyal a mix and check the salt and adjust to suit your taste.Add more coconut if required. Turn off the heat and serve the Muttaikose Poriyal / Purple Cabbage Poriyal warm.Serve the Muttaikose Poriyal Recipe/ Purple Cabbage Poriyal along with Tomato Rasam and Steamed Rice topped with ghee for lunch or dinner.",http://www.archanaskitchen.com/muttaikose-poriyal-recipe-purple-cabbage-poriyal
1274,Basil Pesto Grilled Chicken Recipe,Basil Pesto Grilled Chicken Recipe,"1 Chicken breasts,1 tablespoon Fresh cream,1 teaspoon Lemon juice,2 tablespoons Garlic Butter,250 grams Basil leaves - with stems removed,1/4 cup Walnuts - toasted,4 cloves Garlic - finely chopped,Salt - to taste,1 tablespoon Whole Black Peppercorns - coarsely pounded,2 tablespoons Extra Virgin Olive Oil,1/2 cup Parmesan cheese - grated","1 Chicken breasts,1 tablespoon Fresh cream,1 teaspoon Lemon juice,2 tablespoons Garlic Butter,250 grams Basil leaves - with stems removed,1/4 cup Walnuts - toasted,4 cloves Garlic - finely chopped,Salt - to taste,1 tablespoon Whole Black Peppercorns - coarsely pounded,2 tablespoons Extra Virgin Olive Oil,1/2 cup Parmesan cheese - grated",70,20,90,1,Continental,Main Course,High Protein Non Vegetarian,"To begin making the Basil Pesto Grilled Chicken Recipe, make the fresh basil pesto and keep it ready.For the Basil PestoPlace the walnuts,garlic, basil leaves, salt, and pepper in the food processor and churn until coarse. With the processor running, slowly pour the olive oil into the bowl through the feed tube and process until the pesto is thoroughly pureed.Add the Parmesan and puree for a minute. In a mixing bowl, marinade the chicken breast along with the basil pesto, cream, and lemon juice. Let it sit for about an hour.Heat a grill pan/skillet on medium flame, put some garlic butter and place the chicken breast on it. Cook till the chicken is completely cooked through. IT will take about 8 to ten minutes on either sides to cook the chicken. Once done transfer the Basil Pesto Grilled Chicken onto a serving plate and serve hot.Serve Basil Pesto Grilled Chicken Recipe with Summer Lettuce Salad Recipe and French Onion Soup Recipe for lunch or dinner.
","To begin making the Basil Pesto Grilled Chicken Recipe, make the fresh basil pesto and keep it ready.For the Basil PestoPlace the walnuts,garlic, basil leaves, salt, and pepper in the food processor and churn until coarse. With the processor running, slowly pour the olive oil into the bowl through the feed tube and process until the pesto is thoroughly pureed.Add the Parmesan and puree for a minute. In a mixing bowl, marinade the chicken breast along with the basil pesto, cream, and lemon juice. Let it sit for about an hour.Heat a grill pan/skillet on medium flame, put some garlic butter and place the chicken breast on it. Cook till the chicken is completely cooked through. IT will take about 8 to ten minutes on either sides to cook the chicken. Once done transfer the Basil Pesto Grilled Chicken onto a serving plate and serve hot.Serve Basil Pesto Grilled Chicken Recipe with Summer Lettuce Salad Recipe and French Onion Soup Recipe for lunch or dinner.",https://www.archanaskitchen.com/basil-pesto-grilled-chicken-recipe
1275,Menthya Matvadi Palya Recipe - Madhwa Brahmin Style Methi-Chana Dal Sabzi,Menthya Matvadi Palya Recipe - Madhwa Brahmin Style Methi-Chana Dal Sabzi,"50 grams Methi Leaves (Fenugreek Leaves),1 tablespoon Sunflower Oil,1 teaspoon Mustard seeds,1 sprig Curry leaves,2 Dry Red Chillies,Salt - to taste,1/2 cup Chana dal (Bengal Gram Dal) - soaked for 2 hours,1/2 cup Fresh coconut - grated,6 Dry Red Chillies,1 teaspoon Coriander (Dhania) Seeds,Curry leaves - few,1 teaspoon Cumin seeds (Jeera),1/4 teaspoon Turmeric powder (Haldi),1/4 teaspoon Asafoetida (hing)","50 grams Methi Leaves (Fenugreek Leaves),1 tablespoon Sunflower Oil,1 teaspoon Mustard seeds,1 sprig Curry leaves,2 Dry Red Chillies,Salt - to taste,1/2 cup Chana dal (Bengal Gram Dal) - soaked for 2 hours,1/2 cup Fresh coconut - grated,6 Dry Red Chillies,1 teaspoon Coriander (Dhania) Seeds,Curry leaves - few,1 teaspoon Cumin seeds (Jeera),1/4 teaspoon Turmeric powder (Haldi),1/4 teaspoon Asafoetida (hing)",120,15,135,4,Karnataka,Side Dish,Diabetic Friendly,"To prepare Matwadi Palya Recipe (Madhwa Brahmin Style Methi-Chana Dal Sabzi); drain the water from the soaked channa dal and grind all the ingredients mentioned under ""to grind"" adding very little water to make a coarse paste.In a steamer, steam the ground masala till soft, for about 10 minutes on high heat using Idli molds.Meanwhile, wash and chop the methi leaves finely.In a kadai, heat oil and mustard seeds and allow it to splutter, add the red chillies and curry leaves and roast for a few seconds.Add finely chopped methi leaves and salt and allow it to wilt down. Once the methi leaves are cooked, add the ground chana dal mixture and mix them and allow it to cook on low flame till everything combines well. Turn off heat. Check the salt and adjust accordingly to taste.Serve Matwadi Palya Recipe (Madhwa Brahmin Style Methi-Chana Dal Sabzi) along with Tawa paratha, Karnataka Special Huli Tovve Recipe and steamed rice for lunch or dinner.
","To prepare Matwadi Palya Recipe (Madhwa Brahmin Style Methi-Chana Dal Sabzi); drain the water from the soaked channa dal and grind all the ingredients mentioned under ""to grind"" adding very little water to make a coarse paste.In a steamer, steam the ground masala till soft, for about 10 minutes on high heat using Idli molds.Meanwhile, wash and chop the methi leaves finely.In a kadai, heat oil and mustard seeds and allow it to splutter, add the red chillies and curry leaves and roast for a few seconds.Add finely chopped methi leaves and salt and allow it to wilt down. Once the methi leaves are cooked, add the ground chana dal mixture and mix them and allow it to cook on low flame till everything combines well. Turn off heat. Check the salt and adjust accordingly to taste.Serve Matwadi Palya Recipe (Madhwa Brahmin Style Methi-Chana Dal Sabzi) along with Tawa paratha, Karnataka Special Huli Tovve Recipe and steamed rice for lunch or dinner.",https://www.archanaskitchen.com/matwadi-palya-recipe-madhwa-brahmin-style-methi-chana-dal-sabzi
1276,Goan Sorak Curry Recipe,Goan Sorak Curry Recipe,"1 cup Fresh coconut - grated,6 Kashmiri dry red chilli,3 cloves Garlic,1 Onion,2 tablespoon Coriander (Dhania) Seeds,3/4 teaspoon Cumin seeds (Jeera),1/2 teaspoon Turmeric powder (Haldi),Water - as required,1 tablespoon Sunflower Oil,6 Kokum (Malabar Tamarind),2 Green Chillies - slit,1 teaspoon Jaggery,Salt - to taste,Coriander (Dhania) Leaves - chopped","1 cup Fresh coconut - grated,6 Kashmiri dry red chilli,3 cloves Garlic,1 Onion,2 tablespoon Coriander (Dhania) Seeds,3/4 teaspoon Cumin seeds (Jeera),1/2 teaspoon Turmeric powder (Haldi),Water - as required,1 tablespoon Sunflower Oil,6 Kokum (Malabar Tamarind),2 Green Chillies - slit,1 teaspoon Jaggery,Salt - to taste,Coriander (Dhania) Leaves - chopped",15,15,30,4,Goan Recipes,Dinner,Vegetarian,"To begin making the Goan Sorak Curry recipe, in a mixer jar take all the ingredients mentioned under Masala to grind. Add a little water and grind to a very smooth paste. Keep it aside.Next, heat oil in a heavy bottomed pan. Once it's hot, add the ground masala and slit green chilli into it. Saute for 2 to 3 minutes on low flame.Later add water, salt to taste, jaggery and kokum. Mix well and allow the curry to simmer for few mins till it starts bubbling. Switch off the gas. Garnish with coriander leaves.Serve Goan Sorak Curry along with Steamed Rice and Suran Fodi for your weekday meal.
","To begin making the Goan Sorak Curry recipe, in a mixer jar take all the ingredients mentioned under Masala to grind. Add a little water and grind to a very smooth paste. Keep it aside.Next, heat oil in a heavy bottomed pan. Once it's hot, add the ground masala and slit green chilli into it. Saute for 2 to 3 minutes on low flame.Later add water, salt to taste, jaggery and kokum. Mix well and allow the curry to simmer for few mins till it starts bubbling. Switch off the gas. Garnish with coriander leaves.Serve Goan Sorak Curry along with Steamed Rice and Suran Fodi for your weekday meal.",https://www.archanaskitchen.com/goan-sorak-curry-recipe
1277,Stir Fried Tofu and Celery Recipe,Stir Fried Tofu and Celery Recipe,"1 cup Tofu,2 tablespoon Corn flour,2 teaspoon Black pepper powder,1 teaspoon Soy sauce,Salt - to taste,1 Onion - chopped,1 cup Celery - chopped,1 tablespoon Ginger Garlic Paste,2 tablespoon Green Chilli Sauce,1 tablespoon Soy sauce,1 teaspoon Sugar,1 tablespoon Black pepper powder","1 cup Tofu,2 tablespoon Corn flour,2 teaspoon Black pepper powder,1 teaspoon Soy sauce,Salt - to taste,1 Onion - chopped,1 cup Celery - chopped,1 tablespoon Ginger Garlic Paste,2 tablespoon Green Chilli Sauce,1 tablespoon Soy sauce,1 teaspoon Sugar,1 tablespoon Black pepper powder",10,15,25,4,Asian,Lunch,Vegan,"We begin making the Stir Fried Tofu and Celery Recipe by mixing the cornstarch, soy, pepper powder, salt in a bowl with 1/4 cup water. Mix well.Heat a flat skillet with oil, once it is hot, dip the cubed tofu into the cornstarch batter and carefully fry them on both the sides till it is golden brown.Once done, keep them aside. In the same skillet add the onion and ginger garlic paste and saute till it is translucent.Then add in the celery and the fried tofu along with the sauces and the seasonings mentioned in the list. Check for seasoning.Keep stir frying till the celery is cooked well and not too soft.Serve the Stir Fried Tofu and Celery Recipe along with Quick Cauliflower Fried Rice Recipe to have a good meal for your Sunday lunch.
","We begin making the Stir Fried Tofu and Celery Recipe by mixing the cornstarch, soy, pepper powder, salt in a bowl with 1/4 cup water. Mix well.Heat a flat skillet with oil, once it is hot, dip the cubed tofu into the cornstarch batter and carefully fry them on both the sides till it is golden brown.Once done, keep them aside. In the same skillet add the onion and ginger garlic paste and saute till it is translucent.Then add in the celery and the fried tofu along with the sauces and the seasonings mentioned in the list. Check for seasoning.Keep stir frying till the celery is cooked well and not too soft.Serve the Stir Fried Tofu and Celery Recipe along with Quick Cauliflower Fried Rice Recipe to have a good meal for your Sunday lunch.",https://www.archanaskitchen.com/stir-fried-tofu-and-celery-recipe
1278,Ice Wine Panna Cotta Recipe,Ice Wine Panna Cotta Recipe,"2-1/2 cups Heavy whipping cream,3/4 cup Sugar,2 tablespoons Lemon juice,1/2 cup Ice wine - (or any other sweet dessert wine),Blackberries - or any berries for garnish","2-1/2 cups Heavy whipping cream,3/4 cup Sugar,2 tablespoons Lemon juice,1/2 cup Ice wine - (or any other sweet dessert wine),Blackberries - or any berries for garnish",10,10,20,6,Italian Recipes,Dessert,Vegetarian,"To begin making Ice Wine Panna Cotta Recipe, pour cream and sugar into a saucepan and heat on low heat just until the sugar dissolves; stir occasionally, not to let it char.Once the sugar has dissolved, take the cream off the heat and stir in the lemon juice and wine.Wait for about 10 minutes, pour the dessert mixture into serving glasses and chill overnight.Once the dessert is chilled, top each glass with fresh fruit if you like,  just before serving.Serve Ice Wine Panna Cotta Recipe along with Cucumbertini Recipe (A Refreshing Cucumber Cocktail) or Watermelon-Cranberry Mocktail Recipe during cocktail parties.
","To begin making Ice Wine Panna Cotta Recipe, pour cream and sugar into a saucepan and heat on low heat just until the sugar dissolves; stir occasionally, not to let it char.Once the sugar has dissolved, take the cream off the heat and stir in the lemon juice and wine.Wait for about 10 minutes, pour the dessert mixture into serving glasses and chill overnight.Once the dessert is chilled, top each glass with fresh fruit if you like,  just before serving.Serve Ice Wine Panna Cotta Recipe along with Cucumbertini Recipe (A Refreshing Cucumber Cocktail) or Watermelon-Cranberry Mocktail Recipe during cocktail parties.",https://www.archanaskitchen.com/ice-wine-panna-cotta-recipe
1279,Danyachi Amti Recipe (Maharashtrian Style Groundnut Curry),Danyachi Amti Recipe (Maharashtrian Style Groundnut Curry),"1 cup Raw Peanuts (Moongphali) - roasted,2-1/2 cups Water,2 teaspoon Sugar,1/4 cup Buttermilk - or 4-5 pieces amsul (dried kokum skin),2 teaspoons Cumin seeds (Jeera),Ghee - as required,3-4 Green Chillies - finely chopped,Salt - to taste (or kala namak when fasting),3 sprig Coriander (Dhania) Leaves - chopped","1 cup Raw Peanuts (Moongphali) - roasted,2-1/2 cups Water,2 teaspoon Sugar,1/4 cup Buttermilk - or 4-5 pieces amsul (dried kokum skin),2 teaspoons Cumin seeds (Jeera),Ghee - as required,3-4 Green Chillies - finely chopped,Salt - to taste (or kala namak when fasting),3 sprig Coriander (Dhania) Leaves - chopped",0,15,15,2,Maharashtrian Recipes,Lunch,Vegetarian,"To begin making the Danyachi amti recipe (groundnut Amti), first grind the groundnuts to a fine paste in a blender. Use water as required for blending.In a saucepan, heat the peanut paste along with water, salt, amsul (if using) and sugar.Boil for 5-6 minutes until all the raw smell goes away.If using buttermilk, add it once the groundnut amti has boiled.Take it off the heat.In a small pan, heat a little ghee.Add cumin seeds and once they sizzle, add green chillies.Sauté for a few seconds and add this tempering to the groundnut Amti.Garnish Danyachi Amti Recipe (Maharashtrian Style Groundnut Curry) with chopped coriander leaves to garnish and to side it up with Sabudana Khichdi.
","To begin making the Danyachi amti recipe (groundnut Amti), first grind the groundnuts to a fine paste in a blender. Use water as required for blending.In a saucepan, heat the peanut paste along with water, salt, amsul (if using) and sugar.Boil for 5-6 minutes until all the raw smell goes away.If using buttermilk, add it once the groundnut amti has boiled.Take it off the heat.In a small pan, heat a little ghee.Add cumin seeds and once they sizzle, add green chillies.Sauté for a few seconds and add this tempering to the groundnut Amti.Garnish Danyachi Amti Recipe (Maharashtrian Style Groundnut Curry) with chopped coriander leaves to garnish and to side it up with Sabudana Khichdi.",http://www.archanaskitchen.com/danyachi-amti-recipe-maharashtrian-style-groundnut-curry
1280,Pacha Payir Kulambu Recipe (South Indian Style Green Gram Curry),Pacha Payir Kulambu Recipe (South Indian Style Green Gram Curry),"1 cup Green Moong Dal (Whole),1 Onion - finely chopped,1 Tomato - finely chopped,2 Green Chillies - slit,2 Dry Red Chillies,Asafoetida (hing) - a pinch,1/4 teaspoon Turmeric powder (Haldi),1/2 teaspoon Red Chilli powder,1 teaspoon Coriander Powder (Dhania),1 teaspoon Sambar Powder,Salt - as required,1/2 teaspoon Mustard seeds,1 teaspoon Cumin seeds (Jeera),2 teaspoons Sunflower Oil","1 cup Green Moong Dal (Whole),1 Onion - finely chopped,1 Tomato - finely chopped,2 Green Chillies - slit,2 Dry Red Chillies,Asafoetida (hing) - a pinch,1/4 teaspoon Turmeric powder (Haldi),1/2 teaspoon Red Chilli powder,1 teaspoon Coriander Powder (Dhania),1 teaspoon Sambar Powder,Salt - as required,1/2 teaspoon Mustard seeds,1 teaspoon Cumin seeds (Jeera),2 teaspoons Sunflower Oil",140,20,160,4,South Indian Recipes,Lunch,High Protein Vegetarian,"To begin making the Pacha Payir Kulambu recipe, wash the green gram and soak in water for 2 hours. Once done, add it to pressure cooker along with required water. Pressure cook for 5-6 whistles.Once the pressure seizes, open the lid, slightly mash the green gram with ladle. Mashing it is optional.Heat a heavy bottomed pan with oil on a medium flame. Add mustard seeds and cumin seeds. Once it splutters, add asafoetida, slitted green chilli and red chilli.Add chopped onion and saute until translucent. Add chopped tomatoes and cook until mushy.Once the tomatoes are mushy, add cooked green gram along with required water for the gravy.Add salt, turmeric powder, chilli powder, coriander powder and sambar powder to it. Mix well, cover the pan and  cook for 10-15 minutes on a low flame.Once everything is combined well turn off the flame and garnish the kulambu with coriander leaves.Serve Pacha Payir Kulambu along with Beetroot Thoran and Steamed Rice for a weekday meal.
","To begin making the Pacha Payir Kulambu recipe, wash the green gram and soak in water for 2 hours. Once done, add it to pressure cooker along with required water. Pressure cook for 5-6 whistles.Once the pressure seizes, open the lid, slightly mash the green gram with ladle. Mashing it is optional.Heat a heavy bottomed pan with oil on a medium flame. Add mustard seeds and cumin seeds. Once it splutters, add asafoetida, slitted green chilli and red chilli.Add chopped onion and saute until translucent. Add chopped tomatoes and cook until mushy.Once the tomatoes are mushy, add cooked green gram along with required water for the gravy.Add salt, turmeric powder, chilli powder, coriander powder and sambar powder to it. Mix well, cover the pan and  cook for 10-15 minutes on a low flame.Once everything is combined well turn off the flame and garnish the kulambu with coriander leaves.Serve Pacha Payir Kulambu along with Beetroot Thoran and Steamed Rice for a weekday meal.",http://www.archanaskitchen.com/pacha-payir-kulambu-recipe-south-indian-style-green-gram-curry
