Srno,RecipeName,TranslatedRecipeName,Ingredients,TranslatedIngredients,PrepTimeInMins,CookTimeInMins,TotalTimeInMins,Servings,Cuisine,Course,Diet,Instructions,TranslatedInstructions,URL
6446,Plum Panna Shot Recipe,Plum Panna Shot Recipe,"6 Plums - red and firm,Jaggery - or sugar as required,2 teaspoon Cumin powder (Jeera),6 Mint Leaves (Pudina),Black Salt (Kala Namak) - as required,Water - chilled as required","6 Plums - red and firm,Jaggery - or sugar as required,2 teaspoon Cumin powder (Jeera),6 Mint Leaves (Pudina),Black Salt (Kala Namak) - as required,Water - chilled as required",15,0,15,4,Continental,Appetizer,Vegetarian,"To begin making the Plum Panna Shot Recipe, roast the plums on a gas stove till the skin is completely blackened.Place the roasted plums on a foil. Close and let them cool.Remove the skin and squeeze out the seeds and keep pulp aside.In a Blender, add pulp, jaggery/sugar, salt, cumin powder, and mint leaves. Blend to a smooth paste.You can strain the juice but it reduces the pulpiness which is delectable. (I skipped this step)Add chilled water, adjust salt and garnish with mint leaves.Serve the Plum Panna Shot Recipe as a starting drink for your party and have accompaniments like Pineapple and Cheese Skewers and Palak Pakora.
","To begin making the Plum Panna Shot Recipe, roast the plums on a gas stove till the skin is completely blackened.Place the roasted plums on a foil. Close and let them cool.Remove the skin and squeeze out the seeds and keep pulp aside.In a Blender, add pulp, jaggery/sugar, salt, cumin powder, and mint leaves. Blend to a smooth paste.You can strain the juice but it reduces the pulpiness which is delectable. (I skipped this step)Add chilled water, adjust salt and garnish with mint leaves.Serve the Plum Panna Shot Recipe as a starting drink for your party and have accompaniments like Pineapple and Cheese Skewers and Palak Pakora.",http://www.archanaskitchen.com/plum-panna-shots-recipe
6448,दाल शोरबा रेसिपी - Dal Shorba Recipe, Dal Shorba Recipe,"1/4 कप पिली मूंग दाल,1 प्याज,6 कली लहसुन,1/2 छोटा चमच्च अदरक पाउडर,1/4 छोटा चमच्च हल्दी पाउडर,1/3 छोटा चमच्च लाल मिर्च पाउडर,1/2 छोटा चमच्च काली मिर्च पाउडर,1 छोटा चमच्च जीरा,2 छोटे चमच्च नारियल का तेल,नमक - स्वाद अनुसार,2 कप पानी,हरा धनिया - गार्निश के लिए,1 छोटा चमच्च निम्बू का रस","1/4 कप पिली मूंग दाल,1 प्याज,6 कली लहसुन,1/2 छोटा चमच्च अदरक पाउडर,1/4 छोटा चमच्च हल्दी पाउडर,1/3 छोटा चमच्च लाल मिर्च पाउडर,1/2 छोटा चमच्च काली मिर्च पाउडर,1 छोटा चमच्च जीरा,2 छोटे चमच्च नारियल का तेल,नमक - स्वाद अनुसार,2 कप पानी,हरा धनिया - गार्निश के लिए,1 छोटा चमच्च निम्बू का रस",10,15,25,4,North Indian Recipes,Appetizer,Vegetarian,"दाल शोरबा रेसिपी बनाने के लिए सबसे पहले मूँद दाल को धो ले. इस दाल को प्रेशर कुकर में प्रयोग अनुसार पानी के साथ डाले और 2 सिटी आने तक पका ले. प्रेशर को अपने आप निकलने दे. कुकर खोले, दाल को हैंड ब्लेंडर की मदद से ब्लेंड कर ले. अलग से रख ले. एक कढ़ाई में तेल गरम कर ले. इसमें प्याज लहुसन डाले और प्याज के नरम होने तक पका ले. इसमें मैश दाल के साथ 2 कप पानी डाले।अब इसमें नमक, हल्दी पाउडर, अदरक पाउडर, काली मिर्च पाउडर, लाल मिर्च पाउडर डाले और मिला ले. 2 से 3 मिनट के लिए पकाए और बिच बिच में मिलाते रहे. पक जाने के बाद, गैस बंद करें और इसमें निम्बू का रस डाले। अलग से रख ले. तड़के ले लिए, एक तड़का पैन में तेल गरम कर ले. तेल गरम होने के बाद इसमें जीरा डाले और इसे तड़कने दे. गैस बंद कर ले. इस तड़के को दाल शोरबा में डाले और हरे धनिए से गार्निश करें। इस शोरबा को बाउल में डाले और क्रीम और जीरे से गार्निश करें। 
","To make dal broth recipe, first wash the moong dal. Pour this lentil in a pressure cooker with water as per use and cook it till 2 years come. Allow the pressure to drain automatically. Open the cooker, blend the lentils with the help of a hand blender. Keep it separately. Heat the oil in a pan. Add the onion garlic and cook till the onion becomes soft. Add 2 cups of water along with the mash lentils. Now add salt, turmeric powder, ginger powder, black pepper powder, red chili powder and mix it. Cook for 2 to 3 minutes and keep adding to the bitches. After cooking, turn off the gas and add lemon juice to it. Keep it separately. For tempering, heat oil in a tempering pan. After the oil is hot, add cumin seeds and let it crackle. Turn off the gas. Add this tempering to the dal broth and garnish with green coriander. Pour this broth in a bowl and garnish with cream and cumin seeds.",http://www.archanaskitchen.com/dal-shorba-recipe-indian-style-lentil-soup-in-hindi
6451,कसी हुई ककड़ी का रायता रेसिपी - Grated Cucumber Raita Recipe, Grated Cucumber Raita Recipe,"1 ककड़ी - कस ले,1 कप दही,1 छोटा चम्मच जीरा,1/2 बड़ा चम्मच लाल मिर्च पाउडर,नमक - स्वाद अनुसार,हरा धनिया - थोड़ा","1 ककड़ी - कस ले,1 कप दही,1 छोटा चम्मच जीरा,1/2 बड़ा चम्मच लाल मिर्च पाउडर,नमक - स्वाद अनुसार,हरा धनिया - थोड़ा",5,0,5,4,Indian,Side Dish,Vegetarian,"कसी हुई ककड़ी का रायता रेसिपी बनाने के लिए सबसे पहले हम जीरा को सेक लेंगे। एक कढ़ाई को गरम करें। इसमें जीरा डाले और उसके भूरे होने तक अच्छी तरह से सेक ले.हो जाने के बाद एक बाउल में निकाले और ठंडा होने दे. ठंडा होने के बाद एक हमानदस्ते में डाले और पीस ले. अब एक बाउल में दही डाले और अच्छी तरह से फेट ले. फटने के बाद इसमें ककड़ी, जीरा पाउडर, लाल मिर्च पाउडर, नमक, हरा धनिया डाले और अच्छी तरह से मिला ले. परोसे। कसी हुई ककड़ी का रायता रेसिपी को पंचमेल दाल, लौकी आलू की सब्ज़ी और फुल्के के साथ अपने रोज के खाने के लिए परोसे.
","To make grated cucumber raita recipe, we will first roast cumin seeds. Heat a pan. Add cumin seeds and roast it well until it turns brown. Once done, take it out in a bowl and let it cool. After it cools down, put it in a pan and grind it. Now pour yogurt in a bowl and beat well. After bursting, add cucumber, cumin powder, red chilli powder, salt, coriander and mix well. Serve. Serve grated cucumber raita recipe with punchy lentils, gourd potato vegetable and phulka for your daily dinner.",https://www.archanaskitchen.com/grated-cucumber-raita-recipe-in-hindi
6452,Garlic Spaghetti with Roasted Red Bell Pepper Sauce Recipe (Vegan),Garlic Spaghetti with Roasted Red Bell Pepper Sauce Recipe (Vegan),"100 grams Spaghetti Pasta - cooked,1 tablespoon Extra Virgin Olive Oil,4 cloves Garlic - sliced,1/2 teaspoon Red Chilli flakes,1/2 teaspoon Rosemary - or any herb of your choice,1 Red Bell pepper (Capsicum),6 cloves Garlic,2 teaspoon Corn flour,1 teaspoon Red Chilli flakes,Salt - to taste","100 grams Spaghetti Pasta - cooked,1 tablespoon Extra Virgin Olive Oil,4 cloves Garlic - sliced,1/2 teaspoon Red Chilli flakes,1/2 teaspoon Rosemary - or any herb of your choice,1 Red Bell pepper (Capsicum),6 cloves Garlic,2 teaspoon Corn flour,1 teaspoon Red Chilli flakes,Salt - to taste",10,20,30,2,Italian Recipes,Dinner,Vegetarian,"To begin making Garlic Spaghetti with Roasted Red Bell Pepper Sauce recipe (Vegan), first, cook the spaghetti to Al dente or follow the instructions given in the packet. Drain from the hot water and run it under cold water and keep it aside by tossing it with olive oil.To roast the red bell pepper over the stove top, apply a little oil on the bell pepper and roast it till all the sides are charred. Similarly, fork in the bulb of garlic and roast it over the flame.When it gets cooled, remove the outer skin of the red bell pepper, discard the seeds inside and roughly chop and blend the cooked flesh along with the de-skinned roasted garlic pods, red chili flakes and cornstarch powder and salt to a chunky paste using a stick blender or a mixer.Heat olive oil in a wide pan, add the sliced garlic and sauté till the garlic releases all its flavors into the oil and becomes light brown.Add the red chili flakes and dried rosemary and toss the cooked spaghetti int it for a few minutes.Season with salt and remove it in a bowl and keep it aside.To make the pasta sauce, in the same pan pour in the sauce paste that we prepared and add a little water and bring it to a rolling boil.Check for seasoning, add salt and let the sauce thicken to your desired consistency and switch off the flame.To serve the Garlic Spaghetti with Roasted Red Bell Pepper Sauce (Vegan), take a pasta bowl and pour a ladle full of sauce in it and swirl in a small portion of the garlic spaghetti on top. Garnish with dried rosemary if you desire.Serve this delicious Garlic Spaghetti with Roasted Red Bell Pepper Sauce (Vegan) for an interesting Italian weeknight dinner along with fresh lettuce salad and tiramisu.
","To begin making Garlic Spaghetti with Roasted Red Bell Pepper Sauce recipe (Vegan), first, cook the spaghetti to Al dente or follow the instructions given in the packet. Drain from the hot water and run it under cold water and keep it aside by tossing it with olive oil.To roast the red bell pepper over the stove top, apply a little oil on the bell pepper and roast it till all the sides are charred. Similarly, fork in the bulb of garlic and roast it over the flame.When it gets cooled, remove the outer skin of the red bell pepper, discard the seeds inside and roughly chop and blend the cooked flesh along with the de-skinned roasted garlic pods, red chili flakes and cornstarch powder and salt to a chunky paste using a stick blender or a mixer.Heat olive oil in a wide pan, add the sliced garlic and sauté till the garlic releases all its flavors into the oil and becomes light brown.Add the red chili flakes and dried rosemary and toss the cooked spaghetti int it for a few minutes.Season with salt and remove it in a bowl and keep it aside.To make the pasta sauce, in the same pan pour in the sauce paste that we prepared and add a little water and bring it to a rolling boil.Check for seasoning, add salt and let the sauce thicken to your desired consistency and switch off the flame.To serve the Garlic Spaghetti with Roasted Red Bell Pepper Sauce (Vegan), take a pasta bowl and pour a ladle full of sauce in it and swirl in a small portion of the garlic spaghetti on top. Garnish with dried rosemary if you desire.Serve this delicious Garlic Spaghetti with Roasted Red Bell Pepper Sauce (Vegan) for an interesting Italian weeknight dinner along with fresh lettuce salad and tiramisu.
",https://www.archanaskitchen.com/garlic-spaghetti-with-roasted-red-bell-pepper-sauce-recipe-vegan
6453,Shukto Recipe - Bengali Mixed Vegetable in Mustard and Poppy Seed Gravy,Shukto Recipe - Bengali Mixed Vegetable in Mustard and Poppy Seed Gravy,"1 Karela (Bitter Gourd/ Pavakkai) - small diced,1 Raw Banana - peeled and diced,1 Carrot (Gajjar) - peeled and diced,1 Potato (Aloo) - peeled and diced,1 Ridge Gourd (Turai/ Peerkangai) - peeled and diced,1 Drumstick - cut into 2 inch pieces,1 teaspoon Panch Phoran Masala,1 teaspoon Mustard seeds,2 teaspoons Poppy seeds,1/2 cup Milk,1 teaspoon Sugar,Salt - to taste,2 teaspoons Mustard oil,1/4 teaspoon Turmeric powder (Haldi),1 Bay leaf (tej patta),1 inch Ginger - grated,2 Green Chillies - slit,2 Dry Red Chillies - broken","1 Karela (Bitter Gourd/ Pavakkai) - small diced,1 Raw Banana - peeled and diced,1 Carrot (Gajjar) - peeled and diced,1 Potato (Aloo) - peeled and diced,1 Ridge Gourd (Turai/ Peerkangai) - peeled and diced,1 Drumstick - cut into 2 inch pieces,1 teaspoon Panch Phoran Masala,1 teaspoon Mustard seeds,2 teaspoons Poppy seeds,1/2 cup Milk,1 teaspoon Sugar,Salt - to taste,2 teaspoons Mustard oil,1/4 teaspoon Turmeric powder (Haldi),1 Bay leaf (tej patta),1 inch Ginger - grated,2 Green Chillies - slit,2 Dry Red Chillies - broken",20,20,40,4,Bengali Recipes,Lunch,Vegetarian,"To begin making the Shukto Recipe, first prepare all the vegetables and the ingredients and keep aside.Place all the vegetables including karela, raw banana, carrot, potato, ridge gourd, drumstick in the pressure cooker, sprinkle a little salt, 1/4 cup of water and cook for 3 to 4 whitles. After 3 to 4 whistles, turn off the heat and let the pressure release immediatlely by placing the cooker under running cold water. Open the lid and keep aside.Make a paste of 1 teaspoon of mustard seeds and 2 teaspoon of poppy seeds along with 1 ot 2 tablespoons of water. Heat mustard oil in a pan, add the ginger, bay leaf, green chillies, red chillies and stir fry for a few seconds.Next, add the turmeric powder, the poppy seed and mustard seed paste, the cooked vegetables, milk, salt and sugar. Stir well, add 1/4 cup of water and give the Shukto mixture a brisk boil.The Shukto will thicken as it is boiling and you can adjust the consistency by adding water or milk. Check the taste and adjust the salt accordingly.Once done, turn off the heat and serve immediately. Serve the Shukto along with Puri, Cholar Dal and Begun Bhaja for a delightful meal.
","To begin making the Shukto Recipe, first prepare all the vegetables and the ingredients and keep aside.Place all the vegetables including karela, raw banana, carrot, potato, ridge gourd, drumstick in the pressure cooker, sprinkle a little salt, 1/4 cup of water and cook for 3 to 4 whitles. After 3 to 4 whistles, turn off the heat and let the pressure release immediatlely by placing the cooker under running cold water. Open the lid and keep aside.Make a paste of 1 teaspoon of mustard seeds and 2 teaspoon of poppy seeds along with 1 ot 2 tablespoons of water. Heat mustard oil in a pan, add the ginger, bay leaf, green chillies, red chillies and stir fry for a few seconds.Next, add the turmeric powder, the poppy seed and mustard seed paste, the cooked vegetables, milk, salt and sugar. Stir well, add 1/4 cup of water and give the Shukto mixture a brisk boil.The Shukto will thicken as it is boiling and you can adjust the consistency by adding water or milk. Check the taste and adjust the salt accordingly.Once done, turn off the heat and serve immediately. Serve the Shukto along with Puri, Cholar Dal and Begun Bhaja for a delightful meal.",http://www.archanaskitchen.com/shukto-recipe-bengali-mixed-vegetable-in-mustard-and-poppy-seed-gravy
6454,येलो कुकुम्बर पछड़ी रेसिपी - Yellow Cucumber Pachadi (Recipe In Hindi), Yellow Cucumber Pachadi (Recipe In Hindi),"1 पिली ककड़ी,2 बड़े चमच्च तेल,1 छोटा चमच्च राइ,1 छोटा चमच्च मसूर दाल,1 छोटा चमच्च मेथी के दाने,5 सुखी लाल मिर्च,नमक - स्वाद अनुसार,1 हल्दी पाउडर,2 इमली,1 छोटा चमच्च हींग","1 पिली ककड़ी,2 बड़े चमच्च तेल,1 छोटा चमच्च राइ,1 छोटा चमच्च मसूर दाल,1 छोटा चमच्च मेथी के दाने,5 सुखी लाल मिर्च,नमक - स्वाद अनुसार,1 हल्दी पाउडर,2 इमली,1 छोटा चमच्च हींग",20,5,25,6,South Indian Recipes,Side Dish,Vegetarian,"येलो कुकुम्बर पछड़ी को बनाने के लिए सबसे पहले ककड़ी को धो कर छील ले. अब इसे बारीक काट ले. एक कढ़ाई में तेल गरम करें। इसमें राइ, मेथी, मसूर दाल डाले और 1 मिनट के लिए पका ले. उसके बाद इसमें सुखी लाल मिर्च। हींग डाले और 30 सेकण्ड्स तक पकने दे. गैस बंद करें और इसे ठंडा होने दे. ब्लेंडर में ऊपर बनाया हुआ 1/2 मिश्रण, नमक, हल्दी पाउडर और इमली डाले। पीस ले. इस मसाले को और बचे हुए तड़के को ककड़ी में अच्छी तरहसे मिलाए और परोसे। येलो कुकुम्बर पछड़ी को मिक्स्ड वेजिटेबल सांबर और फुल्के के साथ दिन के खाने के लिए परोसे।
","येलो कुकुम्बर पछड़ी को बनाने के लिए सबसे पहले ककड़ी को धो कर छील ले. अब इसे बारीक काट ले. एक कढ़ाई में तेल गरम करें। इसमें राइ, मेथी, मसूर दाल डाले और 1 मिनट के लिए पका ले. उसके बाद इसमें सुखी लाल मिर्च। हींग डाले और 30 सेकण्ड्स तक पकने दे. गैस बंद करें और इसे ठंडा होने दे. ब्लेंडर में ऊपर बनाया हुआ 1/2 मिश्रण, नमक, हल्दी पाउडर और इमली डाले। पीस ले. इस मसाले को और बचे हुए तड़के को ककड़ी में अच्छी तरहसे मिलाए और परोसे। येलो कुकुम्बर पछड़ी को मिक्स्ड वेजिटेबल सांबर और फुल्के के साथ दिन के खाने के लिए परोसे।
",https://www.archanaskitchen.com/yellow-cucumber-pachadi-recipe-in-hindi
6455,कुरुकु कालन रेसिपी - Kurukku Kaalan Recipe, Kurukku Kaalan Recipe,"2 कच्चा केला - छीलकर काट ले,1 छोटा चमच्च हल्दी पाउडर,1 कप दही,1/2 छोटा चमच्च हल्दी पाउडर,1/2 छोटा चमच्च लाल मिर्च पाउडर,नमक - स्वाद अनुसार,2 हरी मिर्च,1 छोटा चमच्च जीरा,1 कप नारियल - कस ले,1 छोटा चमच्च नारियल का तेल,1 छोटा चमच्च जीरा,1/2 छोटा चमच्च राइ,1/8 छोटा चमच्च मेथी के दाने,2 सुखी लाल मिर्च - बिच में से तोड़ ले,2 टहनी कढ़ी पत्ता","2 कच्चा केला - छीलकर काट ले,1 छोटा चमच्च हल्दी पाउडर,1 कप दही,1/2 छोटा चमच्च हल्दी पाउडर,1/2 छोटा चमच्च लाल मिर्च पाउडर,नमक - स्वाद अनुसार,2 हरी मिर्च,1 छोटा चमच्च जीरा,1 कप नारियल - कस ले,1 छोटा चमच्च नारियल का तेल,1 छोटा चमच्च जीरा,1/2 छोटा चमच्च राइ,1/8 छोटा चमच्च मेथी के दाने,2 सुखी लाल मिर्च - बिच में से तोड़ ले,2 टहनी कढ़ी पत्ता",25,30,55,4,Kerala Recipes,Side Dish,Vegetarian,"कुरुकु कालन बनाने के लिए सबसे पहले एक प्रेशर कुकर में कच्चा केला, हल्दी पाउडर, कढ़ी पत्ता, नमक, 1/4 कप पानी डाले और 2 सिटी आने तक पका ले. प्रेशर अपने आप निकलने दे.कुकर को खोले, इसमें दही और लाल मिर्च पाउडर डाले और अच्छी तरह से मिला ले. अलग से रख दे. अब एक मिक्सर ग्राइंडर में नारियल के साथ हरी मिर्च, जीरा डाले और पेस्ट बना ले. इस पिसे हुए मसाले को कुकर में डाले, गैस चालू करें और उबलने दे. जब तक कालन उबाल रहा है, हम इसके लिए तड़का बनाएँगे। एक तड़का पैन में नारियल का तेल गरम करें। इसमें राइ , जीरा, मेथी के दाने, कढ़ी पत्ता और सुखी लाल मिर्च डाले। 15 से 20 सेकण्ड्स के बाद, गैस बंद कर दे. कालन के उबाला आ जाने के बाद इस तड़के को ग्रेवी में डाले और मिला ले.गैस बंद करें और गरमा गरम परोसे। कुरुकु कालन को चावल, बीटरूट थोरन, पचड़ी और पापड़ के साथ दिन के खाने के लिए परोसे।
","To make Kuruku Kalan, first put raw banana, turmeric powder, curry leaves, salt, 1/4 cup of water in a pressure cooker and cook it till 2 city comes. Let the pressure drain automatically. Open the cooker, add curd and red chili powder to it and mix it well. Keep it aside. Now in a mixer grinder, add green chillies, cumin seeds along with coconut and make a paste. Pour this ground spice into the cooker, turn on the gas and allow it to boil. While the colon is boiling, we will make the tempering. Heat coconut oil in a tempering pan. Add mustard seeds, cumin seeds, fenugreek seeds, curry leaves and dry red chillies. After 15 to 20 seconds, turn off the gas. After the colons boil, add this tempering to the gravy and mix it. Turn off the gas and serve hot. Serve Kuruku Kalan with rice, beetroot thoran, pachdi and papad for the day's dinner.",https://www.archanaskitchen.com/kuruku-kaalan-recipe-raw-bananas-in-coconut-curry-in-hindi
