Srno,RecipeName,TranslatedRecipeName,Ingredients,TranslatedIngredients,PrepTimeInMins,CookTimeInMins,TotalTimeInMins,Servings,Cuisine,Course,Diet,Instructions,TranslatedInstructions,URL
6346,Udupi Tomato Rasam Recipe,Udupi Tomato Rasam Recipe,"1/2 cup Arhar dal (Split Toor Dal) - cooked,2 Tomatoes - cut into cubes,1 cup Tamarind Water,1 tablespoon Jaggery,2 sprig Coriander (Dhania) Leaves - finely chopped,1/2 teaspoon Methi Seeds (Fenugreek Seeds),1/2 teaspoon Mustard seeds,1 teaspoon Cumin seeds (Jeera),2 tablespoons Coriander (Dhania) Seeds,1 tablespoon Fresh coconut - grated,4 Dry Red Chillies,1/4 teaspoon Asafoetida (hing),1 sprig Curry leaves,1 tablespoon Ghee,1/2 teaspoon Mustard seeds,1 Dry Red Chilli,1 sprig Curry leaves","1/2 cup Arhar dal (Split Toor Dal) - cooked,2 Tomatoes - cut into cubes,1 cup Tamarind Water,1 tablespoon Jaggery,2 sprig Coriander (Dhania) Leaves - finely chopped,1/2 teaspoon Methi Seeds (Fenugreek Seeds),1/2 teaspoon Mustard seeds,1 teaspoon Cumin seeds (Jeera),2 tablespoons Coriander (Dhania) Seeds,1 tablespoon Fresh coconut - grated,4 Dry Red Chillies,1/4 teaspoon Asafoetida (hing),1 sprig Curry leaves,1 tablespoon Ghee,1/2 teaspoon Mustard seeds,1 Dry Red Chilli,1 sprig Curry leaves",10,45,55,4,Udupi,Main Course,Vegetarian,"We begin making the Udupi Tomato Rasam Recipe by pressure cooking the toor dal with water in a pressure for 4 whistle. Allow the pressure to release naturally, and once done mash the dal using a muddler.To make the rasam powder, dry roast the fenugreek seeds, mustard seeds, cumin seeds, coriander seeds, fresh coconut, dry red chilies, asafoetida, curry leaves in a small skillet on medium-low flame. Then grind into a smooth powder using a Mixer.In a large sauce pan, boil the tamarind water with tomatoes, green chillies, curry leaves, rasam powder and jaggery. Let it boil for at least 25 minutes. You can add sufficient water if it reduces.Then later on add the dal, check for the seasoning and mix well. Boil for another 10 minutes and then add the chopped coriander leaves.Heat another pan for tempering, add ghee, crackle mustard seeds and add the dry red chili and curry leaves. Pour it over the rasam and serve. Serve the Udupi Tomato Rasam Recipe along with steamed rice and Sabudana Sandige | Fryums Recipe to enjoy your week Night Dinner.
","We begin making the Udupi Tomato Rasam Recipe by pressure cooking the toor dal with water in a pressure for 4 whistle. Allow the pressure to release naturally, and once done mash the dal using a muddler.To make the rasam powder, dry roast the fenugreek seeds, mustard seeds, cumin seeds, coriander seeds, fresh coconut, dry red chilies, asafoetida, curry leaves in a small skillet on medium-low flame. Then grind into a smooth powder using a Mixer.In a large sauce pan, boil the tamarind water with tomatoes, green chillies, curry leaves, rasam powder and jaggery. Let it boil for at least 25 minutes. You can add sufficient water if it reduces.Then later on add the dal, check for the seasoning and mix well. Boil for another 10 minutes and then add the chopped coriander leaves.Heat another pan for tempering, add ghee, crackle mustard seeds and add the dry red chili and curry leaves. Pour it over the rasam and serve. Serve the Udupi Tomato Rasam Recipe along with steamed rice and Sabudana Sandige | Fryums Recipe to enjoy your week Night Dinner.
",http://www.archanaskitchen.com/udupi-tomato-rasam-recipe
6352,Sweet Dashami Recipe (Maharashtrian Flatbread Made With Wheat Flour & Sugarcane Juice),Sweet Dashami Recipe (Maharashtrian Flatbread Made With Wheat Flour & Sugarcane Juice),"3 cups Sugarcane Juice,1-1/2 cups Whole Wheat Flour,1/4 teaspoon Nutmeg powder - (optional),1 tablespoon Ghee - hot,1 pinch Salt","3 cups Sugarcane Juice,1-1/2 cups Whole Wheat Flour,1/4 teaspoon Nutmeg powder - (optional),1 tablespoon Ghee - hot,1 pinch Salt",15,20,35,4,Maharashtrian Recipes,Main Course,Vegetarian,"To begin making Sweet Dashami Recipe (Maharashtrian Flatbread Made With Wheat Flour & Sugarcane Juice), first boil the sugar cane juice in a saucepan on a low heat till it reduces to 1/3rd of its initial amount.Now, let it cool completely.In a mixing bowl, add the concentrated sugarcane juice, wheat flour, nutmeg powder (if using), salt, 1 tablespoon of hot oil or ghee, mix till crumbly. Then knead into a soft pliable dough. Use 1-2 tablespoons of water only if required.Pinch out 10-11 balls from the dough.Press each ball into a disc shape with your palm and then flatten further using a rolling pin into disc like small chapatis.Dip your finger tips in a little oil and smear on the flattened dough.Fold the flattened dough disc into a triangle.Lightly dust the working surface with some whole wheat flour.Roll it out into a thin circle of about 6-7 inches.Meanwhile, heat a non-stick griddle.Transfer the Sweet Dashami on the griddle and cook on a medium heat till brown spots appear.Flip and cook further on the other side till cooked and the spots appear.Repeat this with the rest of the dough balls.Smear some ghee on top of it and serve Sweet Dashami Recipe (Maharashtrian Flatbread Made With Wheat Flour & Sugarcane Juice) with Maharashtrian Amleche God Lonche Recipe or Kanda Kairichi Chutney Recipe or any chutney of your choice for a simple comforting breakfast or a light meal in the evening.
","To begin making Sweet Dashami Recipe (Maharashtrian Flatbread Made With Wheat Flour & Sugarcane Juice), first boil the sugar cane juice in a saucepan on a low heat till it reduces to 1/3rd of its initial amount.Now, let it cool completely.In a mixing bowl, add the concentrated sugarcane juice, wheat flour, nutmeg powder (if using), salt, 1 tablespoon of hot oil or ghee, mix till crumbly. Then knead into a soft pliable dough. Use 1-2 tablespoons of water only if required.Pinch out 10-11 balls from the dough.Press each ball into a disc shape with your palm and then flatten further using a rolling pin into disc like small chapatis.Dip your finger tips in a little oil and smear on the flattened dough.Fold the flattened dough disc into a triangle.Lightly dust the working surface with some whole wheat flour.Roll it out into a thin circle of about 6-7 inches.Meanwhile, heat a non-stick griddle.Transfer the Sweet Dashami on the griddle and cook on a medium heat till brown spots appear.Flip and cook further on the other side till cooked and the spots appear.Repeat this with the rest of the dough balls.Smear some ghee on top of it and serve Sweet Dashami Recipe (Maharashtrian Flatbread Made With Wheat Flour & Sugarcane Juice) with Maharashtrian Amleche God Lonche Recipe or Kanda Kairichi Chutney Recipe or any chutney of your choice for a simple comforting breakfast or a light meal in the evening.",http://www.archanaskitchen.com/sweet-dashami-recipe-maharashtrian-flatbread-made-with-wheat-flour-sugarcane-juice
6353,Ginger Brandy Cookie Recipe,Ginger Brandy Cookie Recipe,"2 cups All Purpose Flour (Maida),1/4 teaspoon Salt,1 teaspoon Baking powder,1 tablespoon Dry ginger powder,2 teaspoons Cinnamon Powder (Dalchini),1/2 cup Butter - softened,1/2 cup Sugar,1/4 cup Honey,1 Whole Eggs,2 tablespoons Brandy","2 cups All Purpose Flour (Maida),1/4 teaspoon Salt,1 teaspoon Baking powder,1 tablespoon Dry ginger powder,2 teaspoons Cinnamon Powder (Dalchini),1/2 cup Butter - softened,1/2 cup Sugar,1/4 cup Honey,1 Whole Eggs,2 tablespoons Brandy",20,45,65,6,Continental,Snack,Vegetarian,"To begin making the Ginger Brandy Cookie Recipe, cream the butter, sugar until light and fluffy. Add the honey, brandy and eggs and beat well until well combined.In a separate bowl, sift together the flour, salt, baking powder, ginger and cinnamon powder.  Gradually beat in the dry flour ingredients to the butter mixture. Combine well to form the cookie dough. Once it forms a cookie dough, cover with a clingfilm and refrigerate for 30 minutes.Preheat the oven to 180 C. Prepare the baking sheet by lining it with parchment paper.Shape the ginger brandy cookie dough into 1 inch balls and place them on the baking sheet. Bake for about 12 minutes, until just firm and a bit crisp around the edges. Remove the Ginger Brandy Cookies from the oven and transfer to a wire rack and let cool completely.Store the Ginger Brandy Cookies in airtight containers and serve as a snack for the holiday season. 
","To begin making the Ginger Brandy Cookie Recipe, cream the butter, sugar until light and fluffy. Add the honey, brandy and eggs and beat well until well combined.In a separate bowl, sift together the flour, salt, baking powder, ginger and cinnamon powder.  Gradually beat in the dry flour ingredients to the butter mixture. Combine well to form the cookie dough. Once it forms a cookie dough, cover with a clingfilm and refrigerate for 30 minutes.Preheat the oven to 180 C. Prepare the baking sheet by lining it with parchment paper.Shape the ginger brandy cookie dough into 1 inch balls and place them on the baking sheet. Bake for about 12 minutes, until just firm and a bit crisp around the edges. Remove the Ginger Brandy Cookies from the oven and transfer to a wire rack and let cool completely.Store the Ginger Brandy Cookies in airtight containers and serve as a snack for the holiday season. 
",https://www.archanaskitchen.com/ginger-brandy-cookie-recipe
6354,Potato Sagu Recipe for Rava Idli,Potato Sagu Recipe for Rava Idli,"3 Potatoes (Aloo) - boiled and mashed,1 Onion - finely chopped,2 Green Chillies - slit (adjust taste),1/2 inch Ginger - grated,2 sprig Curry leaves,1/2 teaspoon Mustard seeds,2 teaspoon White Urad Dal (Split),1 tablespoon Chana dal (Bengal Gram Dal),1/4 teaspoon Asafoetida (hing) - +a pinch,1/2 teaspoon Turmeric powder (Haldi),1 tablespoon Coriander Powder (Dhania),2 tablespoons Coriander (Dhania) Leaves - chopped,1 teaspoon Sugar,1/2-1 tablespoon Lemon juice,Salt - to taste,Sunflower Oil - as needed","3 Potatoes (Aloo) - boiled and mashed,1 Onion - finely chopped,2 Green Chillies - slit (adjust taste),1/2 inch Ginger - grated,2 sprig Curry leaves,1/2 teaspoon Mustard seeds,2 teaspoon White Urad Dal (Split),1 tablespoon Chana dal (Bengal Gram Dal),1/4 teaspoon Asafoetida (hing) - +a pinch,1/2 teaspoon Turmeric powder (Haldi),1 tablespoon Coriander Powder (Dhania),2 tablespoons Coriander (Dhania) Leaves - chopped,1 teaspoon Sugar,1/2-1 tablespoon Lemon juice,Salt - to taste,Sunflower Oil - as needed",20,35,55,4,South Indian Recipes,South Indian Breakfast,Vegetarian,"To begin making Potato Sagu Recipe for Rava Idli, get prepped up with all the ingredients. In a kadai, heat some oil and add mustard seeds and let the seeds splutter.Once they splutter, add chana dal and urad dal and saute till they change slightly brown in colour.Once done add curry leaves, a pinch of asafoetida, green chilies, and grated ginger and sauté it for a few seconds.After few seconds add onions, turmeric powder and a pinch of salt and cook until the onions are cooked but not browned.Once the onions are cooked add the mashed potatoes, remaining asafoetida and turmeric powder, coriander powder, chili powder, salt and sugar and stir well to combine.Add a cup of water and cook until you see a gravy consistency, continue to cook for 5-6 minutes on a low heat so that the potatoes absorb all the flavor.Once the potato sagu has reached the desired consistency add chopped coriander leaves and lemon juice. Stir to combine and turn off the heat.Transfer the potato sagu into a serving bowl and serve. Serve Potato Sagu Recipe for Rava Idli with Broccoli Rava Idli and Green Coriander Coconut Chutney for a wholesome breakfast.
","To begin making Potato Sagu Recipe for Rava Idli, get prepped up with all the ingredients. In a kadai, heat some oil and add mustard seeds and let the seeds splutter.Once they splutter, add chana dal and urad dal and saute till they change slightly brown in colour.Once done add curry leaves, a pinch of asafoetida, green chilies, and grated ginger and sauté it for a few seconds.After few seconds add onions, turmeric powder and a pinch of salt and cook until the onions are cooked but not browned.Once the onions are cooked add the mashed potatoes, remaining asafoetida and turmeric powder, coriander powder, chili powder, salt and sugar and stir well to combine.Add a cup of water and cook until you see a gravy consistency, continue to cook for 5-6 minutes on a low heat so that the potatoes absorb all the flavor.Once the potato sagu has reached the desired consistency add chopped coriander leaves and lemon juice. Stir to combine and turn off the heat.Transfer the potato sagu into a serving bowl and serve. Serve Potato Sagu Recipe for Rava Idli with Broccoli Rava Idli and Green Coriander Coconut Chutney for a wholesome breakfast.
",http://www.archanaskitchen.com/potato-sagu-recipe-for-rava-idli
6355,Homemade Mysore Pak Recipe | Traditional Recipe Made With Ghee,Homemade Mysore Pak Recipe | Traditional Recipe Made With Ghee,"1 cup Gram flour (besan),1-1/4 cups Ghee,1-1/4 cups Sugar,1 cup Water","1 cup Gram flour (besan),1-1/4 cups Ghee,1-1/4 cups Sugar,1 cup Water",15,20,35,12,Karnataka,Dessert,Vegetarian,"To begin making Homemade Mysore Pak Recipe, prep all the ingredients and keep them handy. Every step comes one after another and hence you need to keep them all ready and handy.Also grease a small rectangular or a square pan which can give you a decent height to be shaped into a Mysore Pak. Approximately 10 x 6 inches (outer edge) is the size of the pan (inner edge is  9 x 4 inches)In a heavy bottomed preheated over medium heat, roast the besan/ gram flour for about 2 to 3 minutes until you get a roasted aroma from the gram flour. This will help the raw smell go away from the besan. Ensure you take care not to allow it to brown or burn. Once roasted remove it into a bowl and keep aside.In a heavy bottomed non stick pan; add the sugar and water and bring the water to a boil ensuring the sugar dissolves completely in the water. Keep stirring so that the sugar dissolves well. Continue to allow the sugar water to boil - after about 4 minutes you will notice that the sugar water is getting bubbly and sticky as well. It will form a foamy texture.At this stage the consistency of the sugar water will be of a sticky and one string consistency.At this stage, turn the heat to low and add the gram flour into the sugar syrup and keep stirring it continuously so it combines well without any lumps and gets a smooth consistency. The heat needs to be on low from now on till the end of the making of Mysore Pak.Once the gram flour is combined well, add ghee little at a time and repeat the addition of ghee after 3-4 minutes of stirring. The 1-1/2 cups of ghee needs to be added in small batches with a space of 3 minutes between each turn.As you keep adding ghee and waiting for the next batch of ghee to be added, ensure that you keep stirring the Mysore Pak.Once the entire mass comes together and looks smooth, add the last portion of ghee and continue to stir till the whole masses rises up like froth and you will notice that the Mysore pak gets a very porous texture where you see the eye holes while stirring.Once it comes to this consistency, remove from the heat and pour the mysore pak mixture into the greased tray. Bang the tray lightly to allow the mass to spread all over and looks evenly spread.Dip a flat spatula with ghee and spread over the Mysore Pak to level it down and make it smooth from the top. Continue this light press and spread until the top of the Mysore Pak looks smooth.At this stage, using a knife, cut the Mysore Pak into rectangle or diamond shapes and allow the Mysore Pak to cool down completely.Once completely cooled, gently lift the Mysore Pak pieces out of the pan and serve.Store the Mysore Pak in airtight container for 1 week or in the refrigerator for 2 weeks.Serve Homemade Mysore Pak Recipe as a dessert after Onion Tomato Podi Masala Dosa Recipe and Chutney for breakfast or after lunch.
","To begin making Homemade Mysore Pak Recipe, prep all the ingredients and keep them handy. Every step comes one after another and hence you need to keep them all ready and handy.Also grease a small rectangular or a square pan which can give you a decent height to be shaped into a Mysore Pak. Approximately 10 x 6 inches (outer edge) is the size of the pan (inner edge is  9 x 4 inches)In a heavy bottomed preheated over medium heat, roast the besan/ gram flour for about 2 to 3 minutes until you get a roasted aroma from the gram flour. This will help the raw smell go away from the besan. Ensure you take care not to allow it to brown or burn. Once roasted remove it into a bowl and keep aside.In a heavy bottomed non stick pan; add the sugar and water and bring the water to a boil ensuring the sugar dissolves completely in the water. Keep stirring so that the sugar dissolves well. Continue to allow the sugar water to boil - after about 4 minutes you will notice that the sugar water is getting bubbly and sticky as well. It will form a foamy texture.At this stage the consistency of the sugar water will be of a sticky and one string consistency.At this stage, turn the heat to low and add the gram flour into the sugar syrup and keep stirring it continuously so it combines well without any lumps and gets a smooth consistency. The heat needs to be on low from now on till the end of the making of Mysore Pak.Once the gram flour is combined well, add ghee little at a time and repeat the addition of ghee after 3-4 minutes of stirring. The 1-1/2 cups of ghee needs to be added in small batches with a space of 3 minutes between each turn.As you keep adding ghee and waiting for the next batch of ghee to be added, ensure that you keep stirring the Mysore Pak.Once the entire mass comes together and looks smooth, add the last portion of ghee and continue to stir till the whole masses rises up like froth and you will notice that the Mysore pak gets a very porous texture where you see the eye holes while stirring.Once it comes to this consistency, remove from the heat and pour the mysore pak mixture into the greased tray. Bang the tray lightly to allow the mass to spread all over and looks evenly spread.Dip a flat spatula with ghee and spread over the Mysore Pak to level it down and make it smooth from the top. Continue this light press and spread until the top of the Mysore Pak looks smooth.At this stage, using a knife, cut the Mysore Pak into rectangle or diamond shapes and allow the Mysore Pak to cool down completely.Once completely cooled, gently lift the Mysore Pak pieces out of the pan and serve.Store the Mysore Pak in airtight container for 1 week or in the refrigerator for 2 weeks.Serve Homemade Mysore Pak Recipe as a dessert after Onion Tomato Podi Masala Dosa Recipe and Chutney for breakfast or after lunch.
",http://www.archanaskitchen.com/insant-mysore-pak-recipe
6358,Mushroom and Broccoli Soup Recipe,Mushroom and Broccoli Soup Recipe,"1 Broccoli - cut into florets,200 grams Button mushrooms - chopped,1 teaspoon Cumin seeds (Jeera) - crushed,2 teaspoons Whole Black Peppercorns - crushed,Salt - as required,2 tablespoons Fresh cream,Coriander (Dhania) Leaves - as required,1 teaspoon Sunflower Oil","1 Broccoli - cut into florets,200 grams Button mushrooms - chopped,1 teaspoon Cumin seeds (Jeera) - crushed,2 teaspoons Whole Black Peppercorns - crushed,Salt - as required,2 tablespoons Fresh cream,Coriander (Dhania) Leaves - as required,1 teaspoon Sunflower Oil",20,20,40,4,Continental,Appetizer,Vegetarian,"To begin making the Mushroom and Broccoli Soup recipe, wash the broccoli and mushrooms. Cut broccoli into florets and slice mushroom into pieces. Keep it aside.Heat oil in a pressure cooker. Once hot, add coarsely crushed cumin and whole black peppercorns. Saute for a minute.Now add broccoli and saute for a minute. Add mushrooms and saute until it starts leaving water.Pour 2 cups of water and add required salt. Stir well and pressure cook for 2 whistles.Once the pressure releases, open cooker and allow the Mushroom and Broccoli Soup to cool a bit. Now using hand blender, mash and blend everything until smooth.Pour the Mushroom and Broccoli Soup in soup bowl and add a tablespoon of fresh cream on top. Garnish with coriander leaves, crushed pepper and serve hot.Serve Mushroom and Broccoli Soup as a starter before your simple meal of Panchmel Dal, Aloo Bhindi Ki Sabzi and Phulka for a weekday meal.
","To begin making the Mushroom and Broccoli Soup recipe, wash the broccoli and mushrooms. Cut broccoli into florets and slice mushroom into pieces. Keep it aside.Heat oil in a pressure cooker. Once hot, add coarsely crushed cumin and whole black peppercorns. Saute for a minute.Now add broccoli and saute for a minute. Add mushrooms and saute until it starts leaving water.Pour 2 cups of water and add required salt. Stir well and pressure cook for 2 whistles.Once the pressure releases, open cooker and allow the Mushroom and Broccoli Soup to cool a bit. Now using hand blender, mash and blend everything until smooth.Pour the Mushroom and Broccoli Soup in soup bowl and add a tablespoon of fresh cream on top. Garnish with coriander leaves, crushed pepper and serve hot.Serve Mushroom and Broccoli Soup as a starter before your simple meal of Panchmel Dal, Aloo Bhindi Ki Sabzi and Phulka for a weekday meal.
",https://www.archanaskitchen.com/mushroom-broccoli-soup-recipe
6361,आलू गोभी मटर की सब्ज़ी रेसिपी - Aloo Gobhi Matar Ki Sabzi (Recipe In Hindi), Aloo Gobhi Matar Ki Sabzi (Recipe In Hindi),"1/2 किलो गोभी - छोटे टुकड़ो में काट ले,2 आलू,1 कप हरा मटर,2 छोटा चमच्च लाल मिर्च पाउडर,1 बड़ा चमच्च धनिया पाउडर,1 बड़ा चमच्च हल्दी पाउडर,2 बड़ा चमच्च प्याज - बारीक काट ले,1 छोटा चमच्च अदरक - बारीक काट ले,1 छोटा चमच्च मेथी के दाने,1 टहनी हरा धनिया - गार्निश के लिए,तेल - प्रयोग अनुसार,नमक - स्वाद अनुसार","1/2 किलो गोभी - छोटे टुकड़ो में काट ले,2 आलू,1 कप हरा मटर,2 छोटा चमच्च लाल मिर्च पाउडर,1 बड़ा चमच्च धनिया पाउडर,1 बड़ा चमच्च हल्दी पाउडर,2 बड़ा चमच्च प्याज - बारीक काट ले,1 छोटा चमच्च अदरक - बारीक काट ले,1 छोटा चमच्च मेथी के दाने,1 टहनी हरा धनिया - गार्निश के लिए,तेल - प्रयोग अनुसार,नमक - स्वाद अनुसार",15,35,50,4,North Indian Recipes,Lunch,Vegetarian,"आलू गोभी मटर की सब्ज़ी बनाने के लिए सबसे पहले गोभी को गरम पानी में भिगो ले. उसमे नमक डाले, मिलाए और ढक कर 10 मिनट के लिए अलग से रख ले. अब आलू को छील ले. धोकर उन्हें काट ले और ठन्डे पानी में भिगो दे. अब एक कढ़ाई में तेल गरम करें। उसमे मेथी के दाने डाले और 10 सेकण्ड्स बाद उसमे अदरक और प्याज डाले। प्याज के नरम होने तक पकाए और फिर उसमे गोभी, आलू और मटर डाले। मिलाए, कढ़ाई को ढ़के और 3 से 4 मिनट तक पकाए। 4 मिनट के बाद उसमे लाल मिर्च पाउडर, धनिया पाउडर, नमक डाले और मिला ले. सबको अच्छी तरह से मिला के ढक ले और 6 मिनट तक पकने दे. आलू गोभी मटर की सब्ज़ी को दाल तड़का, कचुम्बर सलाद और फुल्के के साथ दिन के खाने के लिए परोसे।
","To make potato cabbage pea vegetable, first soak the cabbage in hot water. Add salt to it, mix and cover and keep it aside for 10 minutes. Now peel the potatoes. Wash and cut them and soak them in cold water. Now heat oil in a pan. Add fenugreek seeds in it and after 10 seconds add ginger and onion. Cook till the onion becomes soft and then add cabbage, potatoes and peas. Mix, cover the pan and cook for 3 to 4 minutes. After 4 minutes, add red chili powder, coriander powder, salt and mix. Mix everything well and cover it and let it cook for 6 minutes. Serve Aloo Cauliflower Peas with Dal Tadka, Kachumbar Salad and Phulka for the day's dinner.",https://www.archanaskitchen.com/aloo-gobhi-matar-ki-sabzi-recipe-in-hindi
