Srno,RecipeName,TranslatedRecipeName,Ingredients,TranslatedIngredients,PrepTimeInMins,CookTimeInMins,TotalTimeInMins,Servings,Cuisine,Course,Diet,Instructions,TranslatedInstructions,URL
5559,Badami Paneer Masala Recipe -Paneer In Almond Gravy,Badami Paneer Masala Recipe -Paneer In Almond Gravy,"300 grams Paneer (Homemade Cottage Cheese) - cut into triangles,1/2 cup Badam (Almond),2 Onions - roughly chopped,4 Tomatoes - roughly chopped,1 tablespoon Ginger - roughly chopped,4 cloves Garlic,3 Dry Red Chillies,2 teaspoons Coriander Powder (Dhania),2 teaspoons Kashmiri Red Chilli Powder,1 teaspoon Garam masala powder,1/2 teaspoon Turmeric powder (Haldi),1/2 teaspoon Sugar,1 Bay leaf (tej patta),1 tablespoon Ghee - or oil,Salt - to taste","300 grams Paneer (Homemade Cottage Cheese) - cut into triangles,1/2 cup Badam (Almond),2 Onions - roughly chopped,4 Tomatoes - roughly chopped,1 tablespoon Ginger - roughly chopped,4 cloves Garlic,3 Dry Red Chillies,2 teaspoons Coriander Powder (Dhania),2 teaspoons Kashmiri Red Chilli Powder,1 teaspoon Garam masala powder,1/2 teaspoon Turmeric powder (Haldi),1/2 teaspoon Sugar,1 Bay leaf (tej patta),1 tablespoon Ghee - or oil,Salt - to taste",10,20,30,4,North Indian Recipes,Side Dish,High Protein Vegetarian,"To begin making Badami Paneer Masala Recipe, soak the almonds in a bowl of hot water for about 10 minutes, de-skin and keep them aside (or you can blanch them in microwave oven)Marinate the paneer in turmeric and a teaspoon of kashmiri red chilli powder and marinate for about 5 minutes.Puree the raw chopped tomatoes using a mixer grinder and keep aside.Make a fine paste of 1/4 cup almonds, ginger, garlic, onions and red chillies using a mixer grinder and keep aside.Heat a tablespoon of ghee or oil in a pan and shallow fry the marinated paneer till they are cooked to about 3/4th and keep aside.In the same pan on a medium heat, add the remaining tablespoon of ghee, add in the bay leaf and let it flavour the ghee for about half a minute.Once done, add the ground almond and onion paste, saute until the raw smell of the masala goes away.Add in the tomato puree and saute until the rawness of tomato is completely gone away and the onion paste is cooked as well.Add the coriander powder, kashmiri red chilli powder, garam masala and mix well.Add 1.5 cups of water, season with salt and bring it to a rolling boil.Now, add the partially fried paneer triangles, and the remaining almonds, simmer for 10 minutes.Switch off the heat and garnish with onion rings.Serve the Badami Paneer Masala Recipe along with Butter Naan Recipe, Bhindi Masala Recipe, Mooli Raita Recipe, and Khatti Meethi Dal Chawal Recipe for a Friday night dinner.
","To begin making Badami Paneer Masala Recipe, soak the almonds in a bowl of hot water for about 10 minutes, de-skin and keep them aside (or you can blanch them in microwave oven)Marinate the paneer in turmeric and a teaspoon of kashmiri red chilli powder and marinate for about 5 minutes.Puree the raw chopped tomatoes using a mixer grinder and keep aside.Make a fine paste of 1/4 cup almonds, ginger, garlic, onions and red chillies using a mixer grinder and keep aside.Heat a tablespoon of ghee or oil in a pan and shallow fry the marinated paneer till they are cooked to about 3/4th and keep aside.In the same pan on a medium heat, add the remaining tablespoon of ghee, add in the bay leaf and let it flavour the ghee for about half a minute.Once done, add the ground almond and onion paste, saute until the raw smell of the masala goes away.Add in the tomato puree and saute until the rawness of tomato is completely gone away and the onion paste is cooked as well.Add the coriander powder, kashmiri red chilli powder, garam masala and mix well.Add 1.5 cups of water, season with salt and bring it to a rolling boil.Now, add the partially fried paneer triangles, and the remaining almonds, simmer for 10 minutes.Switch off the heat and garnish with onion rings.Serve the Badami Paneer Masala Recipe along with Butter Naan Recipe, Bhindi Masala Recipe, Mooli Raita Recipe, and Khatti Meethi Dal Chawal Recipe for a Friday night dinner.",https://www.archanaskitchen.com/badami-paneer-masala-recipe-paneer-in-almond-gravy
5560,Dahi Wali Singhare Ki Sabzi Recipe,Dahi Wali Singhare Ki Sabzi Recipe,"300 grams Singhade (water chestnut),1 teaspoon Cumin seeds (Jeera),1 teaspoon Mustard seeds,1 Tomatoes - chopped,1 Green Chilli - slit,1/2 cup Curd (Dahi / Yogurt),1 teaspoon Gram flour (besan),1/2 teaspoon Turmeric powder (Haldi),1 teaspoon Coriander Powder (Dhania),1 teaspoon Black pepper powder,1 teaspoon Amchur (Dry Mango Powder),Salt - to taste,Sunflower Oil,1 sprig Coriander (Dhania) Leaves - chopped","300 grams Singhade (water chestnut),1 teaspoon Cumin seeds (Jeera),1 teaspoon Mustard seeds,1 Tomatoes - chopped,1 Green Chilli - slit,1/2 cup Curd (Dahi / Yogurt),1 teaspoon Gram flour (besan),1/2 teaspoon Turmeric powder (Haldi),1 teaspoon Coriander Powder (Dhania),1 teaspoon Black pepper powder,1 teaspoon Amchur (Dry Mango Powder),Salt - to taste,Sunflower Oil,1 sprig Coriander (Dhania) Leaves - chopped",10,30,40,4,North Indian Recipes,Side Dish,No Onion No Garlic (Sattvic),"To begin making the Dahi Wali Singhare ki Sabzi Recipe, pressure cook the water chestnuts along with their outer layer. Add about 1 cup of water and pressure cook for at least 4 whistles.Once done, peel the skin out and chop them into small pieces. Heat a kadai with oil, add mustard seeds, cumin seeds and allow them to crackle.In a separate bowl, mix curd along with besan, turmeric powder, coriander powder, black pepper powder, amchur and keep it aside.Into the hot pan, add chopped tomatoes and sprinkle a bit of salt and cook till it becomes mushy.Add the curd mixture, cooked water chestnuts and mix well. Add little water to adjust consistency.Check for seasonings and serve hot with chopped coriander leaves.Serve the Dahi Wali Singhare Ki Sabzi Recipe along with Thepla and Gujarati Dal Recipe to make it a good meal after fasting.
","To begin making the Dahi Wali Singhare ki Sabzi Recipe, pressure cook the water chestnuts along with their outer layer. Add about 1 cup of water and pressure cook for at least 4 whistles.Once done, peel the skin out and chop them into small pieces. Heat a kadai with oil, add mustard seeds, cumin seeds and allow them to crackle.In a separate bowl, mix curd along with besan, turmeric powder, coriander powder, black pepper powder, amchur and keep it aside.Into the hot pan, add chopped tomatoes and sprinkle a bit of salt and cook till it becomes mushy.Add the curd mixture, cooked water chestnuts and mix well. Add little water to adjust consistency.Check for seasonings and serve hot with chopped coriander leaves.Serve the Dahi Wali Singhare Ki Sabzi Recipe along with Thepla and Gujarati Dal Recipe to make it a good meal after fasting.",http://www.archanaskitchen.com/dahi-wali-singhade-ki-subzi-recipe
5562,Paneer Tikka Pulao Recipe,Paneer Tikka Pulao Recipe,"1-1/2 cups Basmati rice,1 Onion,1 Green Chilli,1 teaspoon Cumin seeds (Jeera),1 Cardamom (Elaichi) Pods/Seeds,1 inch Cinnamon Stick (Dalchini),2 Cloves (Laung),1 Bay leaf (tej patta),1/4 teaspoon Turmeric powder (Haldi),1/4 teaspoon Garam masala powder,2 teaspoon Sunflower Oil,Salt - as required,200 grams Paneer (Homemade Cottage Cheese) - cubed into 1 inch thick pieces,2 tablespoons Curd (Dahi / Yogurt),3 teaspoons Gram flour (besan),1 teaspoon Red Chilli powder,1/2 teaspoon Garam masala powder,1/2 teaspoon Kasuri Methi (Dried Fenugreek Leaves),1 tablespoon Ginger Garlic Paste,Coconut Oil - as required","1-1/2 cups Basmati rice,1 Onion,1 Green Chilli,1 teaspoon Cumin seeds (Jeera),1 Cardamom (Elaichi) Pods/Seeds,1 inch Cinnamon Stick (Dalchini),2 Cloves (Laung),1 Bay leaf (tej patta),1/4 teaspoon Turmeric powder (Haldi),1/4 teaspoon Garam masala powder,2 teaspoon Sunflower Oil,Salt - as required,200 grams Paneer (Homemade Cottage Cheese) - cubed into 1 inch thick pieces,2 tablespoons Curd (Dahi / Yogurt),3 teaspoons Gram flour (besan),1 teaspoon Red Chilli powder,1/2 teaspoon Garam masala powder,1/2 teaspoon Kasuri Methi (Dried Fenugreek Leaves),1 tablespoon Ginger Garlic Paste,Coconut Oil - as required",30,20,50,4,North Indian Recipes,Lunch,Vegetarian,"To begin making Paneer Tikka Pulao, we will wash and soak basmati rice in water for 30 minutes. The next step is to make the marinade for the paneer. In a large bowl, combine curd, gram flour, ginger garlic paste, red chilli powder, garam masala powder and little salt.Mix everything together into thick paste. Add paneer cubes to the paste and mix well so that the paste is well coated on each paneer cube. Cover and refrigerate for 30 minutes.Heat a griddle and add two teaspoons cooking oil, place the paneer cubes and fry until slightly golden on all sides. Remove from tawa and keep aside.The next step is to make the pulao. Heat a teaspoon of oil in a pressure cooker and add cumin seeds, cinnamon, cloves, cardamom and bay leaf. Saute for a minute.Add chopped onion and slitted green chilli. Saute until the onions turn soft and translucent.Once the onions turn soft, add the paneer tikkas, turmeric powder, garam masala powder and mix lightly without breaking the paneer cubes. Drain the soaked basmati rice from water and add to the pressure cooker. Saute for a minute until the masalas coat on to the rice.Add 3 cups of water along with required amount of salt. Mix well and bring the water to a boil.Close the cooker and pressure cook for a whistle. Once the pressure releases naturally, gently fluff the rice with a fork. Garnish with coriander leaves.Serve Paneer Tikka Pulao along with Tomato Onion Raita or Tadka Raita for a simple sunday lunch or pack it for lunch box on a weekday.
","To begin making Paneer Tikka Pulao, we will wash and soak basmati rice in water for 30 minutes. The next step is to make the marinade for the paneer. In a large bowl, combine curd, gram flour, ginger garlic paste, red chilli powder, garam masala powder and little salt.Mix everything together into thick paste. Add paneer cubes to the paste and mix well so that the paste is well coated on each paneer cube. Cover and refrigerate for 30 minutes.Heat a griddle and add two teaspoons cooking oil, place the paneer cubes and fry until slightly golden on all sides. Remove from tawa and keep aside.The next step is to make the pulao. Heat a teaspoon of oil in a pressure cooker and add cumin seeds, cinnamon, cloves, cardamom and bay leaf. Saute for a minute.Add chopped onion and slitted green chilli. Saute until the onions turn soft and translucent.Once the onions turn soft, add the paneer tikkas, turmeric powder, garam masala powder and mix lightly without breaking the paneer cubes. Drain the soaked basmati rice from water and add to the pressure cooker. Saute for a minute until the masalas coat on to the rice.Add 3 cups of water along with required amount of salt. Mix well and bring the water to a boil.Close the cooker and pressure cook for a whistle. Once the pressure releases naturally, gently fluff the rice with a fork. Garnish with coriander leaves.Serve Paneer Tikka Pulao along with Tomato Onion Raita or Tadka Raita for a simple sunday lunch or pack it for lunch box on a weekday.",http://www.archanaskitchen.com/paneer-tikka-pulao-recipe
5563,Bharma Baingan Ki Sabzi Recipe - Spicy Stuffed Brinjals,Bharma Baingan Ki Sabzi Recipe - Spicy Stuffed Brinjals,"6 Small Brinjal (Baingan / Eggplant),Sunflower Oil - as required,12 Garlic - cloves and make a paste of it,3 Onions,3 Green Chillies - paste,1/2 teaspoon Ginger - grated,Salt - as required,2 teaspoons Cumin powder (Jeera),2 teaspoons Garam masala powder,1 teaspoon Amchur (Dry Mango Powder),1 sprig Mint Leaves (Pudina),Salt - as required","6 Small Brinjal (Baingan / Eggplant),Sunflower Oil - as required,12 Garlic - cloves and make a paste of it,3 Onions,3 Green Chillies - paste,1/2 teaspoon Ginger - grated,Salt - as required,2 teaspoons Cumin powder (Jeera),2 teaspoons Garam masala powder,1 teaspoon Amchur (Dry Mango Powder),1 sprig Mint Leaves (Pudina),Salt - as required",10,45,55,3,Rajasthani,Lunch,Vegetarian,"To begin making the Bharma Baingan Ki Sabzi recipe, wash the brinjal well. Cut the brinjal into four peices keeping the stalk intact. Immerse these whole cut brinjal in salted water and set aside. For the Bharma Baingan filling Heat a pan on medium flame, with some oil, once hot, add garlic, ginger, green chilli, onions and fry till they are well roasted. This will take about 5 minutes. Turn off the flame, transfer the ingredients along with some salt into a mixer-jar and grind into a coarse mixture using no water at all. Transfer the masala into a bowl. divide the onion mixture into two bowls. Use one portion to stuff into the brinjals Now drain the brinjals which are immersed, pat dry the brinjals, and stuff the onion mixture into the slits. Heat a skillet with oil, on medium flame, place the stuffed brinjals and allow it to cook until the brinjals soften up. Cover and cook until it is done. Remove the cooked brinjal in a bowl and set aside. In the same pan, add the other portion of the onion masala, and add, cumin powder,  salt, garam masala powder, amchur powder, and finely chopped mint leaves. Mix well. To this mix add 1/3 cup of water and drop the cooked brinjal into this.Cook on high heat till the water evaporates and the masala has coated the brinjal well. Serve Bharma Baingan Ki Sabzi  with Panchmel Dal and hot Phulkas along with Beetroot, Carrot & Cucumber Salad with Peanuts Recipe and Spring Onion and Peanut Raita Recipe for a perfect weekday meal.
","To begin making the Bharma Baingan Ki Sabzi recipe, wash the brinjal well. Cut the brinjal into four peices keeping the stalk intact. Immerse these whole cut brinjal in salted water and set aside. For the Bharma Baingan filling Heat a pan on medium flame, with some oil, once hot, add garlic, ginger, green chilli, onions and fry till they are well roasted. This will take about 5 minutes. Turn off the flame, transfer the ingredients along with some salt into a mixer-jar and grind into a coarse mixture using no water at all. Transfer the masala into a bowl. divide the onion mixture into two bowls. Use one portion to stuff into the brinjals Now drain the brinjals which are immersed, pat dry the brinjals, and stuff the onion mixture into the slits. Heat a skillet with oil, on medium flame, place the stuffed brinjals and allow it to cook until the brinjals soften up. Cover and cook until it is done. Remove the cooked brinjal in a bowl and set aside. In the same pan, add the other portion of the onion masala, and add, cumin powder,  salt, garam masala powder, amchur powder, and finely chopped mint leaves. Mix well. To this mix add 1/3 cup of water and drop the cooked brinjal into this.Cook on high heat till the water evaporates and the masala has coated the brinjal well. Serve Bharma Baingan Ki Sabzi  with Panchmel Dal and hot Phulkas along with Beetroot, Carrot & Cucumber Salad with Peanuts Recipe and Spring Onion and Peanut Raita Recipe for a perfect weekday meal.",http://www.archanaskitchen.com/bharma-baingan-aur-pyaaz-ki-sabzi-recipe-spicy-stuffed-brinjals-with-onions
5564,No Bake Dragon Fruit Jam Tarts Recipe,No Bake Dragon Fruit Jam Tarts Recipe,"10 Dates - deseeded,7 Digestive biscuit,2 tablespoons Butter - (melted),1/2 Dragon fruit (Pitaya) - scooped,2 teaspoons Sugar,1 teaspoon Lemon juice,Strawberries - sliced","10 Dates - deseeded,7 Digestive biscuit,2 tablespoons Butter - (melted),1/2 Dragon fruit (Pitaya) - scooped,2 teaspoons Sugar,1 teaspoon Lemon juice,Strawberries - sliced",15,30,45,2,French,Dessert,Vegetarian,"For the Tart Crust:To begin making No Bake Dragon Fruit Jam Tarts Recipe, prepare tart crust first. In a mixer, take dates and crackers and grind till you get a smooth mixture.Now take the mixture in a bowl and gradually add about 2 tablespoons melted butter and mix well until the mixture resembles a dough.Line tart moulds with parchment paper. Divide crust between the moulds and press firmly using your hands to form a uniform crust. Press it more in the centre with your thumb to make space for our filling.Put in the freezer section of the refrigerator for about 10-15 minutes.For The Filling:Cut the dragon fruit into two halves and scoop out the flesh using a spoon. Take scooped flesh in a mixer/grinder and blend to a pulp.In a thick bottomed non-stick pan, combine dragon fruit pulp and sugar. Cook on a medium flame and simmer until it has a thick jam like consistency. Keep on stirring occasionally. This will take about 20-25 minutes.Once you notice that it has begun to thicken, add lemon juice to it. Stir well and cook for about a minute.Remove from flame and allow it to cool.Assembling:Take out the prepared tarts from the refrigerator.Put about a spoonful of dragon fruit jam on it.Garnish with sliced strawberry. Serve No Bake Dragon Fruit Jam Tarts Recipe chilled as a party dessert, along with appetizers like Vegetarian Chinese Samosa Recipe.
","For the Tart Crust:To begin making No Bake Dragon Fruit Jam Tarts Recipe, prepare tart crust first. In a mixer, take dates and crackers and grind till you get a smooth mixture.Now take the mixture in a bowl and gradually add about 2 tablespoons melted butter and mix well until the mixture resembles a dough.Line tart moulds with parchment paper. Divide crust between the moulds and press firmly using your hands to form a uniform crust. Press it more in the centre with your thumb to make space for our filling.Put in the freezer section of the refrigerator for about 10-15 minutes.For The Filling:Cut the dragon fruit into two halves and scoop out the flesh using a spoon. Take scooped flesh in a mixer/grinder and blend to a pulp.In a thick bottomed non-stick pan, combine dragon fruit pulp and sugar. Cook on a medium flame and simmer until it has a thick jam like consistency. Keep on stirring occasionally. This will take about 20-25 minutes.Once you notice that it has begun to thicken, add lemon juice to it. Stir well and cook for about a minute.Remove from flame and allow it to cool.Assembling:Take out the prepared tarts from the refrigerator.Put about a spoonful of dragon fruit jam on it.Garnish with sliced strawberry. Serve No Bake Dragon Fruit Jam Tarts Recipe chilled as a party dessert, along with appetizers like Vegetarian Chinese Samosa Recipe.",http://www.archanaskitchen.com/no-bake-dragon-fruit-jam-tarts-recipe
5565,Spinach Banana Muffin Recipe,Spinach Banana Muffin Recipe,"3 cups Baby spinach - (without stem),1 Ripe Bananas - peeled,1/2 cup Honey,1/4 cup Milk,1/2 Extra Virgin Olive Oil,1 Whole Egg,1 teaspoon Vanilla Extract,2 cups Whole Wheat Flour,1/2 teaspoon Salt,2 teaspoons Baking powder,1/2 teaspoon Baking soda,2 teaspoons Cinnamon Powder (Dalchini),1/2 teaspoon Mace powder","3 cups Baby spinach - (without stem),1 Ripe Bananas - peeled,1/2 cup Honey,1/4 cup Milk,1/2 Extra Virgin Olive Oil,1 Whole Egg,1 teaspoon Vanilla Extract,2 cups Whole Wheat Flour,1/2 teaspoon Salt,2 teaspoons Baking powder,1/2 teaspoon Baking soda,2 teaspoons Cinnamon Powder (Dalchini),1/2 teaspoon Mace powder",30,20,50,2,Continental,Snack,Eggetarian,"To begin making Spinach Banana Muffin Recipe, preheat oven into 350 F/ 180 C. Line up a muffin pan with cup cake liners, i used silicone muffin cup, greased with oil.First we will start mixing dry ingredients. In a mixing bowl add all dry ingredients and mix very well and keep aside.In a blender add all wet ingredients and blend very smooth, until no crumble left.Slowly add wet ingredients mixture into dry ingredients whisk thoroughly but don't over mix. Pour muffin batter into prepared muffin cups or muffin pan 1/3, left place for puffing.Bake 20 minutes or until toothpick insert came clean.Cool it  before serving or storing in container. It can be stored for upto 7 days.Serve Spinach Banana Muffin Recipe on breakfast with Chocolate Banana Smoothie Recipe, or for snacks along with Cold Coffee Smoothie Recipe.
","To begin making Spinach Banana Muffin Recipe, preheat oven into 350 F/ 180 C. Line up a muffin pan with cup cake liners, i used silicone muffin cup, greased with oil.First we will start mixing dry ingredients. In a mixing bowl add all dry ingredients and mix very well and keep aside.In a blender add all wet ingredients and blend very smooth, until no crumble left.Slowly add wet ingredients mixture into dry ingredients whisk thoroughly but don't over mix. Pour muffin batter into prepared muffin cups or muffin pan 1/3, left place for puffing.Bake 20 minutes or until toothpick insert came clean.Cool it  before serving or storing in container. It can be stored for upto 7 days.Serve Spinach Banana Muffin Recipe on breakfast with Chocolate Banana Smoothie Recipe, or for snacks along with Cold Coffee Smoothie Recipe.
",https://www.archanaskitchen.com/spinach-banana-muffin-recipe
5566,Muhammara Recipe - Roasted Red Bell Pepper & Walnut Dip,Muhammara Recipe - Roasted Red Bell Pepper & Walnut Dip,"2 Red Bell pepper (Capsicum),1 cup Walnuts - lightly toasted,1 teaspoon Cumin powder (Jeera),1 teaspoon Red Chilli flakes,2 teaspoons Jaggery - or pomegranate mollases,2 teaspoons Lemon juice - freshly squeezed,2 tablespoons Extra Virgin Olive Oil,4 tablespoons Whole Wheat Bread crumbs,Salt - to taste","2 Red Bell pepper (Capsicum),1 cup Walnuts - lightly toasted,1 teaspoon Cumin powder (Jeera),1 teaspoon Red Chilli flakes,2 teaspoons Jaggery - or pomegranate mollases,2 teaspoons Lemon juice - freshly squeezed,2 tablespoons Extra Virgin Olive Oil,4 tablespoons Whole Wheat Bread crumbs,Salt - to taste",5,20,25,6,Middle Eastern,Side Dish,Vegetarian,"To start making the Muhammara Recipe - Roasted Red Bell Pepper & Walnut Dip, rub a little oil on the whole red bell peppers and roast them directly on the flame, turning every 3 minutes, till it is 3/4th charred.Remove from the flame, allow it to cool, peel the burnt skin and roughly chop the red capsicum into pieces.In a mixer-jar, combine the roasted red capsicum peppers, walnuts, lemon juice, cumin powder, red chili flakes, jaggery, olive oil and salt.Grind this until you get a smooth paste, then add the bread crumbs, and grind it once more.You can always add more breadcrumbs or olive oil to adjust the consistency of the Muhammara. Adjust the salt and spices according to your taste.Transfer the Muhammara to a bowl and drizzle some more olive oil on top and serve fresh. You can also refrigerate the Muhammara for 3 to 4 days in an air tight container.Serve this Muhammara Recipe along with Whole Wheat Pita Bread Recipe or Homemade Pita Bread Recipe - Quick and Simple Recipe or Peri Peri Fish Fingers Recipe or Roasted Baby Potatoes Recipe at yout high tea parties.
","To start making the Muhammara Recipe - Roasted Red Bell Pepper & Walnut Dip, rub a little oil on the whole red bell peppers and roast them directly on the flame, turning every 3 minutes, till it is 3/4th charred.Remove from the flame, allow it to cool, peel the burnt skin and roughly chop the red capsicum into pieces.In a mixer-jar, combine the roasted red capsicum peppers, walnuts, lemon juice, cumin powder, red chili flakes, jaggery, olive oil and salt.Grind this until you get a smooth paste, then add the bread crumbs, and grind it once more.You can always add more breadcrumbs or olive oil to adjust the consistency of the Muhammara. Adjust the salt and spices according to your taste.Transfer the Muhammara to a bowl and drizzle some more olive oil on top and serve fresh. You can also refrigerate the Muhammara for 3 to 4 days in an air tight container.Serve this Muhammara Recipe along with Whole Wheat Pita Bread Recipe or Homemade Pita Bread Recipe - Quick and Simple Recipe or Peri Peri Fish Fingers Recipe or Roasted Baby Potatoes Recipe at yout high tea parties.
",http://www.archanaskitchen.com/muhammara-recipe-roasted-red-bell-pepper-walnut-dip
