Srno,RecipeName,TranslatedRecipeName,Ingredients,TranslatedIngredients,PrepTimeInMins,CookTimeInMins,TotalTimeInMins,Servings,Cuisine,Course,Diet,Instructions,TranslatedInstructions,URL
5805,Vegetarian Moussaka with Mushrooms Sauce Recipe,Vegetarian Moussaka with Mushrooms Sauce Recipe,"1 Brinjal (Baingan / Eggplant),1/2 cup Cheddar cheese - grated,1/4 cup Whole Wheat Bread crumbs,250 grams Button mushrooms - chopped,2 cloves Garlic - chopped,1 cup Homemade tomato puree,1/2 teaspoon Cumin powder (Jeera),Salt - to taste,Black pepper powder - for seasoning,1 sprig Parsley leaves - chopped,3 tablespoons Whole Wheat Flour - or corn flour or (corn flour + ragi flour),1 1/2 cups Milk,1/4 cup Britannia Cream Cheese,Salt - to taste,Black pepper powder - for seasoning","1 Brinjal (Baingan / Eggplant),1/2 cup Cheddar cheese - grated,1/4 cup Whole Wheat Bread crumbs,250 grams Button mushrooms - chopped,2 cloves Garlic - chopped,1 cup Homemade tomato puree,1/2 teaspoon Cumin powder (Jeera),Salt - to taste,Black pepper powder - for seasoning,1 sprig Parsley leaves - chopped,3 tablespoons Whole Wheat Flour - or corn flour or (corn flour + ragi flour),1 1/2 cups Milk,1/4 cup Britannia Cream Cheese,Salt - to taste,Black pepper powder - for seasoning",15,45,60,4,Greek,One Pot Dish,Vegetarian,"To begin making the Eggplant Moussaka with Mushroom Sauce, we will first prepare the eggplants. First cut the eggplants into 1/2 inch thick slices. Sprinkle some salt and keep it aside in a colander for about an hour.After an hour, dry the eggplants using a kitchen towel. The next step is to cook the eggplants.Preheat a skillet on medium heat, grease the pan with oil and place the sliced eggplants in the oil and cook them until browned and soft on both sides. Once cooked, place them on a paper towel to drain the excess oil.Cooking the eggplants on the skillet, gives it a soft texture as opposed to baking them in the oven. If you plan to bake your eggplants, make sure you cover them with an aluminum foil so it does not dry out.Preheat the oven to 180 C. Grease a baking dish with oil and keep aside.In the next steps we will make the mushroom sauce and the bechamel sauce, the two most important sauces for the moussakaTo make the mushrooms sauce, heat a teaspoon of oil in a skillet over medium heat. Add the chopped garlic and mushrooms and stir fry them until the mushrooms begin to release the water. Add the homemade tomato puree, the salt, cumin and black pepper. Give the mushrooms sauce a brisk boil until the mixture thickens. Once you have a thick sauce, turn off the heat and keep aside. Stir in the chopped coriander leaves.For the bechamel sauce, add all the ingredients into a saucepan and cook the sauce until it thickens. Once the sauce is thick, turn off the heat and keep the sauce aside.Our final step to make the moussaka is to assemble the dish and bake it in the oven.In a greased baking dish, sprinkle some breadcrumbs, this will help absorb the extra juices that come out when baking the moussaka.Place a layer of cooked eggplants at the bottom, pour some mushroom sauce over this later. Next layer it with eggplants again and pour the bechamel sauce over. Finally sprinkle it with cheese on the top.Bake the moussaka in the preheated oven for about 20 minutes until the cheese melts and turns golden brown. Once done, remove from the oven and allow it to rest for about 10 minutes before you serve.Serve the Eggplant Moussaka with a Crusty Garlic Bread and a salad by the side.
","To begin making the Eggplant Moussaka with Mushroom Sauce, we will first prepare the eggplants. First cut the eggplants into 1/2 inch thick slices. Sprinkle some salt and keep it aside in a colander for about an hour.After an hour, dry the eggplants using a kitchen towel. The next step is to cook the eggplants.Preheat a skillet on medium heat, grease the pan with oil and place the sliced eggplants in the oil and cook them until browned and soft on both sides. Once cooked, place them on a paper towel to drain the excess oil.Cooking the eggplants on the skillet, gives it a soft texture as opposed to baking them in the oven. If you plan to bake your eggplants, make sure you cover them with an aluminum foil so it does not dry out.Preheat the oven to 180 C. Grease a baking dish with oil and keep aside.In the next steps we will make the mushroom sauce and the bechamel sauce, the two most important sauces for the moussakaTo make the mushrooms sauce, heat a teaspoon of oil in a skillet over medium heat. Add the chopped garlic and mushrooms and stir fry them until the mushrooms begin to release the water. Add the homemade tomato puree, the salt, cumin and black pepper. Give the mushrooms sauce a brisk boil until the mixture thickens. Once you have a thick sauce, turn off the heat and keep aside. Stir in the chopped coriander leaves.For the bechamel sauce, add all the ingredients into a saucepan and cook the sauce until it thickens. Once the sauce is thick, turn off the heat and keep the sauce aside.Our final step to make the moussaka is to assemble the dish and bake it in the oven.In a greased baking dish, sprinkle some breadcrumbs, this will help absorb the extra juices that come out when baking the moussaka.Place a layer of cooked eggplants at the bottom, pour some mushroom sauce over this later. Next layer it with eggplants again and pour the bechamel sauce over. Finally sprinkle it with cheese on the top.Bake the moussaka in the preheated oven for about 20 minutes until the cheese melts and turns golden brown. Once done, remove from the oven and allow it to rest for about 10 minutes before you serve.Serve the Eggplant Moussaka with a Crusty Garlic Bread and a salad by the side.",https://www.archanaskitchen.com/vegetarian-moussaka-with-mushrooms-sauce-recipe
5806,Malabar Prawn Curry Recipe,Malabar Prawn Curry Recipe,"250 grams Prawns,1 cup Coconut milk,1 teaspoon Tamarind Paste,1 sprig Curry leaves,1/2 teaspoon Mustard seeds,1/2 teaspoon Methi Seeds (Fenugreek Seeds),2 Dry Red Chillies,3 Pearl onions (Sambar Onions),1 teaspoon Turmeric powder (Haldi),1 teaspoon Kashmiri Red Chilli Powder,Salt - to taste,1 teaspoon Lemon juice,3 teaspoon Mustard oil,3/4 cup Fresh coconut - grated,1 teaspoon Ginger - chopped,2 teaspoon Garlic - chopped,2 Green Chillies,1/2 teaspoon Turmeric powder (Haldi),1/2 teaspoon Cumin powder (Jeera),1 teaspoon Coriander Powder (Dhania)","250 grams Prawns,1 cup Coconut milk,1 teaspoon Tamarind Paste,1 sprig Curry leaves,1/2 teaspoon Mustard seeds,1/2 teaspoon Methi Seeds (Fenugreek Seeds),2 Dry Red Chillies,3 Pearl onions (Sambar Onions),1 teaspoon Turmeric powder (Haldi),1 teaspoon Kashmiri Red Chilli Powder,Salt - to taste,1 teaspoon Lemon juice,3 teaspoon Mustard oil,3/4 cup Fresh coconut - grated,1 teaspoon Ginger - chopped,2 teaspoon Garlic - chopped,2 Green Chillies,1/2 teaspoon Turmeric powder (Haldi),1/2 teaspoon Cumin powder (Jeera),1 teaspoon Coriander Powder (Dhania)",10,50,60,3,Kerala Recipes,Lunch,Non Vegeterian,"To begin making the Malabar Prawn Curry recipe, wash and clean the prawns.Marinate the prawn with 1 teaspoon turmeric powder, 1 teaspoon red chilli powder, 1 teaspoon salt and a juice of half a lemon for 30 minutes.Take 1 cup of grated coconut and pour over 1 cup of boiling water and extract the coconut milk through a sieve.Grind all the ingredients marked under ‘For the Paste’ with some water and keep it aside in a grinder.In a heavy bottomed pan, fry the prawns on both sides in mustard oil for 3 to 4 minutes. Remove and keep aside.In the same pan, add a little more oil, when it is hot, add the mustard and fenugreek seeds, once they start to splutter, add the curry leaves, dry red chillies, and the onions.Fry till the onions turns a little brown and then add the ground masala. Saute for 5 to 6 minutes or till oil comes out from it on medium heat.Add salt and tamarind paste and cook for further 3 to 4 minutes.Now add the prawns and cook for 3 to 4 minutes and then add the coconut milk.Let it comes to a boil and then lower the heat and let the curry cook for 2 to 3 minutes more.Switch off the gas and keep it covered to trap the aroma of the curry inside. Serve Malabar Prawn Curry with hot steamed rice and any raita of your choice for a delicious meal.
","To begin making the Malabar Prawn Curry recipe, wash and clean the prawns.Marinate the prawn with 1 teaspoon turmeric powder, 1 teaspoon red chilli powder, 1 teaspoon salt and a juice of half a lemon for 30 minutes.Take 1 cup of grated coconut and pour over 1 cup of boiling water and extract the coconut milk through a sieve.Grind all the ingredients marked under ‘For the Paste’ with some water and keep it aside in a grinder.In a heavy bottomed pan, fry the prawns on both sides in mustard oil for 3 to 4 minutes. Remove and keep aside.In the same pan, add a little more oil, when it is hot, add the mustard and fenugreek seeds, once they start to splutter, add the curry leaves, dry red chillies, and the onions.Fry till the onions turns a little brown and then add the ground masala. Saute for 5 to 6 minutes or till oil comes out from it on medium heat.Add salt and tamarind paste and cook for further 3 to 4 minutes.Now add the prawns and cook for 3 to 4 minutes and then add the coconut milk.Let it comes to a boil and then lower the heat and let the curry cook for 2 to 3 minutes more.Switch off the gas and keep it covered to trap the aroma of the curry inside. Serve Malabar Prawn Curry with hot steamed rice and any raita of your choice for a delicious meal.",https://www.archanaskitchen.com/malabar-prawn-curry-recipe
5807,Soba Noodle Salad Recipe,Soba Noodle Salad Recipe,"150 grams Soba noodles,2 cups Red cabbage - shredded,2 cups Red Yellow or Green Bell Pepper (Capsicum) - julienned,1/2 cup Spring Onion (Bulb & Greens) - chopped,1 cup Carrots (Gajjar) - grated,1/2 cup Coriander (Dhania) Leaves - chopped,1 tablespoons Basil leaves - chopped,2 tablespoons Mint Leaves (Pudina) - chopped,1 tablespoon Sesame seeds (Til seeds) - (black and white),3 tablespoons Peanut Butter - unsweetened,1 inch Ginger - grated,1 tablespoon Honey,1 tablespoon Soy sauce,1 tablespoon Rice Vinegar,1 teaspoon Sesame (Gingelly) Oil,1 tablespoon Sriracha sauce,Salt - to taste,Black pepper powder - to taste,Red Chilli flakes - to taste,2 tablespoons Lemon juice","150 grams Soba noodles,2 cups Red cabbage - shredded,2 cups Red Yellow or Green Bell Pepper (Capsicum) - julienned,1/2 cup Spring Onion (Bulb & Greens) - chopped,1 cup Carrots (Gajjar) - grated,1/2 cup Coriander (Dhania) Leaves - chopped,1 tablespoons Basil leaves - chopped,2 tablespoons Mint Leaves (Pudina) - chopped,1 tablespoon Sesame seeds (Til seeds) - (black and white),3 tablespoons Peanut Butter - unsweetened,1 inch Ginger - grated,1 tablespoon Honey,1 tablespoon Soy sauce,1 tablespoon Rice Vinegar,1 teaspoon Sesame (Gingelly) Oil,1 tablespoon Sriracha sauce,Salt - to taste,Black pepper powder - to taste,Red Chilli flakes - to taste,2 tablespoons Lemon juice",10,5,15,4,Chinese,Dinner,Vegetarian,"To begin making the Soba Noodle Salad recipe, in a pot boil the soba noodles as per package instructions. Strain under cold water and keep aside.In a salad bowl, add the red cabbage, bell peppers, green onions, carrots, coriander leaves, mint leaves and basil leaves. Mix all the vegetables.Then take another bowl and add the peanut butter, honey, soy sauce, rice vinegar, sesame oil, sriracha, ginger, salt, pepper, chilli flakes and lime juice.Whisk well to combine all the ingredients to form a dressing.Add the noodles to the veggies in the salad bowl followed by the dressing and sesame seeds.Mix well and serve cold. The salad tastes better if you let it sit in the refrigerator for some time. Enjoy!Serve Soba Noodle Salad along with Chinese Vegetarian Fried Rice With Apples for a weekend night dinner.
","To begin making the Soba Noodle Salad recipe, in a pot boil the soba noodles as per package instructions. Strain under cold water and keep aside.In a salad bowl, add the red cabbage, bell peppers, green onions, carrots, coriander leaves, mint leaves and basil leaves. Mix all the vegetables.Then take another bowl and add the peanut butter, honey, soy sauce, rice vinegar, sesame oil, sriracha, ginger, salt, pepper, chilli flakes and lime juice.Whisk well to combine all the ingredients to form a dressing.Add the noodles to the veggies in the salad bowl followed by the dressing and sesame seeds.Mix well and serve cold. The salad tastes better if you let it sit in the refrigerator for some time. Enjoy!Serve Soba Noodle Salad along with Chinese Vegetarian Fried Rice With Apples for a weekend night dinner.",http://www.archanaskitchen.com/soba-noodle-salad-recipe
5808,Masoor Dal Makhni Recipe,Masoor Dal Makhni Recipe,"1 cup Masoor Dal (Whole),1 Onion - finely chopped,1 Tomato,6 cloves Garlic,2 inch Ginger,1 Bay leaf (tej patta),2 Cloves (Laung),1 teaspoon Cumin seeds (Jeera),1 Cinnamon Stick (Dalchini),2 teaspoon Garam masala powder,1 teaspoon Red Chilli powder,2 teaspoon Coriander Powder (Dhania),2 tablespoons Ghee,2 teaspoon Fresh cream,Salt - to taste","1 cup Masoor Dal (Whole),1 Onion - finely chopped,1 Tomato,6 cloves Garlic,2 inch Ginger,1 Bay leaf (tej patta),2 Cloves (Laung),1 teaspoon Cumin seeds (Jeera),1 Cinnamon Stick (Dalchini),2 teaspoon Garam masala powder,1 teaspoon Red Chilli powder,2 teaspoon Coriander Powder (Dhania),2 tablespoons Ghee,2 teaspoon Fresh cream,Salt - to taste",10,20,30,4,North Indian Recipes,Lunch,High Protein Vegetarian,"To begin making the Masoor Dal Makhni Recipe, wash the whole masoor dal in running tap water until the water turns clear.Soak the washed masoor dal in lukewarm water for about 30 minutes.Heat ghee in a pressure cooker, add the whole spices, cinnamon, cloves, cinnamon, cumin seeds and let it sputter.Add the finely chopped onion and sauté till it turns brown.Now gently crush the ginger and garlic pods in a mortar and pestle and add the mix into the pressure pan. Sauté till the raw aroma of ginger and garlic goes away.Add the chopped tomatoes and the dry spices coriander powder, red chilli and garam masala and cook until the tomatoes get mushy and the ghee starts to leave the sides.To this add the soaked who masoor dal, enough water to cook and salt to taste.Pressure cook this for 4-5 whistles in low flame. Switch off and let the pressure subside.Open the lid gently and add the cream to make it richer.Masoor Dal Makhni is best served along with rice or paratha's and green salad.
","To begin making the Masoor Dal Makhni Recipe, wash the whole masoor dal in running tap water until the water turns clear.Soak the washed masoor dal in lukewarm water for about 30 minutes.Heat ghee in a pressure cooker, add the whole spices, cinnamon, cloves, cinnamon, cumin seeds and let it sputter.Add the finely chopped onion and sauté till it turns brown.Now gently crush the ginger and garlic pods in a mortar and pestle and add the mix into the pressure pan. Sauté till the raw aroma of ginger and garlic goes away.Add the chopped tomatoes and the dry spices coriander powder, red chilli and garam masala and cook until the tomatoes get mushy and the ghee starts to leave the sides.To this add the soaked who masoor dal, enough water to cook and salt to taste.Pressure cook this for 4-5 whistles in low flame. Switch off and let the pressure subside.Open the lid gently and add the cream to make it richer.Masoor Dal Makhni is best served along with rice or paratha's and green salad.",https://www.archanaskitchen.com/masoor-dal-makhni-recipe
5809,पंजाबी लोबिया मसालारेसिपी -Punjabi Style Black Eyed Beans Curry (Recipe In Hindi),Punjabi Style Black Eyed Beans Curry (Recipe In Hindi),"1 कप लोबिया,2 प्याज - बारीक कटे हुए,2 टमाटर,1 हरी मिर्च - कटी हुई,1 बड़ा चमच्च अदरक लहसुन का पेस्ट,1 छोटी चमच्च जीरा,1 इंच दालचीनी,1 तेज पत्ता,3 लवंग,1 छोटी चमच्च लाल मिर्च पाउडर,1/2 छोटी चमच्च हल्दी पाउडर,2 छोटी चमच्च जीरा पाउडर,2 छोटी चमच्च धनिया पाउडर,1 छोटी चमच्च गरम मसाला पाउडर,1 बड़ा चमच्च कसूरी मेथी,1 इंच अदरक - गार्निश के लिए,1 बड़ा चमच्च घी,नमक - स्वादनुसार,Salt - to taste","1 cup cowpea, 2 onions - finely chopped, 2 tomatoes, 1 green chili - chopped, 1 tablespoon ginger garlic paste, 1 teaspoon cumin seeds, 1 inch cinnamon, 1 bay leaf, 3 cloves, 1 teaspoon red chilli Powder, 1/2 teaspoon turmeric powder, 2 teaspoons cumin powder, 2 teaspoons coriander powder, 1 teaspoon garam masala powder, 1 tablespoon kasoori methi, 1 inch ginger - for garnish, 1 tablespoon ghee, salt - Salt - to taste",320,30,350,4,Indian,Dinner,Vegetarian,"पंजाबी लोबीया मसाला बनाने के लिए, सबसे पहले लोबिया को धो कर 4-5 घंटे के लिए पानी में भिगोलें।  फिर उसे प्रेशर कुकर में 2 सीटी आने तक पकालें।टमाटर की प्यूरी बनाले और उसे अलग रखले।   एक कढ़ाई में माध्यम आँच पर घी गरम करे, उसमे दालचीनी, लवंग और तेज पत्ता डाले, पकने का इंतज़ार करे।  जीरा डाले और क्रेकल होने दे। अदरक कहसुन का पेस्ट डाले और उसका पकने का इंतज़ार करे।कटे हुए प्याज़ डाले और उन्हें भूरा होने तक भुने।अब, हरी मिर्च, टमाटर की प्यूरी डाले और 3 मिनट तक सिम्मर करे। लाल मिर्च, हल्दी और जीरा पाउडर डाले और अछे से मिलाले एंड पकने दे जब तक घी नहीं छूटता।  अब, लोबिया को उसके पानी समेत कढ़ाई में डाले और 5 मिनट तक सिम्मर करे। हलके से कुछ लोबिया को स्मैश करे ताकि ग्रेवी थोड़ी घाड़ी हो जाए। कसूरी मेथी को हलके से हाथो के बीच क्रश करे और गरम मसाला सहित ग्रेवी में मिलाकर अछे से मिक्स करले। गैस बंद करे और ग्रेवी को अदरक से गार्निश करे। पंजाबी लोबिया मसाला को फुल्का और चावल के साथ रात के भोजन में परोसे।
","To make Punjabi lobiya masala, first wash the cowpea and soak it in water for 4-5 hours. Then cook it in the pressure cooker for 2 whistles. Make a tomato puree and keep it aside. Heat the ghee on a medium flame in a pan, add cinnamon, lavang and bay leaves, wait for it to cook. Add cumin seeds and let it crackle. Add ginger Kahsun paste and wait for it to cook. Add chopped onions and roast them till they turn brown. Now add green chili, tomato puree and simmer for 3 minutes. Add red chilli, turmeric and cumin powder and mix well and let it cook until the ghee leaves. Now, put the cowpea with its water in the pan and simmer for 5 minutes. Smash some cowpea lightly so that the gravy becomes slightly thick. Crush Kasuri Methi lightly between hands and mix it with gravy along with garam masala and mix it well. Turn off the gas and garnish the gravy with ginger. Serve Punjabi Lobiya Masala with Phulka and Rice at dinner.",https://www.archanaskitchen.com/punjabi-style-black-eyed-beans-curry-recipe-in-hindi
5811,Aloo Raswala Sabzi Recipe,Aloo Raswala Sabzi Recipe,"1 tablespoon Sunflower Oil,1/4 teaspoon Methi Seeds (Fenugreek Seeds),1/2 teaspoon Cumin seeds (Jeera),1 pinch Asafoetida (hing),1 Onion - finely chopped,4 cloves Garlic - finely chopped,1 inch Ginger - finely chopped,1 Green Chillies - chopped,2 Tomatoes - chopped,4 Potatoes (Aloo),1/4 teaspoon Turmeric powder (Haldi),1 teaspoon Garam masala powder - (Or kitchen king masala),Red Chilli powder,Salt - to taste,Coriander (Dhania) Leaves - to garnish","1 tablespoon Sunflower Oil,1/4 teaspoon Methi Seeds (Fenugreek Seeds),1/2 teaspoon Cumin seeds (Jeera),1 pinch Asafoetida (hing),1 Onion - finely chopped,4 cloves Garlic - finely chopped,1 inch Ginger - finely chopped,1 Green Chillies - chopped,2 Tomatoes - chopped,4 Potatoes (Aloo),1/4 teaspoon Turmeric powder (Haldi),1 teaspoon Garam masala powder - (Or kitchen king masala),Red Chilli powder,Salt - to taste,Coriander (Dhania) Leaves - to garnish",20,20,40,2,North Indian Recipes,North Indian Breakfast,Vegetarian,"To begin making the Aloo Raswala Sabzi Recipe, we will first boil the potatoes. Place the potatoes in a pressure cooker along with some water and pressure cook for about 5-6 whistles. Turn off the pressure cooker and allow the pressure to release naturally. Remove the potatoes from the cooker, peel and cut them into medium sized cubes and set aside. Heat oil in a pan on medium flame, add cumin seeds and methi seeds. Once the seeds begin to sizzle, add in the onion, ginger and garlic and saute until the onions become soft and tender.Stir in green chillies, asafoetida and stir fry for a few seconds. Once the onions have softened, add in the tomatoes and mix well.Add turmeric powder and red chilli powder. Continue to cook until the tomatoes are mushy and softened.Sprinkle garam masala powder, add cooked potatoes, salt to taste and just enough water to the consistency of your choice and bring to the Aloo Raswala Sabzi to a brisk boil. Adjust water such that the consistency is neither too thick or too thin. Reduce heat and simmer the Aloo Raswala Sabzi for about 10 minutes till it form a masaledar gravy. Once done, check the salt and spices and adjust to suit your taste and turn off the heat.Transfer the Aloo Raswala Sabzi to a serving bowl and serve hot.Serve Aloo Raswala Sabzi Recipe along with Chunni Ki Puri Recipe- Moong Dal And Besan Fried Puri Recipe and Sago Kheer Recipe - Tapioca Milk Pudding for a simple Sunday brunch.
","To begin making the Aloo Raswala Sabzi Recipe, we will first boil the potatoes. Place the potatoes in a pressure cooker along with some water and pressure cook for about 5-6 whistles. Turn off the pressure cooker and allow the pressure to release naturally. Remove the potatoes from the cooker, peel and cut them into medium sized cubes and set aside. Heat oil in a pan on medium flame, add cumin seeds and methi seeds. Once the seeds begin to sizzle, add in the onion, ginger and garlic and saute until the onions become soft and tender.Stir in green chillies, asafoetida and stir fry for a few seconds. Once the onions have softened, add in the tomatoes and mix well.Add turmeric powder and red chilli powder. Continue to cook until the tomatoes are mushy and softened.Sprinkle garam masala powder, add cooked potatoes, salt to taste and just enough water to the consistency of your choice and bring to the Aloo Raswala Sabzi to a brisk boil. Adjust water such that the consistency is neither too thick or too thin. Reduce heat and simmer the Aloo Raswala Sabzi for about 10 minutes till it form a masaledar gravy. Once done, check the salt and spices and adjust to suit your taste and turn off the heat.Transfer the Aloo Raswala Sabzi to a serving bowl and serve hot.Serve Aloo Raswala Sabzi Recipe along with Chunni Ki Puri Recipe- Moong Dal And Besan Fried Puri Recipe and Sago Kheer Recipe - Tapioca Milk Pudding for a simple Sunday brunch.",http://www.archanaskitchen.com/whole-wheat-poori-with-aloo-raswala-sabzi-recipe
