Srno,RecipeName,TranslatedRecipeName,Ingredients,TranslatedIngredients,PrepTimeInMins,CookTimeInMins,TotalTimeInMins,Servings,Cuisine,Course,Diet,Instructions,TranslatedInstructions,URL
4821,Jowar Atta Pyaz Thepla Recipe – Sorghum Wheat Onion Thepla,Jowar Atta Pyaz Thepla Recipe – Sorghum Wheat Onion Thepla,"1 cup Whole Wheat Flour,1-1/2 cup Jowar Flour (Sorghum),2 Onion - finely chopped,1 Green Chilli - finely chopped,1 teaspoon Coriander Powder (Dhania),2 teaspoon Garam masala powder,2 teaspoon Amchur (Dry Mango Powder),1 teaspoon Turmeric powder (Haldi),Salt - to taste,Sunflower Oil","1 cup Whole Wheat Flour,1-1/2 cup Jowar Flour (Sorghum),2 Onion - finely chopped,1 Green Chilli - finely chopped,1 teaspoon Coriander Powder (Dhania),2 teaspoon Garam masala powder,2 teaspoon Amchur (Dry Mango Powder),1 teaspoon Turmeric powder (Haldi),Salt - to taste,Sunflower Oil",10,25,35,4,North Indian Recipes,Side Dish,Diabetic Friendly,"To begin making the Jowar Atta Pyaz Thepla Recipe, in a large mixing bowl add chopped onions, green chilli, coriander powder, garam masala, amchur and turmeric, salt, whole wheat flour and the jowar flour.Add water little at a time and form a firm dough which is not sticky. Knead it well to form a dough. Rest the thepla dough for at least 10 minutes and shape them into medium sized balls.Dust it with wheat flour and roll the Jowar Atta Pyaz Thepla dough gently to make a thin circular thepla.The diameter of the Jowar Atta Pyaz thepla depends on how thin or thick you want it to be. Repeat the same process with the remaining dough portions.Preheat the skillet on medium flame. Place the rolled Jowar Atta Pyaz thepla gently on the tawa and cook on both sides, drizzle oil or ghee and cook till the thepla have brown spots on either side.Once done, stack the theplas one over the other and serve hot.Serve the Jowar Atta Pyaz Thepla Recipe along with Dal Palak, Aloo Parwal Sabzi,  Gor Keri Pickle , Palak Raita Recipe for a wholesome lunch or dinner.
","To begin making the Jowar Atta Pyaz Thepla Recipe, in a large mixing bowl add chopped onions, green chilli, coriander powder, garam masala, amchur and turmeric, salt, whole wheat flour and the jowar flour.Add water little at a time and form a firm dough which is not sticky. Knead it well to form a dough. Rest the thepla dough for at least 10 minutes and shape them into medium sized balls.Dust it with wheat flour and roll the Jowar Atta Pyaz Thepla dough gently to make a thin circular thepla.The diameter of the Jowar Atta Pyaz thepla depends on how thin or thick you want it to be. Repeat the same process with the remaining dough portions.Preheat the skillet on medium flame. Place the rolled Jowar Atta Pyaz thepla gently on the tawa and cook on both sides, drizzle oil or ghee and cook till the thepla have brown spots on either side.Once done, stack the theplas one over the other and serve hot.Serve the Jowar Atta Pyaz Thepla Recipe along with Dal Palak, Aloo Parwal Sabzi,  Gor Keri Pickle , Palak Raita Recipe for a wholesome lunch or dinner.
",http://www.archanaskitchen.com/jowar-atta-pyaz-thepla-recipe-sorghum-wheat-onion-thepla
4823,Vegetarian Pad Thai Recipe - Thai style Stir fried Vegetarian Rice Noodle Dish,Vegetarian Pad Thai Recipe - Thai style Stir fried Vegetarian Rice Noodle Dish,"100 grams Tofu - extra firm,100 grams Rice noodles - dry,1 Onion - diced,1 teaspoon Garlic - minced,Spring Onion Greens - small bunch,100 grams Bean Sprouts,2 Whole Eggs - scrambled separately with salt and pepper,2 tablespoons Sesame (Gingelly) Oil,1 Lemon - cut into wedges,1/3 cup Roasted Peanuts (Moongphali) - coarsely chopped,Coriander (Dhania) Leaves - chopped for garnish,Salt and Pepper - as needed,2 tablespoons Soy sauce,1 tablespoon Sugar,1/2 teaspoon Red Chilli flakes","100 grams Tofu - extra firm,100 grams Rice noodles - dry,1 Onion - diced,1 teaspoon Garlic - minced,Spring Onion Greens - small bunch,100 grams Bean Sprouts,2 Whole Eggs - scrambled separately with salt and pepper,2 tablespoons Sesame (Gingelly) Oil,1 Lemon - cut into wedges,1/3 cup Roasted Peanuts (Moongphali) - coarsely chopped,Coriander (Dhania) Leaves - chopped for garnish,Salt and Pepper - as needed,2 tablespoons Soy sauce,1 tablespoon Sugar,1/2 teaspoon Red Chilli flakes",20,25,45,3,Thai,Dinner,Eggetarian,"To begin making Vegetarian Pad Thai Recipe, first drain the tofu and place it on a plate. In order to remove the excess liquid from it, place another plate over it and top it with a heavy weight. Set this aside until the tofu is drained out completely.In a pot, bring some water to a boil, to cook the noodles. When it begins to boil, add the noodles to it, turn the heat off and allow the noodles to remain in the hot water for about 7 minutes till soft. Drain them and set aside for later use.In a small bowl whisk together the soya sauce, sugar and red pepper flakes and keep the sauce aside for later use.Next, place a non stick skillet or wok on high heat. Add a tablespoon of oil and add onions. Stir fry vigorously until the onions turn brown.Cut the pressed tofu in bite size cubes and add them into the wok. Cook for couple of minutes or until slightly brown.Stir in the garlic, scallions, bean sprouts, salt and pepper to taste and stir-fry the vegetables for a couple of minutes on high heat so they cook but remain crunchy.Add the scrambled eggs into the vegetable tofu mixture and stir to combine. At this stage, turn off the heat on the wok.Pour in the the prepared soy sauce mixture over the veggies and toss so that everything is well coated. Transfer this mixture into a bowl.Next, in the same skillet heat another tablespoon oil and add the noodles into it. Stir fry for two minutes and then return the vegetable mixture to the skillet. Saute until mixed well.Transfer the Vegetarian Pad Thai to the serving bowl. Squeeze lime, garnish with chopped peanuts and cilantro and serve.Serve the Vegetarian Pad Thai along with Sweet Corn Vegetable Soup Recipe for a wholesome dinner.
","To begin making Vegetarian Pad Thai Recipe, first drain the tofu and place it on a plate. In order to remove the excess liquid from it, place another plate over it and top it with a heavy weight. Set this aside until the tofu is drained out completely.In a pot, bring some water to a boil, to cook the noodles. When it begins to boil, add the noodles to it, turn the heat off and allow the noodles to remain in the hot water for about 7 minutes till soft. Drain them and set aside for later use.In a small bowl whisk together the soya sauce, sugar and red pepper flakes and keep the sauce aside for later use.Next, place a non stick skillet or wok on high heat. Add a tablespoon of oil and add onions. Stir fry vigorously until the onions turn brown.Cut the pressed tofu in bite size cubes and add them into the wok. Cook for couple of minutes or until slightly brown.Stir in the garlic, scallions, bean sprouts, salt and pepper to taste and stir-fry the vegetables for a couple of minutes on high heat so they cook but remain crunchy.Add the scrambled eggs into the vegetable tofu mixture and stir to combine. At this stage, turn off the heat on the wok.Pour in the the prepared soy sauce mixture over the veggies and toss so that everything is well coated. Transfer this mixture into a bowl.Next, in the same skillet heat another tablespoon oil and add the noodles into it. Stir fry for two minutes and then return the vegetable mixture to the skillet. Saute until mixed well.Transfer the Vegetarian Pad Thai to the serving bowl. Squeeze lime, garnish with chopped peanuts and cilantro and serve.Serve the Vegetarian Pad Thai along with Sweet Corn Vegetable Soup Recipe for a wholesome dinner.",https://www.archanaskitchen.com/vegetarian-pad-thai-recipe-thai-style-stir-fried-vegetarian-rice-noodle-dish
4827,Chicken Stuffed Bread Recipe,Chicken Stuffed Bread Recipe,"2-1/2 cup Vivatta Maida,2 tablespoons Sugar,1-1/2 Active dry yeast,Salt - to taste,3 tablespoons Sunflower Oil,4 tablespoons Milk - warm,1/4 cup Lukewarm Water,1 Whole Egg - beaten,250 grams Chicken - Boiled and boneless,2 tablespoons Butter,1-1/2 tablespoon All Purpose Flour (Maida),1/2 cup Milk - lukewarm,1 cup Cheese - grated processed chees,Salt - to taste,Black pepper powder - to taste,1 teaspoon Dried oregano,1 teaspoon Dried oregano","2-1/2 cup Vivatta Maida,2 tablespoons Sugar,1-1/2 Active dry yeast,Salt - to taste,3 tablespoons Sunflower Oil,4 tablespoons Milk - warm,1/4 cup Lukewarm Water,1 Whole Egg - beaten,250 grams Chicken - Boiled and boneless,2 tablespoons Butter,1-1/2 tablespoon All Purpose Flour (Maida),1/2 cup Milk - lukewarm,1 cup Cheese - grated processed chees,Salt - to taste,Black pepper powder - to taste,1 teaspoon Dried oregano,1 teaspoon Dried oregano",25,40,65,8,Continental,Snack,Non Vegeterian,"To begin making the Chicken Stuffed Bread recipe, let us make the bread dough.For the bread dough In a small bowl, add yeast and sugar, add lukewarm water to it and mix well. Cover and set aside for 5 mins for the yeast to activate and froth up. In a mixing bowl, add flour, salt, oil and mix well. Add in the yeast mixture and milk. Mix well using a fork. Add little warm water as needed. Knead this to a soft dough. Knead well for 12-15 minutes. You can also use a food processor to knead the dough. Now drizzle with little of oil and incorporate it in the dough.  Cover with a damp muslin cloth and set aside to rise for 1 hour.When the dough is risen, punch the air out and knead it once more. Add more flour if it is too sticky.For the filling Melt butter in a pan on medium heat and add flour stirring continuously. As soon as the flour gets slightly brownish, add warm milk and stir well to remove any lumps. Let it cook and thicken.As the sauce thickens, add salt and pepper to taste. Now add the shredded boiled chicken. Mix well and remove from the heat and set aside.To shape the dough Divide the dough four portions, to make medium sized breads. Take one portion of the dough, flatten it between your palms and using a rolling pin, roll it into rectangular shape.Now place the rectangular sheet of dough vertically in front of you on the working counter, with the help of a knife/pizza cutter, make cuts from 1 inch away from the edge to the end of the edges with a gap of 1 cm. Make sure the cuts are even numbered.Spoon some filling in the center,add grated cheese and oregano and start braiding.Fold the top and bottom part of dough and starting from one end, start braiding each pair of strip (overlapping)till you reach the end. Place it in a baking tray lined with parchment paper. Cover with damp muslin cloth and allow to rise for another hour. once it has risen, gently brush well with beaten egg.Preheat oven to 180 degree Celsius and bake the bread for 30-35 minutes or till top gets browned well.Bake this for 12 minutes at 180 degree C. Now increase the heat to 220 Degree C and bake for 5 to 8 minutes until you see a nice brown colour on the bread. Remove it and serve warm.Serve Chicken Stuffed Bread over high tea along with other tea time snacks like Whole Wheat Carrot Cake Recipe, Baked Corn & Flour Tortilla Chips Flavored With Paprika Recipe, Baked Samosa Pinwheels Recipe.
","To begin making the Chicken Stuffed Bread recipe, let us make the bread dough.For the bread dough In a small bowl, add yeast and sugar, add lukewarm water to it and mix well. Cover and set aside for 5 mins for the yeast to activate and froth up. In a mixing bowl, add flour, salt, oil and mix well. Add in the yeast mixture and milk. Mix well using a fork. Add little warm water as needed. Knead this to a soft dough. Knead well for 12-15 minutes. You can also use a food processor to knead the dough. Now drizzle with little of oil and incorporate it in the dough.  Cover with a damp muslin cloth and set aside to rise for 1 hour.When the dough is risen, punch the air out and knead it once more. Add more flour if it is too sticky.For the filling Melt butter in a pan on medium heat and add flour stirring continuously. As soon as the flour gets slightly brownish, add warm milk and stir well to remove any lumps. Let it cook and thicken.As the sauce thickens, add salt and pepper to taste. Now add the shredded boiled chicken. Mix well and remove from the heat and set aside.To shape the dough Divide the dough four portions, to make medium sized breads. Take one portion of the dough, flatten it between your palms and using a rolling pin, roll it into rectangular shape.Now place the rectangular sheet of dough vertically in front of you on the working counter, with the help of a knife/pizza cutter, make cuts from 1 inch away from the edge to the end of the edges with a gap of 1 cm. Make sure the cuts are even numbered.Spoon some filling in the center,add grated cheese and oregano and start braiding.Fold the top and bottom part of dough and starting from one end, start braiding each pair of strip (overlapping)till you reach the end. Place it in a baking tray lined with parchment paper. Cover with damp muslin cloth and allow to rise for another hour. once it has risen, gently brush well with beaten egg.Preheat oven to 180 degree Celsius and bake the bread for 30-35 minutes or till top gets browned well.Bake this for 12 minutes at 180 degree C. Now increase the heat to 220 Degree C and bake for 5 to 8 minutes until you see a nice brown colour on the bread. Remove it and serve warm.Serve Chicken Stuffed Bread over high tea along with other tea time snacks like Whole Wheat Carrot Cake Recipe, Baked Corn & Flour Tortilla Chips Flavored With Paprika Recipe, Baked Samosa Pinwheels Recipe.
",http://www.archanaskitchen.com/chicken-stuffed-bread-recipe
4829,Sweet Potato & Spinach Hash brown Recipe,Sweet Potato & Spinach Hash brown Recipe,"2 Sweet Potato - grated,1 cup Spinach - chopped,1 Onion - sliced,1 tablespoon Fennel Powder,1 teaspoon Salt,1 tablespoon Dried oregano,1 tablespoon Dried Thyme Leaves,1 tablespoon Red Chilli flakes,Salt and Pepper - to taste,Sunflower Oil - for cooking","2 Sweet Potato - grated,1 cup Spinach - chopped,1 Onion - sliced,1 tablespoon Fennel Powder,1 teaspoon Salt,1 tablespoon Dried oregano,1 tablespoon Dried Thyme Leaves,1 tablespoon Red Chilli flakes,Salt and Pepper - to taste,Sunflower Oil - for cooking",10,30,40,4,Continental,World Breakfast,Vegetarian,"We begin making the Sweet Potato & Spinach Hash brown Recipe by heating a flat skilled with oil, Add in the onions and sauté till it turns golden brown.Then add in the grated sweet potato, spinach, spice and herb powders mentioned in the list. Check for salt and mix well. Keep sautéing till it is cooked.Take the pan off the heat. Cool it down and once it is cooled down and then start shaping them into discs by using your hands.Heat a flat skillet, drizzle some oil and place these hash brown and toast them on either side for 2 minutes till it is golden brown and serve. Serve the Sweet Potato & Spinach Hash brown Recipe along with some Toasted Bread and Glass of Plum Ginger Juice Recipe for your morning Breakfast.
","We begin making the Sweet Potato & Spinach Hash brown Recipe by heating a flat skilled with oil, Add in the onions and sauté till it turns golden brown.Then add in the grated sweet potato, spinach, spice and herb powders mentioned in the list. Check for salt and mix well. Keep sautéing till it is cooked.Take the pan off the heat. Cool it down and once it is cooled down and then start shaping them into discs by using your hands.Heat a flat skillet, drizzle some oil and place these hash brown and toast them on either side for 2 minutes till it is golden brown and serve. Serve the Sweet Potato & Spinach Hash brown Recipe along with some Toasted Bread and Glass of Plum Ginger Juice Recipe for your morning Breakfast.
",http://www.archanaskitchen.com/sweet-potato-spinach-hash-brown-recipe
4832,Kerala Style Kanji Payar Recipe,Kerala Style Kanji Payar Recipe,"1 cup Red matta rice,1 cup Green Moong Dal (Whole),1/2 cup Fresh coconut - grated,2 cloves Garlic,1 teaspoon Cumin seeds (Jeera),1 Green Chilli - finely chopped,1 teaspoon Turmeric powder (Haldi),2 sprig Curry leaves,Salt - to taste,4 Papad","1 cup Red matta rice,1 cup Green Moong Dal (Whole),1/2 cup Fresh coconut - grated,2 cloves Garlic,1 teaspoon Cumin seeds (Jeera),1 Green Chilli - finely chopped,1 teaspoon Turmeric powder (Haldi),2 sprig Curry leaves,Salt - to taste,4 Papad",10,45,55,2,Kerala Recipes,Lunch,Vegetarian,"To begin making the Kanji Payar Recipe, wash and add rice and salt to a pressure cooker along with 4 cups of water.Pressure cook for 6 -7 whistle on high heat and lower the heat and cook for 15 minutes. After 15 minutes turn off the heat. Let the pressure release naturally and then open the pressure cooker. Add more water if required to adjust the consistency of the rice Kanji.To make the Payar ThoranAdd the green gram in pressure cooker with 2 cups of water and salt.Pressure cook for 4-5 whistles and turn off the heat.Once the pressure is released cook off the excess water if any.In a blender add coconut, garlic, cumin seeds, green chilly, turmeric and blend. The mixture should be coarse.Add the coconut mixture and curry leaves to the cooked green gram and mix well. Roast the papad on low flame.To serve the Kanji Payar transfer the hot boiled rice to a serving bowl or a plate. Add some ghee to the rice Kanji if you like. Check the salt and adjust to suit your taste. Serve the Payar and papad on the side and enjoy.Serve Kanji Payar with Tomato Garlic Chutney Recipe or Kerala Vendakka Thoran and Elai Vadam Recipe
","To begin making the Kanji Payar Recipe, wash and add rice and salt to a pressure cooker along with 4 cups of water.Pressure cook for 6 -7 whistle on high heat and lower the heat and cook for 15 minutes. After 15 minutes turn off the heat. Let the pressure release naturally and then open the pressure cooker. Add more water if required to adjust the consistency of the rice Kanji.To make the Payar ThoranAdd the green gram in pressure cooker with 2 cups of water and salt.Pressure cook for 4-5 whistles and turn off the heat.Once the pressure is released cook off the excess water if any.In a blender add coconut, garlic, cumin seeds, green chilly, turmeric and blend. The mixture should be coarse.Add the coconut mixture and curry leaves to the cooked green gram and mix well. Roast the papad on low flame.To serve the Kanji Payar transfer the hot boiled rice to a serving bowl or a plate. Add some ghee to the rice Kanji if you like. Check the salt and adjust to suit your taste. Serve the Payar and papad on the side and enjoy.Serve Kanji Payar with Tomato Garlic Chutney Recipe or Kerala Vendakka Thoran and Elai Vadam Recipe
",http://www.archanaskitchen.com/kanji-payar-recipe
4833,हरे चने की चटनी रेसिपी - Green Chana Chutney (Recipe In Hindi), Green Chana Chutney (Recipe In Hindi),"1 कप हरे चने,3 हरी मिर्च,6 कली लहसुन,नमक - स्वाद अनुसार,पानी - प्रयोग अनुसार,तेल - प्रयोग अनुसार,1/2 बड़ा चमच्च जीरा,2 बड़े चमच्च दही","1 cup green gram, 3 green chillies, 6 cloves garlic, salt - as per taste, water - as per use, oil - as per use, 1/2 tablespoon cumin seeds, 2 tablespoons curd",5,10,15,4,Rajasthani,Side Dish,Vegetarian,"हरे चने की चटनी बनाने के लिए पहले एक मिक्सर ग्राइंडर में हरे चने, हरी मिर्च, लहसुन, नमक और थोड़ा पानी डाले। अच्छी तरह से पीस कर इसका पेस्ट बना ले. इस पेस्ट को एक बाउल में निकाल ले.अब एक कढ़ाई में तेल गरम करें। इसमें जीरा डाले और 10 सेकण्ड्स तक पका ले. 10 सेकण्ड्स के बाद इसमें दही डाले और मिला ले.1 मिनट बाद इसमें हरे चने का पेस्ट डाले और अगले 2 मिनट तक पकाए. 2 मिनट के बाद गैस बंद करें और परोसे।  हरे चने की चटनी को गट्टे की सब्ज़ी, बूंदी रायता और फुल्के के साथ परोसे।
","हरे चने की चटनी बनाने के लिए पहले एक मिक्सर ग्राइंडर में हरे चने, हरी मिर्च, लहसुन, नमक और थोड़ा पानी डाले। अच्छी तरह से पीस कर इसका पेस्ट बना ले. इस पेस्ट को एक बाउल में निकाल ले.अब एक कढ़ाई में तेल गरम करें। इसमें जीरा डाले और 10 सेकण्ड्स तक पका ले. 10 सेकण्ड्स के बाद इसमें दही डाले और मिला ले.1 मिनट बाद इसमें हरे चने का पेस्ट डाले और अगले 2 मिनट तक पकाए. 2 मिनट के बाद गैस बंद करें और परोसे।  हरे चने की चटनी को गट्टे की सब्ज़ी, बूंदी रायता और फुल्के के साथ परोसे।
",https://www.archanaskitchen.com/green-chana-chutney-recipe-in-hindi
4834,Pattani Kootu Recipe (Green Peas Curry),Pattani Kootu Recipe (Green Peas Curry),"1-1/2 Green peas (Matar),1 Onion - finely chopped,1/2 cup Fresh coconut - grated,4 Green Chillies,1 teaspoon Cumin seeds (Jeera),1 sprig Curry leaves,1 teaspoon Fennel seeds (Saunf),1 teaspoon Mustard seeds,Salt - to taste,1 teaspoon Sunflower Oil","1-1/2 Green peas (Matar),1 Onion - finely chopped,1/2 cup Fresh coconut - grated,4 Green Chillies,1 teaspoon Cumin seeds (Jeera),1 sprig Curry leaves,1 teaspoon Fennel seeds (Saunf),1 teaspoon Mustard seeds,Salt - to taste,1 teaspoon Sunflower Oil",10,25,35,4,Kerala Recipes,Side Dish,Vegetarian,"To begin making Pattani Kootu Recipe (Green Peas Curry), in a mixer grinder, grind grated coconut, green chillies and cumin seeds into a thick paste. Keep aside till required.Heat oil in a kadai. Add mustard seeds and wait until they splutters.Add fennel seeds, curry leaves, and finely chopped onions and saute until the onions turn pinkish.Add the ground coconut masala reserved earlier and cook further until the coconut paste comes together from the sides of the pan.Add green peas and cook for about 3 minutes or till they are almost a bit soft and looks a little cooked. Add salt and stir.Now add about 1/2 cup water and cook covered until the green peas are well cooked, and are almost mashable.Adjust salt if required and cook until the dish is thick in consistency, now turn off heat.Serve Pattani Kootu Recipe (Green Peas Curry) with Pudina Tawa Paratha Recipe (Mint Leaf Skillet Flat Bread), steamed rice, Varutharachu Sambar Recipe for a simple weeknight dinner.
","To begin making Pattani Kootu Recipe (Green Peas Curry), in a mixer grinder, grind grated coconut, green chillies and cumin seeds into a thick paste. Keep aside till required.Heat oil in a kadai. Add mustard seeds and wait until they splutters.Add fennel seeds, curry leaves, and finely chopped onions and saute until the onions turn pinkish.Add the ground coconut masala reserved earlier and cook further until the coconut paste comes together from the sides of the pan.Add green peas and cook for about 3 minutes or till they are almost a bit soft and looks a little cooked. Add salt and stir.Now add about 1/2 cup water and cook covered until the green peas are well cooked, and are almost mashable.Adjust salt if required and cook until the dish is thick in consistency, now turn off heat.Serve Pattani Kootu Recipe (Green Peas Curry) with Pudina Tawa Paratha Recipe (Mint Leaf Skillet Flat Bread), steamed rice, Varutharachu Sambar Recipe for a simple weeknight dinner.",https://www.archanaskitchen.com/pattani-kootu-recipe-green-peas-curry
