Srno,RecipeName,TranslatedRecipeName,Ingredients,TranslatedIngredients,PrepTimeInMins,CookTimeInMins,TotalTimeInMins,Servings,Cuisine,Course,Diet,Instructions,TranslatedInstructions,URL
1216,Eggless Whole wheat And Orange Almond Cake Recipe,Eggless Whole wheat And Orange Almond Cake Recipe,"1-1/2 cups Whole Wheat Flour,1/2 cup Almond Meal (Badam Powder),1/2 cup Condensed Milk,1/2 cup Fresh orange juice - fresh or canned,50 grams Butter - cold,2/3 cup Sunflower Oil,1 teaspoon Baking soda,1 tablespoon Baking powder,pinch Salt,1/2 teaspoon Cinnamon Powder (Dalchini),1/2 tablespoon Vanilla Extract,1/2 cup Buttermilk,1 cup Badam (Almond) - sliced or blanched,1/4 cup Pistachios,1/4 cup Walnuts - diced","1-1/2 cups Whole Wheat Flour,1/2 cup Almond Meal (Badam Powder),1/2 cup Condensed Milk,1/2 cup Fresh orange juice - fresh or canned,50 grams Butter - cold,2/3 cup Sunflower Oil,1 teaspoon Baking soda,1 tablespoon Baking powder,pinch Salt,1/2 teaspoon Cinnamon Powder (Dalchini),1/2 tablespoon Vanilla Extract,1/2 cup Buttermilk,1 cup Badam (Almond) - sliced or blanched,1/4 cup Pistachios,1/4 cup Walnuts - diced",0,45,45,6,Continental,Dessert,Vegetarian,"To begin making the Eggless Whole Wheat And Orange Almond Cake, firstly sift the flour with baking soda, salt and baking powder. Cream the butter and oil. Add the almond meal and mix everything well.Pre-heat an oven to 180 degree C, line a cake pan and grease/line with parchment.The next step is to mix the liquids. Mix buttermilk, orange juice, condensed milk and oil, vanilla essence and cinnamon together in a mixing bowl.Add the above flour mixture and some of the nuts in the liquid. Make sure that everything is mixed well.Transfer the lumpy mass into a cake pan and top it with chopped almond.Bake for 30 mins or till done. After 30 minutes, cool the cake for a few minutes and it is ready to be served.Enjoy the Eggless Whole Wheat And Orange Almond Cake with hot Masala chai and Carrot and Peas Sandwich during your tea time.
","To begin making the Eggless Whole Wheat And Orange Almond Cake, firstly sift the flour with baking soda, salt and baking powder. Cream the butter and oil. Add the almond meal and mix everything well.Pre-heat an oven to 180 degree C, line a cake pan and grease/line with parchment.The next step is to mix the liquids. Mix buttermilk, orange juice, condensed milk and oil, vanilla essence and cinnamon together in a mixing bowl.Add the above flour mixture and some of the nuts in the liquid. Make sure that everything is mixed well.Transfer the lumpy mass into a cake pan and top it with chopped almond.Bake for 30 mins or till done. After 30 minutes, cool the cake for a few minutes and it is ready to be served.Enjoy the Eggless Whole Wheat And Orange Almond Cake with hot Masala chai and Carrot and Peas Sandwich during your tea time.",http://www.archanaskitchen.com/eggless-wholewheat-and-orange-almond-cake-recipe
1217,"Beetroot, Sweet Potato And Oatmeal Cutlet Recipe","Beetroot, Sweet Potato And Oatmeal Cutlet Recipe","2 Beetroots - grated,2 Sweet Potatoes - boiled,1/2 cup Instant Oats (Oatmeal) - roasted,Sweet corn - a handful,2 Green Chillies - finely chopped,1 teaspoon Red Chilli powder,1 teaspoon Amchur (Dry Mango Powder),1 teaspoon Cumin powder (Jeera),1/2 teaspoon Black Salt (Kala Namak),3 tablespoons Coriander (Dhania) Leaves - finely chopped,1 inch Ginger - grated,1/2 cup Whole Wheat Bread crumbs - made fresh,2 tablespoons Sunflower Oil,Salt - to taste","2 Beetroots - grated,2 Sweet Potatoes - boiled,1/2 cup Instant Oats (Oatmeal) - roasted,Sweet corn - a handful,2 Green Chillies - finely chopped,1 teaspoon Red Chilli powder,1 teaspoon Amchur (Dry Mango Powder),1 teaspoon Cumin powder (Jeera),1/2 teaspoon Black Salt (Kala Namak),3 tablespoons Coriander (Dhania) Leaves - finely chopped,1 inch Ginger - grated,1/2 cup Whole Wheat Bread crumbs - made fresh,2 tablespoons Sunflower Oil,Salt - to taste",15,20,35,4,Indian,Appetizer,Vegetarian,"To begin making Beetroot, Sweet Potato and Oatmeal Cutlet Recipe, boil the sweet potato using pressure cooker, peel the skin off, mash and keep aside.In the mean, dry roast the rolled oats in a wide pan and keep aside.Now, take a big bowl and add in the grated beetroot, boiled & mashed sweet potatoes, roasted oatmeal, boiled corn kernels, green chillies, coriander, grated ginger, along with the spices mentioned and half of the bread crumbs and mix well.Divide the mixture to equal portions and shape them to a oval flat cutlets or any shape you desire.Now, take each cutlet formed, coat it with the remaining bread crumbs and gently press it so that the bread crumbs stick to the surface of the cutlets.Heat oil in a pan on medium heat and place the crumb coated cutlets and let it cook till a golden crust forms on its surface. This will take around 5 minutes.Now, flip over and cook the other side a well till it is golden brown.Likewise, prepare the rest of the cutlets.Serve the Beetroot, Sweet Potato and Oatmeal Cutlet Recipe as an after school snack for kids or as a tea time snack along with Green Chutney and Masala Tea.
","To begin making Beetroot, Sweet Potato and Oatmeal Cutlet Recipe, boil the sweet potato using pressure cooker, peel the skin off, mash and keep aside.In the mean, dry roast the rolled oats in a wide pan and keep aside.Now, take a big bowl and add in the grated beetroot, boiled & mashed sweet potatoes, roasted oatmeal, boiled corn kernels, green chillies, coriander, grated ginger, along with the spices mentioned and half of the bread crumbs and mix well.Divide the mixture to equal portions and shape them to a oval flat cutlets or any shape you desire.Now, take each cutlet formed, coat it with the remaining bread crumbs and gently press it so that the bread crumbs stick to the surface of the cutlets.Heat oil in a pan on medium heat and place the crumb coated cutlets and let it cook till a golden crust forms on its surface. This will take around 5 minutes.Now, flip over and cook the other side a well till it is golden brown.Likewise, prepare the rest of the cutlets.Serve the Beetroot, Sweet Potato and Oatmeal Cutlet Recipe as an after school snack for kids or as a tea time snack along with Green Chutney and Masala Tea.",http://www.archanaskitchen.com/beetroot-sweet-potato-and-oatmeal-cutlet-recipe
1218,Punjabi Lobia Masala Recipe (Punjabi Style Black Eyed Beans Curry),Punjabi Lobia Masala Recipe (Punjabi Style Black Eyed Beans Curry),"1 cup Black Eyed Beans (Lobia),2 Onions - finely chopped,2 Tomatoes,1 Green Chilli - slit,1/2 tablespoon Ginger - made into paste,1/2 tablespoon Garlic - made into paste,1 teaspoon Cumin seeds (Jeera),1 inch Cinnamon Stick (Dalchini),1 Bay leaves (tej patta),3 Cloves (Laung),1 teaspoon Red Chilli powder,1/2 teaspoon Turmeric powder (Haldi),2 teaspoons Cumin powder (Jeera),2 teaspoons Coriander Powder (Dhania),1 teaspoon Garam masala powder,1 tablespoon Kasuri Methi (Dried Fenugreek Leaves),1 inch Ginger - cut into juliennes for garnish,1 tablespoon Ghee,Salt - to taste","1 cup Black Eyed Beans (Lobia),2 Onions - finely chopped,2 Tomatoes,1 Green Chilli - slit,1/2 tablespoon Ginger - made into paste,1/2 tablespoon Garlic - made into paste,1 teaspoon Cumin seeds (Jeera),1 inch Cinnamon Stick (Dalchini),1 Bay leaves (tej patta),3 Cloves (Laung),1 teaspoon Red Chilli powder,1/2 teaspoon Turmeric powder (Haldi),2 teaspoons Cumin powder (Jeera),2 teaspoons Coriander Powder (Dhania),1 teaspoon Garam masala powder,1 tablespoon Kasuri Methi (Dried Fenugreek Leaves),1 inch Ginger - cut into juliennes for garnish,1 tablespoon Ghee,Salt - to taste",10,30,40,4,Indian,Dinner,Vegetarian,"To begin making the Punjabi Lobia Masala, wash and soak the lobia for 4 to 5 hours and then pressure cook with enough water for 2 whistles and keep aside.Make a puree of tomatoes using a hand blender and keep aside.Heat ghee in a wok on medium flame, add the cinnamon stick, cloves and bay leaves and let release its aroma into the ghee.Add the cumin seeds and let it crackle.Add the ginger garlic paste and cook until the raw smell goes away.Add the finely chopped onions and saute until it turns light brown.Now, add the slit green chilli, tomato pureè and simmer for 3 minutes.Add the red chilli, turmeric and cumin powder, mix well and let the mixture cook until the ghee leaves the sides.Now, add the cooked lobia along with the water in which it has been boiled and simmer for 5 minutes.Gently smash a few lobia for the gravy to thicken further.Slightly crush the kasuri methi between your palms and add it to the gravy along with garam masala and mix well.Switch off the flame, and garnish with the ginger juliennes.Serve the Punjabi Lobia Masala along with phulkas or steamed rice for a weeknight dinner.
","To begin making the Punjabi Lobia Masala, wash and soak the lobia for 4 to 5 hours and then pressure cook with enough water for 2 whistles and keep aside.Make a puree of tomatoes using a hand blender and keep aside.Heat ghee in a wok on medium flame, add the cinnamon stick, cloves and bay leaves and let release its aroma into the ghee.Add the cumin seeds and let it crackle.Add the ginger garlic paste and cook until the raw smell goes away.Add the finely chopped onions and saute until it turns light brown.Now, add the slit green chilli, tomato pureè and simmer for 3 minutes.Add the red chilli, turmeric and cumin powder, mix well and let the mixture cook until the ghee leaves the sides.Now, add the cooked lobia along with the water in which it has been boiled and simmer for 5 minutes.Gently smash a few lobia for the gravy to thicken further.Slightly crush the kasuri methi between your palms and add it to the gravy along with garam masala and mix well.Switch off the flame, and garnish with the ginger juliennes.Serve the Punjabi Lobia Masala along with phulkas or steamed rice for a weeknight dinner.
",https://www.archanaskitchen.com/punjabi-lobia-masala-recipe-punjabi-style-black-eyed-peas-curry
1219,Delmonte Beetballs Pasta Recipe,Delmonte Beetballs Pasta Recipe,"1 cup Masoor Dal (Whole),150 grams Beetroot,1 Onion,2 cloves Garlic,1/2 teaspoon Cumin powder (Jeera),1/2 teaspoon Coriander Powder (Dhania),1 teaspoon Salt,1/2 cup Whole Wheat Bread crumbs,Sunflower Oil - for deep frying,100 grams Del Monte Spaghetti Pasta,1 tablespoon Extra Virgin Olive Oil - + 1 teaspoon extra,4 cloves Garlic - chopped,1 tablespoon Dried oregano,1 tablespoon Parsley leaves,1-1/2 teaspoon Red Chilli flakes,4 Basil leaves,4 tablespoon Parmesan cheese - grated","1 cup Masoor Dal (Whole),150 grams Beetroot,1 Onion,2 cloves Garlic,1/2 teaspoon Cumin powder (Jeera),1/2 teaspoon Coriander Powder (Dhania),1 teaspoon Salt,1/2 cup Whole Wheat Bread crumbs,Sunflower Oil - for deep frying,100 grams Del Monte Spaghetti Pasta,1 tablespoon Extra Virgin Olive Oil - + 1 teaspoon extra,4 cloves Garlic - chopped,1 tablespoon Dried oregano,1 tablespoon Parsley leaves,1-1/2 teaspoon Red Chilli flakes,4 Basil leaves,4 tablespoon Parmesan cheese - grated",15,45,60,4,Italian Recipes,Lunch,Vegetarian,"To begin making the Delmonte Beetballs Pasta Recipe, wash lentils well and soak it for 20 minutes. Pressure cook the lentils until soft with very little water. We want to have a paste on lentils once cooked and not in liquid form.Peel the skin of beetroots and grate them.Finely chop onions, garlic and keep it aside. .In a bowl add grated beetroot, lentil paste, chopped onions, garlic, cumin powder, and coriander powder, salt and mix well. The mixture should not be firm enough to form balls.Heat oil for deep frying in a wide pan.Divide the beetroot mix into equal portions. Make small lemon sized balls. Deep fry them until golden brown.Remove from oil and drain on kitchen paper.Now cook the pasta as per packet instructions until al- dente. Drain from water and rinse with cold water immediately. Add 1/2 teaspoon olive oil and rub all over the pasta.In a pan heat olive oil. Add garlic and fry for a minute. Add the herbs and red chili flakes and salt to taste. Throw in the cooked pasta and toss well.Remove the pasta into serving plates, top with grated parmesan cheese and place the beetballs.Serve Delmonte Beetballs Pasta Recipe immediately with fresh Watermelon Panzanella Salad or Carrot Ribbon Salad With Asian Sesame Dressing.
","To begin making the Delmonte Beetballs Pasta Recipe, wash lentils well and soak it for 20 minutes. Pressure cook the lentils until soft with very little water. We want to have a paste on lentils once cooked and not in liquid form.Peel the skin of beetroots and grate them.Finely chop onions, garlic and keep it aside. .In a bowl add grated beetroot, lentil paste, chopped onions, garlic, cumin powder, and coriander powder, salt and mix well. The mixture should not be firm enough to form balls.Heat oil for deep frying in a wide pan.Divide the beetroot mix into equal portions. Make small lemon sized balls. Deep fry them until golden brown.Remove from oil and drain on kitchen paper.Now cook the pasta as per packet instructions until al- dente. Drain from water and rinse with cold water immediately. Add 1/2 teaspoon olive oil and rub all over the pasta.In a pan heat olive oil. Add garlic and fry for a minute. Add the herbs and red chili flakes and salt to taste. Throw in the cooked pasta and toss well.Remove the pasta into serving plates, top with grated parmesan cheese and place the beetballs.Serve Delmonte Beetballs Pasta Recipe immediately with fresh Watermelon Panzanella Salad or Carrot Ribbon Salad With Asian Sesame Dressing.",https://www.archanaskitchen.com/delmonte-beetballs-pasta-recipe
1220,Chicken Teriyaki Rice Bowl Recipe,Chicken Teriyaki Rice Bowl Recipe,"200 grams Chicken breasts - cut into bite sized pieces,1/4 cup Sprig Ginger Teriyaki Sauce,1/2 cup Fresh orange juice,1 teaspoon Corn flour,4 cloves Garlic - chopped,1/4 cup Spring Onion Greens - chopped,1 cup Broccoli,1 cup Cooked rice,5 cloves Garlic - chopped,1/2 cup Spring Onion Greens - chopped,1 teaspoon Black pepper powder,Salt - to taste,Sunflower Oil","200 grams Chicken breasts - cut into bite sized pieces,1/4 cup Sprig Ginger Teriyaki Sauce,1/2 cup Fresh orange juice,1 teaspoon Corn flour,4 cloves Garlic - chopped,1/4 cup Spring Onion Greens - chopped,1 cup Broccoli,1 cup Cooked rice,5 cloves Garlic - chopped,1/2 cup Spring Onion Greens - chopped,1 teaspoon Black pepper powder,Salt - to taste,Sunflower Oil",60,30,90,2,Japanese,Lunch,High Protein Non Vegetarian,"To begin making the Chicken Teriyaki Rice Bowl Recipe, we will first wash and clean the chicken pieces thoroughly. For the Chicken TeriyakiTo marinate the chicken in a mixing bowl,  combine the chicken pieces with teriyaki sauce, orange juice, mix well and leave it aside to rest for at least 20 minutes or for 6-8 hours. Once the chicken is marinated, heat a griddle pan on medium heat, drizzle some oil and place the chicken pieces and leave it cook on either side, the chicken will take about 2 minutes to cook on either side. Once done transfer the chicken pieces into a bowl.Set aside the leftover marinade in yet another bowl. Into this bowl with leftover marinated sauce, add corn flour and salt and whisk well.Set a side. Heat a flat skillet with oil, add garlic and saute till it turns brown in colour . Add in spring onions and cook for few seconds and add in the marinated mixture.Add cooked chicken pieces as well and cook until the chicken is coated well with the sauce.For Fried RiceHeat a wok with oil on medium flame , add chopped garlic and saute until they turn golden brown.Add cooked rice, spring onions, salt and pepper to taste. Toss the rice on high flame for 2-3 minutes minutes and keep it aside.For the Broccoli Stir fryTo stir fry the broccoli, heat a small pan on medium flame, add oil and broccoli. Sprinkle little salt and water. Cover it with the lid and cook for 5-7 minutes. Keep stirring at intervals.Finally sprinkle some pepper powder and toss well and keep it aside for serving.To assemble the Chicken Teriyaki Rice Bowl, place the rice agat the bottom of the bowl, and arrange the chicken on one side and broccoli on the other. Serve the Chicken Teriyaki Rice Bowl Recipe along with a glass of Sangria and end it with a cold Strawberry Cheesecake Bars.
","To begin making the Chicken Teriyaki Rice Bowl Recipe, we will first wash and clean the chicken pieces thoroughly. For the Chicken TeriyakiTo marinate the chicken in a mixing bowl,  combine the chicken pieces with teriyaki sauce, orange juice, mix well and leave it aside to rest for at least 20 minutes or for 6-8 hours. Once the chicken is marinated, heat a griddle pan on medium heat, drizzle some oil and place the chicken pieces and leave it cook on either side, the chicken will take about 2 minutes to cook on either side. Once done transfer the chicken pieces into a bowl.Set aside the leftover marinade in yet another bowl. Into this bowl with leftover marinated sauce, add corn flour and salt and whisk well.Set a side. Heat a flat skillet with oil, add garlic and saute till it turns brown in colour . Add in spring onions and cook for few seconds and add in the marinated mixture.Add cooked chicken pieces as well and cook until the chicken is coated well with the sauce.For Fried RiceHeat a wok with oil on medium flame , add chopped garlic and saute until they turn golden brown.Add cooked rice, spring onions, salt and pepper to taste. Toss the rice on high flame for 2-3 minutes minutes and keep it aside.For the Broccoli Stir fryTo stir fry the broccoli, heat a small pan on medium flame, add oil and broccoli. Sprinkle little salt and water. Cover it with the lid and cook for 5-7 minutes. Keep stirring at intervals.Finally sprinkle some pepper powder and toss well and keep it aside for serving.To assemble the Chicken Teriyaki Rice Bowl, place the rice agat the bottom of the bowl, and arrange the chicken on one side and broccoli on the other. Serve the Chicken Teriyaki Rice Bowl Recipe along with a glass of Sangria and end it with a cold Strawberry Cheesecake Bars.",http://www.archanaskitchen.com/chicken-teriyaki-rice-bowl-recipe
1221,Strawberry Smoothie Bowl with chia seeds and Muesli Recipe,Strawberry Smoothie Bowl with chia seeds and Muesli Recipe,"2 tablespoons Instant Oats (Oatmeal),2 Prunes - finely chopped,1 tablespoon Badam (Almond) - finely chopped,1 teaspoon Honey,1 cup Curd (Dahi / Yogurt) - low fat,Water - for cooking,2 tablespoons Muesli - Saffola Nutty Crunch,2 tablespoons Strawberries - chopped,1 tablespoon Chia Seeds","2 tablespoons Instant Oats (Oatmeal),2 Prunes - finely chopped,1 tablespoon Badam (Almond) - finely chopped,1 teaspoon Honey,1 cup Curd (Dahi / Yogurt) - low fat,Water - for cooking,2 tablespoons Muesli - Saffola Nutty Crunch,2 tablespoons Strawberries - chopped,1 tablespoon Chia Seeds",10,15,25,1,Continental,World Breakfast,Vegetarian,"We begin making the Strawberry Smoothie Bowl with chia seeds and Muesli Recipe by combining oats, honey, yogurt and water in a saucepan. Cook them for about 5 minutes till the oats get cooked.To this stir in the prunes and almonds and mix well.  Transfer the smoothie to a serving bowl.Top it up with some chopped strawberries, Muesli and crunchy chia seeds.Serve the Strawberry Smoothie Bowl with chia seeds and Muesli Recipe as your favorite Breakfast in the morning.
","We begin making the Strawberry Smoothie Bowl with chia seeds and Muesli Recipe by combining oats, honey, yogurt and water in a saucepan. Cook them for about 5 minutes till the oats get cooked.To this stir in the prunes and almonds and mix well.  Transfer the smoothie to a serving bowl.Top it up with some chopped strawberries, Muesli and crunchy chia seeds.Serve the Strawberry Smoothie Bowl with chia seeds and Muesli Recipe as your favorite Breakfast in the morning.",https://www.archanaskitchen.com/strawberry-smoothie-bowl-with-chia-seeds-and-muesli-recipe
1222,Oven Roasted Peaches And Cream Recipe,Oven Roasted Peaches And Cream Recipe,"6 Peaches - ripe,1 tablespoon Butter - softened,1 tablespoon Sugar,1 pinch Cinnamon Powder (Dalchini),Walnuts - roasted,Mint Leaves (Pudina) - for garnish,200 ml Heavy whipping cream,3 tablespoons Icing Sugar,1 teaspoon Vanilla Extract","6 Peaches - ripe,1 tablespoon Butter - softened,1 tablespoon Sugar,1 pinch Cinnamon Powder (Dalchini),Walnuts - roasted,Mint Leaves (Pudina) - for garnish,200 ml Heavy whipping cream,3 tablespoons Icing Sugar,1 teaspoon Vanilla Extract",20,30,50,4,Continental,Dessert,Vegetarian,"To begin making the Peaches and Cream Recipe, preheat the oven to 180 C. Cut peaches into half and remove the seeds and toss the peaches in some softened butter, cinnamon and sugar. Place the peaches on a baking sheet and bake it in the preheated oven for about 25 minutes, until the peaches have softened and look tender.  Once done, remove from the oven and keep aside.In the next step, we will prepare the whipped cream. Place some whipped cream in a large mixing bowl or in the bowl of a stand mixer. Add the icing sugar and vanilla extract and using the whip attachment, whip the cream until you get stiff peaks. To serve the Oven Roasted Peaches and Cream, scoop the whipped cream into individual serving glass, place a few oven roasted peaches on the top of the cream. Garnish it with mint or slivered almonds and serve.Serve Oven Roasted Peaches and Cream Recipe as a party dessert after a meal of Ultimate Potato Gratin Dauphinois and Mung Bean Sprouts Salad Recipe With Brussel Sprouts and Pomegranate.
","To begin making the Peaches and Cream Recipe, preheat the oven to 180 C. Cut peaches into half and remove the seeds and toss the peaches in some softened butter, cinnamon and sugar. Place the peaches on a baking sheet and bake it in the preheated oven for about 25 minutes, until the peaches have softened and look tender.  Once done, remove from the oven and keep aside.In the next step, we will prepare the whipped cream. Place some whipped cream in a large mixing bowl or in the bowl of a stand mixer. Add the icing sugar and vanilla extract and using the whip attachment, whip the cream until you get stiff peaks. To serve the Oven Roasted Peaches and Cream, scoop the whipped cream into individual serving glass, place a few oven roasted peaches on the top of the cream. Garnish it with mint or slivered almonds and serve.Serve Oven Roasted Peaches and Cream Recipe as a party dessert after a meal of Ultimate Potato Gratin Dauphinois and Mung Bean Sprouts Salad Recipe With Brussel Sprouts and Pomegranate.",http://www.archanaskitchen.com/oven-roasted-peaches-and-cream-recipe
1224,Karnataka Style Sorakkai Palya Recipe - Karnataka Style Bottle Gourd Sabzi,Karnataka Style Sorakkai Palya Recipe - Karnataka Style Bottle Gourd Sabzi,"1 Bottle gourd (lauki) - peeled and chopped,1 Tomato - chopped,1 teaspoon Cumin seeds (Jeera),1 teaspoon Turmeric powder (Haldi),1 teaspoon Red Chilli powder,2 tablespoon Sambar Powder,1 sprig Curry leaves,Salt - to taste,Sunflower Oil - for cooking","1 Bottle gourd (lauki) - peeled and chopped,1 Tomato - chopped,1 teaspoon Cumin seeds (Jeera),1 teaspoon Turmeric powder (Haldi),1 teaspoon Red Chilli powder,2 tablespoon Sambar Powder,1 sprig Curry leaves,Salt - to taste,Sunflower Oil - for cooking",10,30,40,3,Karnataka,Lunch,Vegetarian,"We begin making the Karnataka Style Sorakkai Palya Recipe (Pressure Cooked Bottle Gourd Recipe) by heating oil in the pressure cooker, temper the cumin seeds and add the curry leaves. Let the curry leaves splutter for few seconds.Then add the chopped tomato, saute with little salt till it is mushy and is cooked, at this point, you can add in the spice powders like turmeric powder, red chilli powder, and sambar powder and also mix in the chopped bottle gourd. Check for seasoning if required.Once it is evenly coated, add 1/2 cup water and pressure cook it for 3 whistles till it is done, let the pressure release naturally and then serve hot. Serve Karnataka Style Sorakkai Palya Recipe along with Mixed Vegetable Sambar and Steamed Rice for a weekday meal.
","We begin making the Karnataka Style Sorakkai Palya Recipe (Pressure Cooked Bottle Gourd Recipe) by heating oil in the pressure cooker, temper the cumin seeds and add the curry leaves. Let the curry leaves splutter for few seconds.Then add the chopped tomato, saute with little salt till it is mushy and is cooked, at this point, you can add in the spice powders like turmeric powder, red chilli powder, and sambar powder and also mix in the chopped bottle gourd. Check for seasoning if required.Once it is evenly coated, add 1/2 cup water and pressure cook it for 3 whistles till it is done, let the pressure release naturally and then serve hot. Serve Karnataka Style Sorakkai Palya Recipe along with Mixed Vegetable Sambar and Steamed Rice for a weekday meal.",http://www.archanaskitchen.com/karnataka-style-sorakkai-palya-recipe-pressure-cooked-bottle-gourd-recipe
