Srno,RecipeName,TranslatedRecipeName,Ingredients,TranslatedIngredients,PrepTimeInMins,CookTimeInMins,TotalTimeInMins,Servings,Cuisine,Course,Diet,Instructions,TranslatedInstructions,URL
5653,Spicy Yogurt Chapati/Roti Recipe,Spicy Yogurt Chapati/Roti Recipe,"2 cups Whole Wheat Flour,1-1/2 cup Curd (Dahi / Yogurt),1/2 cup Water,3 Green Chillies - ground to paste,3 tablespoons Coriander (Dhania) Leaves - finely chopped,1 tablespoon Sunflower Oil,1 teaspoon Cumin seeds (Jeera),Ghee - as needed,Salt - to taste","2 cups Whole Wheat Flour,1-1/2 cup Curd (Dahi / Yogurt),1/2 cup Water,3 Green Chillies - ground to paste,3 tablespoons Coriander (Dhania) Leaves - finely chopped,1 tablespoon Sunflower Oil,1 teaspoon Cumin seeds (Jeera),Ghee - as needed,Salt - to taste",20,25,45,4,Indian,Lunch,Vegetarian,"To begin making the Spicy Yogurt Chapati recipe, In a large saucepan/vessel, add yogurt, jeera, chilli paste, coriander, salt and oil.Whisk everything until smooth and lump-free. Add 1/2 cup of water and mix it all together. Now bring this to a gentle boil and lower the flame and pour the wheat flour to the centre as much as possible and let it cook on a low flame for approximately 4 to 5 minutes.Turn of the flame and vigorously mix this with a wet wooden stick or a spatula until this mixture comes together. Should take about 2 minutes.Keep it covered until it slightly cools down and until you can handle the mixture with your hands.Knead it thoroughly for 5 to 6 minutes and divide the mixture into 10 equal portions.Now knead each of these balls for 20 seconds and shape it into pedas (round flatten balls).Roll the pedas into chapathis by dusting some wheat flour and roast simultaneously or roll all of them and stack them on top of each other by spreading some flour between each chapathi.And roast on a hot tava on both sides by smearing some oil or ghee. Serve Spicy Yogurt Chapati along with Panchmel Dal and Bharwa Besan Mirch Sabzi for a weekday lunch or dinner. You can also pack it for your lunch box.
","To begin making the Spicy Yogurt Chapati recipe, In a large saucepan/vessel, add yogurt, jeera, chilli paste, coriander, salt and oil.Whisk everything until smooth and lump-free. Add 1/2 cup of water and mix it all together. Now bring this to a gentle boil and lower the flame and pour the wheat flour to the centre as much as possible and let it cook on a low flame for approximately 4 to 5 minutes.Turn of the flame and vigorously mix this with a wet wooden stick or a spatula until this mixture comes together. Should take about 2 minutes.Keep it covered until it slightly cools down and until you can handle the mixture with your hands.Knead it thoroughly for 5 to 6 minutes and divide the mixture into 10 equal portions.Now knead each of these balls for 20 seconds and shape it into pedas (round flatten balls).Roll the pedas into chapathis by dusting some wheat flour and roast simultaneously or roll all of them and stack them on top of each other by spreading some flour between each chapathi.And roast on a hot tava on both sides by smearing some oil or ghee. Serve Spicy Yogurt Chapati along with Panchmel Dal and Bharwa Besan Mirch Sabzi for a weekday lunch or dinner. You can also pack it for your lunch box.",http://www.archanaskitchen.com/spicy-yogurt-chapati-recipe
5654,Bread Waffle Pizza Recipe,Bread Waffle Pizza Recipe,"8 Whole Wheat Brown Bread,1/4 cup Mozzarella cheese - grated,1 Onion - chopped,1 Green Bell Pepper (Capsicum) - chopped,1 Tomato - chopped,2 tablespoons Sweet corn,15 Baby spinach,Black pepper powder - to taste,4 tablespoons Homemade Pizza And Pasta Sauce,1/2 teaspoon Dried oregano,Butter - to grease waffle iron","8 Whole Wheat Brown Bread,1/4 cup Mozzarella cheese - grated,1 Onion - chopped,1 Green Bell Pepper (Capsicum) - chopped,1 Tomato - chopped,2 tablespoons Sweet corn,15 Baby spinach,Black pepper powder - to taste,4 tablespoons Homemade Pizza And Pasta Sauce,1/2 teaspoon Dried oregano,Butter - to grease waffle iron",10,20,30,4,Continental,World Breakfast,Vegetarian,"To begin making the Bread Waffle Pizza Recipe, firstly cut the sides of each bread slice.Grease waffle iron with butter and put one bread slice over it. Now spread pizza sauce and arrange chopped vegetables including onion, green bell peppper, sweet corn, tomato and baby spinach over it.Add mozzarella cheese over the bread slice. Now, sprinkle black pepper powder and dried oregano leaves. Cover it with another bread slice.Cover and cook it for 5 minutes or until it turns golden in colour.Repeat the same process to make more waffles.Serve Bread Waffle Pizza Recipe along with Watermelon Panzanella Salad, Penne Pasta Arrabiata and Chocolate Ganache Tart for your weekend brunch..
","To begin making the Bread Waffle Pizza Recipe, firstly cut the sides of each bread slice.Grease waffle iron with butter and put one bread slice over it. Now spread pizza sauce and arrange chopped vegetables including onion, green bell peppper, sweet corn, tomato and baby spinach over it.Add mozzarella cheese over the bread slice. Now, sprinkle black pepper powder and dried oregano leaves. Cover it with another bread slice.Cover and cook it for 5 minutes or until it turns golden in colour.Repeat the same process to make more waffles.Serve Bread Waffle Pizza Recipe along with Watermelon Panzanella Salad, Penne Pasta Arrabiata and Chocolate Ganache Tart for your weekend brunch..",https://www.archanaskitchen.com/bread-waffle-pizza-recipe
5655,Nuchinunde / Nucchina Unde Recipe -Karnataka Style Dal Steamed Pakora,Nuchinunde / Nucchina Unde Recipe -Karnataka Style Dal Steamed Pakora,"1 cup Arhar dal (Split Toor Dal),1/2 cup Chana dal (Bengal Gram Dal) - optional,1/2 cup Dill leaves - finely chopped,6-7 Green Chillies - finely chopped,Ginger - small piece,1/2 cup Fresh coconut,sprig Coriander (Dhania) Leaves,Curry leaves,1 pinch Asafoetida (hing),1 pinch Turmeric powder (Haldi),Salt - to taste","1 cup Arhar dal (Split Toor Dal),1/2 cup Chana dal (Bengal Gram Dal) - optional,1/2 cup Dill leaves - finely chopped,6-7 Green Chillies - finely chopped,Ginger - small piece,1/2 cup Fresh coconut,sprig Coriander (Dhania) Leaves,Curry leaves,1 pinch Asafoetida (hing),1 pinch Turmeric powder (Haldi),Salt - to taste",150,35,185,10,Karnataka,Snack,Vegetarian,"To prepare Nuchinunde / Nucchina Unde Recipe , wash and soak dals in water for about 2-3 hours. Drain water.In a mixer, pulse the lentils coarsely along with green chillies and ginger without adding any water.In a bowl, mix together ground lentils, dill leaves, coriander , curry leaves, coconut, hing & salt.Heat water in a steamer. Grease idli molds with oil.Make oval shaped dumplings and place them in the greased idli stand. Steam cook for 10-15 minutes.When done, serve hot / warm Nucchinunde / Nucchina Unde Recipe with majjige huli / kadale chutney recipe or with tea during evening.
","To prepare Nuchinunde / Nucchina Unde Recipe , wash and soak dals in water for about 2-3 hours. Drain water.In a mixer, pulse the lentils coarsely along with green chillies and ginger without adding any water.In a bowl, mix together ground lentils, dill leaves, coriander , curry leaves, coconut, hing & salt.Heat water in a steamer. Grease idli molds with oil.Make oval shaped dumplings and place them in the greased idli stand. Steam cook for 10-15 minutes.When done, serve hot / warm Nucchinunde / Nucchina Unde Recipe with majjige huli / kadale chutney recipe or with tea during evening.",https://www.archanaskitchen.com/nucchinunde-nucchina-unde-recipe-karnataka-style-dal-steamed-pakora
5656,Kerala Style Kappa Ulathiyathu Recipe - Tapioca Stir Fry Recipe,Kerala Style Kappa Ulathiyathu Recipe - Tapioca Stir Fry Recipe,"2 Tapioca root,1 teaspoon Mustard seeds,1 cup Shallots - chopped,1 inch Ginger - chopped,1 sprig Curry leaves,2 Dry Red Chilli,2 tablespoon Fresh coconut - grated,1/2 teaspoon Turmeric powder (Haldi),Salt - to taste,Coconut Oil - for cooking","2 Tapioca root,1 teaspoon Mustard seeds,1 cup Shallots - chopped,1 inch Ginger - chopped,1 sprig Curry leaves,2 Dry Red Chilli,2 tablespoon Fresh coconut - grated,1/2 teaspoon Turmeric powder (Haldi),Salt - to taste,Coconut Oil - for cooking",10,35,45,4,Kerala Recipes,Appetizer,Vegetarian,"To begin making the Kerala Style Kappa Ularthiyathu Recipe, firstly cut the tapioca and boiling them in a pressure cooker with water and salt for about 3 whistle.Once done release the pressure naturally and drain the water and peel off the skin, cut them into big chunks and keep it aside.We begin by heating kadai with oil, crackle the mustard seeds, and curry leaves and dry red chillies.Then add in the onions and ginger and fry them till it is translucent, you can add the turmeric powder.Once that is done, add in the boiled tapioca and salt and fry them till it evenly coated. Cook for 2 minutes, switch off the gas and serve hot.Serve the Kerala Style Kappa Ularthiyathu Recipe along with Kerala Style Fish Curry Recipe or Chettinad Muttai Masala Recipe and Kerala Parotta for an everyday meal.
","To begin making the Kerala Style Kappa Ularthiyathu Recipe, firstly cut the tapioca and boiling them in a pressure cooker with water and salt for about 3 whistle.Once done release the pressure naturally and drain the water and peel off the skin, cut them into big chunks and keep it aside.We begin by heating kadai with oil, crackle the mustard seeds, and curry leaves and dry red chillies.Then add in the onions and ginger and fry them till it is translucent, you can add the turmeric powder.Once that is done, add in the boiled tapioca and salt and fry them till it evenly coated. Cook for 2 minutes, switch off the gas and serve hot.Serve the Kerala Style Kappa Ularthiyathu Recipe along with Kerala Style Fish Curry Recipe or Chettinad Muttai Masala Recipe and Kerala Parotta for an everyday meal.",http://www.archanaskitchen.com/kerala-style-kappa-ulathiyatu-recipe-tapioca-stir-fry-recipe
5657,Minced Mutton Spring Rolls Recipe,Minced Mutton Spring Rolls Recipe,"250 grams Mutton - boneless and washed,1 Onion - finely chopped,10 cloves Garlic - finely chopped,1 inch Ginger - finely chopped,2 Green Chillies - finely chopped,1/4 teaspoon Turmeric powder (Haldi),1 teaspoon Red Chilli powder,2 teaspoon Coriander (Dhania) Powder,1 teaspoon Cumin powder (Jeera),1 teaspoon Garam masala powder,Salt - to taste,2 tablespoon Mint Leaves (Pudina) - chopped,1/2 cup All Purpose Flour (Maida),1/4 cup Corn flour,1 cup Water,Salt - to taste,2 tablespoons All Purpose Flour (Maida),Water - a little","250 grams Mutton - boneless and washed,1 Onion - finely chopped,10 cloves Garlic - finely chopped,1 inch Ginger - finely chopped,2 Green Chillies - finely chopped,1/4 teaspoon Turmeric powder (Haldi),1 teaspoon Red Chilli powder,2 teaspoon Coriander (Dhania) Powder,1 teaspoon Cumin powder (Jeera),1 teaspoon Garam masala powder,Salt - to taste,2 tablespoon Mint Leaves (Pudina) - chopped,1/2 cup All Purpose Flour (Maida),1/4 cup Corn flour,1 cup Water,Salt - to taste,2 tablespoons All Purpose Flour (Maida),Water - a little",40,30,70,6,Indian,Snack,High Protein Non Vegetarian,"To begin making the Minced Mutton Spring Rolls Recipe, firstly we will mince the mutton. For this, add the mutton pieces into a preethi turbo chop. Pulse it until it becomes coarsely grounded.The next step is to make the filling for the spring rolls: Add the required oil in a heavy bottomed pan. Once the oil is hot, add the onions, ginger, garlic and green chillies. Saute until the onions becomes soft and translucent. Once the onions are soft, add the minced mutton and saute for another 2 minutes till the mutton changes its colour.Next, add the turmeric powder, red chili powder, coriander powder, cumin powder, garam masala powder and salt to taste. Saute well until well combined.Add little water if required, cover and let it cook till the mutton keema is cooked properly and all the moisture has evaporated. This will take about 8 to 10 minutes.Once done, turn off the heat and add in fresh chopped mint leaves. Mix well and keep it aside. Your filling for the spring rolls is ready.To make the Spring Roll Wrappers:Into a mixing bowl, add the all purpose flour, corn flour, salt and water to make a thin flowing batter. Whisk well until smooth and there are no lumps.Heat and grease a nonstick pan with oil. Once the pan is hot, on medium heat, pour a ladle of the batter into the pan and tilt the pan around quickly to make a thin crepe.Cook on medium heat until you see the sides are beginning to peel off. When the sides begin to peel off, turn the wrapper and cook on the other side for a few seconds. Do not keep the wrapper cooking for long as the wrappers become stiff and dry up.Repeat with the remaining batter to make more wrappers. Keep aside.Next, in a mixing bowl, add all purpose flour and a little water to make a thick paste. We will be using this to seal the edges of the Mince Mutton Spring Rolls. Place each spring roll wrapper on a flat surface. Apply a little flour paste along the edges of the wrapper. Place a tablespoon of the minced mutton filling at one corner/edge of the wrapper.Roll over the filling tightly. Apply a little more paste around the edges and fold the sides and finally roll to make the spring roll. Repeat the same process and proceed to make the rest of the Minced Mutton Spring Rolls.Preheat the oil for deep frying; slide in a few minced mutton spring rolls at a time and deep fry on medium heat until golden brown and crisp. Once done, remove the Minced Mutton Spring Roll onto an oil absorbent paper, so that it soaks the excess oil from the Spring Rolls. It is ready to be served.Serve Minced Mutton Spring Rolls Recipe as a tea time snack along with Green Chutney and Pudina Pyaz Kachumber Salad for your party starters.
","To begin making the Minced Mutton Spring Rolls Recipe, firstly we will mince the mutton. For this, add the mutton pieces into a preethi turbo chop. Pulse it until it becomes coarsely grounded.The next step is to make the filling for the spring rolls: Add the required oil in a heavy bottomed pan. Once the oil is hot, add the onions, ginger, garlic and green chillies. Saute until the onions becomes soft and translucent. Once the onions are soft, add the minced mutton and saute for another 2 minutes till the mutton changes its colour.Next, add the turmeric powder, red chili powder, coriander powder, cumin powder, garam masala powder and salt to taste. Saute well until well combined.Add little water if required, cover and let it cook till the mutton keema is cooked properly and all the moisture has evaporated. This will take about 8 to 10 minutes.Once done, turn off the heat and add in fresh chopped mint leaves. Mix well and keep it aside. Your filling for the spring rolls is ready.To make the Spring Roll Wrappers:Into a mixing bowl, add the all purpose flour, corn flour, salt and water to make a thin flowing batter. Whisk well until smooth and there are no lumps.Heat and grease a nonstick pan with oil. Once the pan is hot, on medium heat, pour a ladle of the batter into the pan and tilt the pan around quickly to make a thin crepe.Cook on medium heat until you see the sides are beginning to peel off. When the sides begin to peel off, turn the wrapper and cook on the other side for a few seconds. Do not keep the wrapper cooking for long as the wrappers become stiff and dry up.Repeat with the remaining batter to make more wrappers. Keep aside.Next, in a mixing bowl, add all purpose flour and a little water to make a thick paste. We will be using this to seal the edges of the Mince Mutton Spring Rolls. Place each spring roll wrapper on a flat surface. Apply a little flour paste along the edges of the wrapper. Place a tablespoon of the minced mutton filling at one corner/edge of the wrapper.Roll over the filling tightly. Apply a little more paste around the edges and fold the sides and finally roll to make the spring roll. Repeat the same process and proceed to make the rest of the Minced Mutton Spring Rolls.Preheat the oil for deep frying; slide in a few minced mutton spring rolls at a time and deep fry on medium heat until golden brown and crisp. Once done, remove the Minced Mutton Spring Roll onto an oil absorbent paper, so that it soaks the excess oil from the Spring Rolls. It is ready to be served.Serve Minced Mutton Spring Rolls Recipe as a tea time snack along with Green Chutney and Pudina Pyaz Kachumber Salad for your party starters.",https://www.archanaskitchen.com/minced-mutton-spring-rolls-recipe
5658,इडली रेसिपी - Homemade Soft Idli (Recipe In Hindi), Homemade Soft Idli (Recipe In Hindi),"इडली डोसा मिश्रण - प्रयोग अनुसार,तिल का तेल - या घी","Idli dosa mixture - sesame oil - or ghee, as per the experiment",480,20,500,4,South Indian Recipes,South Indian Breakfast,High Protein Vegetarian,"इडली बनाने के लिए सबसे पहले इडली बनाने के बर्तन पर थोड़ा तिल का तेल लगा ले. आप यहाँ पर घी या किसी और तेल का भी प्रयोग कर सकते है. इडली मोउल्ड्स में इडली का मिश्रण भरे. इडली को अद्धा ही भरे क्यूंकि बनाने के बाद इडली उभर जाती है. इडली स्टीमर में निचे थोड़ा पानी रखे और इडली मोउल्ड्स को इ के ऊपर एक रख दे. इडली स्टीमर को ढक दे और तेज आंच पर 10 मिनट के लिए पकने दे. 10 मिनट के बाद चाकू डालकर चेक करें की इडली पकी या नहीं। अगर चाकू पर कुछ नहीं चिपके, मतलब आपकी इडली तैयार है.इडली को चाकू में मदद से निकले और परोसे। इडली को टमाटर प्याज सांबर और नारियल की चटनी के साथ सुबह के नाश्ते के लिए परोसे।
","To make idli, firstly apply a little sesame oil on the idli preparation vessel. You can also use ghee or some other oil here. Fill idli mixture in idli molds. The idli emerges after making the idli full of faith. Put some water below in the idli steamer and place the idli molds on top of it. Cover the idli steamer and let it cook for 10 minutes on high heat. After 10 minutes, insert the knife and check if the idli is cooked or not. If nothing sticks to the knife, you mean your idli is ready. Remove and serve the idli with the help of a knife. Serve the idli with tomato onion sambar and coconut chutney for breakfast.",https://www.archanaskitchen.com/homemade-soft-idli-recipe-in-hindi
5660,Paneer Peshawari Recipe - Cottage Cheese In Rich Gravy,Paneer Peshawari Recipe - Cottage Cheese In Rich Gravy,"1-1/2 cups Paneer (Homemade Cottage Cheese) - cut into big cubes,2 Onions - finely chopped,1 cup Homemade tomato puree,2 tablespoons Whole cashews - soaked in 1/4 cup warm water,2 tablespoons Fresh cream,1 teaspoon Cumin seeds (Jeera),1 Bay leaf (tej patta),1 tablespoon Ginger Garlic Paste,1/4 teaspoon Turmeric powder (Haldi),1 teaspoon Cumin powder (Jeera),1 teaspoon Garam masala powder,2 teaspoons Kashmiri Red Chilli Powder,2 teaspoon Coriander Powder (Dhania),1 tablespoon Kasuri Methi (Dried Fenugreek Leaves),1 tablespoon Honey,1 tablespoon Butter,Salt - to taste","1-1/2 cups Paneer (Homemade Cottage Cheese) - cut into big cubes,2 Onions - finely chopped,1 cup Homemade tomato puree,2 tablespoons Whole cashews - soaked in 1/4 cup warm water,2 tablespoons Fresh cream,1 teaspoon Cumin seeds (Jeera),1 Bay leaf (tej patta),1 tablespoon Ginger Garlic Paste,1/4 teaspoon Turmeric powder (Haldi),1 teaspoon Cumin powder (Jeera),1 teaspoon Garam masala powder,2 teaspoons Kashmiri Red Chilli Powder,2 teaspoon Coriander Powder (Dhania),1 tablespoon Kasuri Methi (Dried Fenugreek Leaves),1 tablespoon Honey,1 tablespoon Butter,Salt - to taste",10,30,40,4,Punjabi,Lunch,Vegetarian,"To begin making Paneer Peshawari Recipe, soak the cashew nuts in hot water for 10 minutes.Combine the soaked and drained cashews in a mixer jar and grind into a smooth paste using a mixer grinder. Transfer to a bowl and keep aside.Heat butter in a wide pan on medium flame. Once the butter has melted, add the cumin seeds and bay leaf, let the cumin seeds sizzle. To this, add ginger-garlic paste, chopped onions and saute for 2-3 minutes, until the onions turn translucent and soft. Once the tomatoes have softened, add the cumin powder, kashmiri red chilli powder, turmeric powder, garam masala powder, coriander powder and mix well. This will help the raw smell go away from the onions, ginger and garlic.Stir the spices for a few seconds and then add in the tomato puree and cashew paste.Saute for the Peshawari masala for about 5 minutes on medium heat until the gravy thickens and the tomato and cashews combine well along with the spices to form a creamy gravy. When you add cashew nuts the gravy tends to thicken and hence you can adjust the consistency by adding 1/4 cup of water. Stir in the paneer, kasuri methi,and the honey and simmer Paneer Peshawari Recipe for another 5 minutes.Check the salt and spices in the Paneer Peshawari Recipe gravy and adjust to suit your taste.Once done, stir in the cream into the Paneer Peshawari Recipe and serve hot.Serve the Paneer Peshawari Recipe for a party along with Kashmiri Pulao Recipe, Butter Garlic Naan Recipe and Boondi Raita Recipe, and Kala Chana Salad for a complete party meal.
","To begin making Paneer Peshawari Recipe, soak the cashew nuts in hot water for 10 minutes.Combine the soaked and drained cashews in a mixer jar and grind into a smooth paste using a mixer grinder. Transfer to a bowl and keep aside.Heat butter in a wide pan on medium flame. Once the butter has melted, add the cumin seeds and bay leaf, let the cumin seeds sizzle. To this, add ginger-garlic paste, chopped onions and saute for 2-3 minutes, until the onions turn translucent and soft. Once the tomatoes have softened, add the cumin powder, kashmiri red chilli powder, turmeric powder, garam masala powder, coriander powder and mix well. This will help the raw smell go away from the onions, ginger and garlic.Stir the spices for a few seconds and then add in the tomato puree and cashew paste.Saute for the Peshawari masala for about 5 minutes on medium heat until the gravy thickens and the tomato and cashews combine well along with the spices to form a creamy gravy. When you add cashew nuts the gravy tends to thicken and hence you can adjust the consistency by adding 1/4 cup of water. Stir in the paneer, kasuri methi,and the honey and simmer Paneer Peshawari Recipe for another 5 minutes.Check the salt and spices in the Paneer Peshawari Recipe gravy and adjust to suit your taste.Once done, stir in the cream into the Paneer Peshawari Recipe and serve hot.Serve the Paneer Peshawari Recipe for a party along with Kashmiri Pulao Recipe, Butter Garlic Naan Recipe and Boondi Raita Recipe, and Kala Chana Salad for a complete party meal.",http://www.archanaskitchen.com/paneer-peshawari-recipe-cottage-cheese-in-rich-gravy
