Srno,RecipeName,TranslatedRecipeName,Ingredients,TranslatedIngredients,PrepTimeInMins,CookTimeInMins,TotalTimeInMins,Servings,Cuisine,Course,Diet,Instructions,TranslatedInstructions,URL
1163,Besan Oats Ladoo Recipe,Besan Oats Ladoo Recipe,"1 cup Gram flour (besan),1/2 cup Instant Oats (Oatmeal),3/4 cup Sugar - powdered,1/4 tablespoon Cardamom Powder (Elaichi),1/4 cup Ghee,1-2 tablespoon Pistachios - coarsely powdered","1 cup Gram flour (besan),1/2 cup Instant Oats (Oatmeal),3/4 cup Sugar - powdered,1/4 tablespoon Cardamom Powder (Elaichi),1/4 cup Ghee,1-2 tablespoon Pistachios - coarsely powdered",25,15,40,4,Indian,Dessert,Vegetarian,"To begin making the Besan Oats Ladoo Recipe, first dry roast the oats in a kadai on a medium heat. This should take about 2-3 minutes, tossing the oats gently. Transfer the roasted oats into a plate and set aside to cool.Once cool enough, put the oats in a grinder and make a fine powder.In the same kadai, on a medium heat, dry roast the besan too. Take care to continuously stir the besan, to avoid burning it.You will know when the besan is roasted fully when the raw smell goes away, and the besan begins to smell toasted. This usually takes about 10-12 minutes and the colour will change a little bit. Do make sure you roast the besan on low to medium heat to avoid it getting burnt.Take the besan off the heat, add the roasted powdered oats, powdered sugar and cardamom to it and mix gently using a wooden spoon. Set this mixture aside.Melt the ghee in a bowl. You can either do this in short bursts in the microwave, or over a medium heat in a small pan.Add the melted ghee, one spoon at a time, into the mixture of roasted besan, roasted oats powder, powdered sugar and cardamom and fold till it comes together. The mixture will get clumpy and resemble wet sand.By now the ladoo mixture would be cool enough to handle. Grease your palms with ghee and using your fingers bring the besan ladoo powder and ghee together. Gently shape the mixture into ladoos of the size you desire.Sprinkle the Besan Oats Ladoo with coarsely powdered pistachio or any nut of your choice and arrange on a festive platter.Serve The Besan Oats Ladoo on any of the upcoming festivals or store in an air-tight box for later use. They make excellent additions to your child’s snack box too!Serve Besan Oats Ladoo as a dessert after your everyday meal of Palak Dal, Bharwa Baingan and Phulka.
","To begin making the Besan Oats Ladoo Recipe, first dry roast the oats in a kadai on a medium heat. This should take about 2-3 minutes, tossing the oats gently. Transfer the roasted oats into a plate and set aside to cool.Once cool enough, put the oats in a grinder and make a fine powder.In the same kadai, on a medium heat, dry roast the besan too. Take care to continuously stir the besan, to avoid burning it.You will know when the besan is roasted fully when the raw smell goes away, and the besan begins to smell toasted. This usually takes about 10-12 minutes and the colour will change a little bit. Do make sure you roast the besan on low to medium heat to avoid it getting burnt.Take the besan off the heat, add the roasted powdered oats, powdered sugar and cardamom to it and mix gently using a wooden spoon. Set this mixture aside.Melt the ghee in a bowl. You can either do this in short bursts in the microwave, or over a medium heat in a small pan.Add the melted ghee, one spoon at a time, into the mixture of roasted besan, roasted oats powder, powdered sugar and cardamom and fold till it comes together. The mixture will get clumpy and resemble wet sand.By now the ladoo mixture would be cool enough to handle. Grease your palms with ghee and using your fingers bring the besan ladoo powder and ghee together. Gently shape the mixture into ladoos of the size you desire.Sprinkle the Besan Oats Ladoo with coarsely powdered pistachio or any nut of your choice and arrange on a festive platter.Serve The Besan Oats Ladoo on any of the upcoming festivals or store in an air-tight box for later use. They make excellent additions to your child’s snack box too!Serve Besan Oats Ladoo as a dessert after your everyday meal of Palak Dal, Bharwa Baingan and Phulka.",https://www.archanaskitchen.com/besan-oats-ladoo-recipe
1165,Ada Pradhaman Recipe With Homemade Ada- Kerala Special Payasam Recipe,Ada Pradhaman Recipe With Homemade Ada- Kerala Special Payasam Recipe,"3/4 cup Jaggery - powdered,1 cup Coconut milk - thick one,2 Cardamom (Elaichi) Pods/Seeds - powdered,1/2 teaspoon Ghee,1/4 cup Rice flour,1/4 cup Hot water,Salt - a pinch,1 Banana leaf,1/2 teaspoon Sunflower Oil - for greasing,10 Cashew nuts,1/4 cup Fresh coconut - finely chopped or thinly sliced coconut pieces,10 Raisins,1 teaspoon Ghee","3/4 cup Jaggery - powdered,1 cup Coconut milk - thick one,2 Cardamom (Elaichi) Pods/Seeds - powdered,1/2 teaspoon Ghee,1/4 cup Rice flour,1/4 cup Hot water,Salt - a pinch,1 Banana leaf,1/2 teaspoon Sunflower Oil - for greasing,10 Cashew nuts,1/4 cup Fresh coconut - finely chopped or thinly sliced coconut pieces,10 Raisins,1 teaspoon Ghee",10,35,45,3,South Indian Recipes,Dessert,Vegetarian,"To prepare Ada Pradhaman Recipe With Homemade Ada, let us first make the ada.To make homemade rice ada, in a mixing bowl, combine rice flour with a pinch of salt in a bowl and pour boiling hot water into the flour and combine it to make a dough using a spoon/spatula. Preheat a steamer, to steam the adas. Grease a banana leaf with oil and spread the rice dough into a thin layer on half of the banana leaf.Close the ada using the other side of the banana leaf.Steam cook this for 10-15 minutes.Once cool, remove the ada from the leaf and cut into smaller pieces to look flaky.To proceed with payasam recipe, heat a pan with ghee on low flame add the cashews, coconut, and raisins till they are golden. Turn off the flame and set aside. Heat a saucepan, on medium heat, add jaggery with 3/4 cup of water, heat till the jaggery dissolves, once it is well dissolved, turn off the flame.  Pass the jaggery syrup through a strainer and set aside.Heat another saucepan,  add chopped ada , and dry roast the ada for 2-3 minutes, now add the jaggery syrup to it. Let the ada cook in jaggery water over low flame for 7-8 minutes or until the aggery syrup thickens. At this stage add the cardamom powder, coconut milk and turn off the flame. Make sure not to cook after adding coconut milk.Garnish with the fried cashews, coconut, and raisins.Your delicious Ada Pradhaman Recipe With Homemade Ada is ready to be served during the festive lunch!
","To prepare Ada Pradhaman Recipe With Homemade Ada, let us first make the ada.To make homemade rice ada, in a mixing bowl, combine rice flour with a pinch of salt in a bowl and pour boiling hot water into the flour and combine it to make a dough using a spoon/spatula. Preheat a steamer, to steam the adas. Grease a banana leaf with oil and spread the rice dough into a thin layer on half of the banana leaf.Close the ada using the other side of the banana leaf.Steam cook this for 10-15 minutes.Once cool, remove the ada from the leaf and cut into smaller pieces to look flaky.To proceed with payasam recipe, heat a pan with ghee on low flame add the cashews, coconut, and raisins till they are golden. Turn off the flame and set aside. Heat a saucepan, on medium heat, add jaggery with 3/4 cup of water, heat till the jaggery dissolves, once it is well dissolved, turn off the flame.  Pass the jaggery syrup through a strainer and set aside.Heat another saucepan,  add chopped ada , and dry roast the ada for 2-3 minutes, now add the jaggery syrup to it. Let the ada cook in jaggery water over low flame for 7-8 minutes or until the aggery syrup thickens. At this stage add the cardamom powder, coconut milk and turn off the flame. Make sure not to cook after adding coconut milk.Garnish with the fried cashews, coconut, and raisins.Your delicious Ada Pradhaman Recipe With Homemade Ada is ready to be served during the festive lunch!",http://www.archanaskitchen.com/ada-pradaman-with-homemade-ada-kerala-special-payasam-recipe
1167,अचारी पनीर रेसिपी - Spicy Pickled Paneer Gravy (Recipe In Hindi), Spicy Pickled Paneer Gravy (Recipe In Hindi),"250 ग्राम्स पनीर,घी - या तेल,2 बड़ा चमच्च अचार - आम का अचार मसाले के साथ,2 प्याज - कस ले,1 बड़ा चमच्च अदरक लहसुन का पेस्ट,1/2 बड़ा चमच्च लाल मिर्च पाउडर,1/2 छोटा चमच्च हल्दी पाउडर,1/2 छोटा चमच्च जीरा पाउडर,1/2 छोटा चमच्च गरम मसाला पाउडर,1 छोटा चमच्च अजवाइन,1 छोटा चमच्च सौंफ,पानी - प्रयोग अनुसार,1 शिमला मिर्च (हरी) - काट ले,1 कप टमाटर प्यूरी,1 छोटा चमच्च कसूरी मेथी,नमक - स्वाद अनुसार,Few टहनी हरा धनिया - बारीक काट ले","250 grams Paneer, Ghee - or oil, 2 tablespoons pickle - mango pickle with spices, 2 onions - grated, 1 tablespoon ginger garlic paste, 1/2 tablespoon red chili powder, 1/2 teaspoon turmeric Powder, 1/2 teaspoon cumin powder, 1/2 teaspoon garam masala powder, 1 teaspoon celery, 1 teaspoon fennel, water - as per use, 1 capsicum (green) - cut, 1 cup tomato puree, 1 Teaspoon Kasuri methi, salt - as per taste, Few branch green coriander - finely chopped",30,30,60,4,North Indian Recipes,Lunch,High Protein Vegetarian,"अचारी पनीर बनाने के लिए सबसे पहले एक कढ़ाई में घी गरम कर ले. अब इसमें प्याज डाले और उनके भूरा होने तक पकाए। अब एक मिक्सर ले, उसमे अचार, लहसुन अदरक का पेस्ट, लाल मिर्च पाउडर, हल्दी पाउडर, जीरा पाउडर और गरम मसाला पाउडर, थोड़ा पानी डाले और पीस ले. अब एक कढ़ाई में तेल गरम करें। इसमें अजवाइन, सौंफ और पिसा हुआ मसाला डाले। 2 मिनट के लिए पकने दे. 2 मिनट के बाद इसमें शिमला मिर्च डाले, मिलाए और 3 से 4 मिनट तक पकाए। 4 मिनट के बाद इसमें टमाटर प्यूरी, थोड़ा पानी डाले और कढ़ाई को ढक ले. 5 से 7 मिनट के लिए पकने दे. 7 मिनट के बाद इसमें पनीर, कसूरी मेथी और नमक डाले। मिलाए और इसको 2 से 3 मिनट तक पकने दे. 3 मिनट के बाद, गैस बंद करें और हरे धनिये से गार्निश करें। अचारी पनीर को दाल फ्राई, फुल्का और जीरा चावल के साथ दिन के खाने के लिए परोसे।
","To make Achari Paneer, first heat ghee in a pan. Now add onions and cook till they turn brown. Now take a mixer, add pickle, garlic ginger paste, red chilli powder, turmeric powder, cumin powder and garam masala powder, add some water and grind it. Now heat oil in a pan. Add celery, fennel and ground spices to it. Let it cook for 2 minutes. After 2 minutes add capsicum to it, mix and cook for 3 to 4 minutes. After 4 minutes, add tomato puree, some water and cover the pan. Let it cook for 5 to 7 minutes. After 7 minutes add paneer, kasuri methi and salt. Mix and let it cook for 2 to 3 minutes. After 3 minutes, turn off the gas and garnish with green coriander. Serve Achari Paneer with Dal Fry, Phulka and Cumin Rice for dinner.",https://www.archanaskitchen.com/spicy-pickled-paneer-gravy-recipe-in-hindi
1168,Grilled Herring With Kasundi Mustard And Wild Celery Recipe,Grilled Herring With Kasundi Mustard And Wild Celery Recipe,"4 Herring Fish Steaks,1 teaspoon Ginger Garlic Paste,2 tablespoons Apple cider vinegar,1 tablespoon Extra Virgin Olive Oil,1/2 teaspoon Celery - (wild celery),1 tablespoon Kasundi mustard sauce,1 teaspoon Lemon juice,Salt - to taste,1 teaspoon Red Chilli flakes","4 Herring Fish Steaks,1 teaspoon Ginger Garlic Paste,2 tablespoons Apple cider vinegar,1 tablespoon Extra Virgin Olive Oil,1/2 teaspoon Celery - (wild celery),1 tablespoon Kasundi mustard sauce,1 teaspoon Lemon juice,Salt - to taste,1 teaspoon Red Chilli flakes",10,10,20,4,Continental,Dinner,High Protein Non Vegetarian,"To begin making Grilled Herring With Kasundi Mustard And Wild Celery Recipe, in a mixing bowl, mix all the ingredients mentioned under marinade.Rub the fish steaks with the marinade well and keep for 1-2 hours in the refrigerator. Heat the cast iron grill pan to smoking hot then place the fish and grill on both sides till done. Takes about 10 minutes on medium heat.Serve Grilled Herring With Kasundi Mustard And Wild Celery Recipe along with Roasted Mushroom Zucchini Salad Recipe with Goat Cheese and a Red Wine Sangria Cocktail Recipe for a quiet weekend meal with your family members.
","To begin making Grilled Herring With Kasundi Mustard And Wild Celery Recipe, in a mixing bowl, mix all the ingredients mentioned under marinade.Rub the fish steaks with the marinade well and keep for 1-2 hours in the refrigerator. Heat the cast iron grill pan to smoking hot then place the fish and grill on both sides till done. Takes about 10 minutes on medium heat.Serve Grilled Herring With Kasundi Mustard And Wild Celery Recipe along with Roasted Mushroom Zucchini Salad Recipe with Goat Cheese and a Red Wine Sangria Cocktail Recipe for a quiet weekend meal with your family members.",http://www.archanaskitchen.com/grilled-herring-with-kasundi-mustard-and-wild-celery-recipe
1169,Creamy Coconut Poached Pears Recipe,Creamy Coconut Poached Pears Recipe,"250 ml Coconut milk,1 tablespoon Coconut Sugar,2 Pears,1/2 inch Cinnamon Stick (Dalchini),1 Cardamom (Elaichi) Pods/Seeds,1 tablespoon Slivered Almonds (Badam)","250 ml Coconut milk,1 tablespoon Coconut Sugar,2 Pears,1/2 inch Cinnamon Stick (Dalchini),1 Cardamom (Elaichi) Pods/Seeds,1 tablespoon Slivered Almonds (Badam)",20,30,50,4,Continental,Dessert,Vegan,"To begin making Creamy Coconut Poached Pears Recipe, we will first get the fruit ready for poaching.eel the skin of pears keeping the stem. Place the coconut milk, sugar, cinnamon and cardamon in a saucepan over low heat.Peel the skin of pears, keeping the stem. Place the coconut milk, sugar, cinnamon and cardamon in a saucepan over low heat.When the coconut milk is warm add the pears with shaved almonds and cook for about 20 minutes, stirring the pear just once. Take care not to let the coconut milk come to a boil. After about 20 minutes, when you notice the pulp of the pear lightly softened, turn off the heat.Place the Poached Pear on the serving platter and pour the spiced creamy coconut sauce over the pears. Top it off with slivered almonds.You can serve the Creamy Coconut Poached Pears warm or cold. If you plan to serve it chilled, then allow the poached pears to cool down and the chill the creamy coconut sauce in the refrigerator. Once you are ready to serve, plate the pear and pour the sauce over. 
","To begin making Creamy Coconut Poached Pears Recipe, we will first get the fruit ready for poaching.eel the skin of pears keeping the stem. Place the coconut milk, sugar, cinnamon and cardamon in a saucepan over low heat.Peel the skin of pears, keeping the stem. Place the coconut milk, sugar, cinnamon and cardamon in a saucepan over low heat.When the coconut milk is warm add the pears with shaved almonds and cook for about 20 minutes, stirring the pear just once. Take care not to let the coconut milk come to a boil. After about 20 minutes, when you notice the pulp of the pear lightly softened, turn off the heat.Place the Poached Pear on the serving platter and pour the spiced creamy coconut sauce over the pears. Top it off with slivered almonds.You can serve the Creamy Coconut Poached Pears warm or cold. If you plan to serve it chilled, then allow the poached pears to cool down and the chill the creamy coconut sauce in the refrigerator. Once you are ready to serve, plate the pear and pour the sauce over. ",https://www.archanaskitchen.com/creamy-coconut-poached-pears-recipe
1170,Mutton Dak Bungalow Curry Recipe,Mutton Dak Bungalow Curry Recipe,"500 grams Mutton - bones,3 tablespoons Curd (Dahi / Yogurt),2 tablespoons Ginger Garlic Paste,1 teaspoon Red Chilli powder,1 teaspoon Kashmiri Red Chilli Powder,1/2 teaspoon Turmeric powder (Haldi),2 tablespoons Mustard oil,4 Whole Eggs - hard boiled,4 Potatoes (Aloo) - small,3 tablespoons Mustard oil,1 tablespoon Ghee,1/2 teaspoon Radhuni - special bengali spice (optional),1/3 teaspoon Methi Leaves (Fenugreek Leaves),1 Bay leaf (tej patta),1 Onion - sliced,Tomato - sliced,1 teaspoon Ginger - paste,1-1/12 teaspoon Garlic - paste,Salt - to taste,1 inch Cinnamon Stick (Dalchini),3 Cardamom (Elaichi) Pods/Seeds,1 Black cardamom (Badi Elaichi),1 Mace (Javitri) - blade,1/4 teaspoon Nutmeg powder,1 teaspoon Cumin seeds (Jeera),1 tablespoon Coriander (Dhania) Seeds,2 Green Chillies - as per taste,Dry Red Chilli - as per taste,4 Whole Black Peppercorns","500 grams Mutton - bones,3 tablespoons Curd (Dahi / Yogurt),2 tablespoons Ginger Garlic Paste,1 teaspoon Red Chilli powder,1 teaspoon Kashmiri Red Chilli Powder,1/2 teaspoon Turmeric powder (Haldi),2 tablespoons Mustard oil,4 Whole Eggs - hard boiled,4 Potatoes (Aloo) - small,3 tablespoons Mustard oil,1 tablespoon Ghee,1/2 teaspoon Radhuni - special bengali spice (optional),1/3 teaspoon Methi Leaves (Fenugreek Leaves),1 Bay leaf (tej patta),1 Onion - sliced,Tomato - sliced,1 teaspoon Ginger - paste,1-1/12 teaspoon Garlic - paste,Salt - to taste,1 inch Cinnamon Stick (Dalchini),3 Cardamom (Elaichi) Pods/Seeds,1 Black cardamom (Badi Elaichi),1 Mace (Javitri) - blade,1/4 teaspoon Nutmeg powder,1 teaspoon Cumin seeds (Jeera),1 tablespoon Coriander (Dhania) Seeds,2 Green Chillies - as per taste,Dry Red Chilli - as per taste,4 Whole Black Peppercorns",480,60,540,2,Indian,Dinner,Non Vegeterian,"To begin making the Mutton Dak Bungalow Curry recipe, we will first marinate the mutton.Take the goat meat under the water at room temperature, and clean very well. Now put the meat in a large pasta strainer for 30 minutes to drain all the excess water.Now put the clean meat in a large bowl, add sour curd, ginger garlic paste, red chili powder, kashmiri red chili powder, turmeric powder & mustard oil and marinate all together very well.Rub the pieces of meat with the marination. Cover the pan and leave the marinated meat for overnight or 6-8 hours.Remove the marinated meat 2 hours before cooking.In the meantime make the ""special spice powder"" by dry grinding all the ingredients under the heading of ""Special Spice Powder"", in a spice grinder. Pour the ""Special Spice Powder"" in an airtight container and keep aside.The next step is to prepare the gravy. Take the boiled egg and prick the skin of the egg to prevent from bursting while frying. Now marinate the boiled eggs and potatoes with some salt and turmeric powder and keep aside for 10 minutes.Heat oil and ghee in a large non-stick pan, fry the marinated eggs and potatoes till they are golden brown, take them out of the pan and keep aside.Now in the same pan add Bay leaf, Radhuni & Methi and fry for a few seconds, but be careful, do not let the Methi burn. Add sliced onion and some salt and cover the pan for 2 minutes.Open the lid after 2 minutes and fry the onion till golden brown. Add ginger garlic paste to the pan and fry again for 1 minutes. Add sliced tomatoes and fry till the tomatoes are pulpy.Now add the marinated meat and the ""special spice powder"" to the pan and cover it for 5 minutes. After 5 minutes open the lid, and start frying on medium heat for 30 minutes.If the masala starts burning at the bottom, sprinkle some water and again fry. Add the fried potatoes to the pan and 2 cups of water.Here you can cook the meat in Pressure Cooker or in the same pan. If you are using a pressure cooker, then add all the meat along with the spices into the cooker, close the lid and cook for 10 minutes or upto 4 whistles.Let release all the pressures of the cooker by itself, and open the cooker and add the fried eggs now. Boil the curry for 5 minutes and turn off the heat and serve with plain rice and cucumber salad.ORIf you are cooking the meat in the pan, then cover the pan, lower the heat and let the gravy boil for 20-30 minutes or till the meat is soft and tender. When the meat is well cooked, open the lid and serve hot.Serve Mutton Dak Bungalow along with Phulka and Jeera Rice for a weekday meal.
","To begin making the Mutton Dak Bungalow Curry recipe, we will first marinate the mutton.Take the goat meat under the water at room temperature, and clean very well. Now put the meat in a large pasta strainer for 30 minutes to drain all the excess water.Now put the clean meat in a large bowl, add sour curd, ginger garlic paste, red chili powder, kashmiri red chili powder, turmeric powder & mustard oil and marinate all together very well.Rub the pieces of meat with the marination. Cover the pan and leave the marinated meat for overnight or 6-8 hours.Remove the marinated meat 2 hours before cooking.In the meantime make the ""special spice powder"" by dry grinding all the ingredients under the heading of ""Special Spice Powder"", in a spice grinder. Pour the ""Special Spice Powder"" in an airtight container and keep aside.The next step is to prepare the gravy. Take the boiled egg and prick the skin of the egg to prevent from bursting while frying. Now marinate the boiled eggs and potatoes with some salt and turmeric powder and keep aside for 10 minutes.Heat oil and ghee in a large non-stick pan, fry the marinated eggs and potatoes till they are golden brown, take them out of the pan and keep aside.Now in the same pan add Bay leaf, Radhuni & Methi and fry for a few seconds, but be careful, do not let the Methi burn. Add sliced onion and some salt and cover the pan for 2 minutes.Open the lid after 2 minutes and fry the onion till golden brown. Add ginger garlic paste to the pan and fry again for 1 minutes. Add sliced tomatoes and fry till the tomatoes are pulpy.Now add the marinated meat and the ""special spice powder"" to the pan and cover it for 5 minutes. After 5 minutes open the lid, and start frying on medium heat for 30 minutes.If the masala starts burning at the bottom, sprinkle some water and again fry. Add the fried potatoes to the pan and 2 cups of water.Here you can cook the meat in Pressure Cooker or in the same pan. If you are using a pressure cooker, then add all the meat along with the spices into the cooker, close the lid and cook for 10 minutes or upto 4 whistles.Let release all the pressures of the cooker by itself, and open the cooker and add the fried eggs now. Boil the curry for 5 minutes and turn off the heat and serve with plain rice and cucumber salad.ORIf you are cooking the meat in the pan, then cover the pan, lower the heat and let the gravy boil for 20-30 minutes or till the meat is soft and tender. When the meat is well cooked, open the lid and serve hot.Serve Mutton Dak Bungalow along with Phulka and Jeera Rice for a weekday meal.",https://www.archanaskitchen.com/mutton-dak-bungalow-curry-recipe
